question,answer,question_type,page
Bu metnin amacı nedir?,"Bu metnin amacı, verilen metinden yüksek kaliteli soru-cevap çiftleri oluşturmaktır.",Olgusal,151
Soru-cevap çiftleri oluşturulurken nelere dikkat edilmelidir?,"Soru-cevap çiftleri oluşturulurken dil tutarlılığı, soru çeşitliliği, zorluk dengesi, yanıt hassasiyeti, bağlam farkındalığı ve tekrardan kaçınmaya dikkat edilmelidir.",Yöntemsel,151
Neden farklı türde sorular oluşturulması önemlidir?,"Farklı türde sorular oluşturulması, içeriğin farklı açılardan anlaşılmasını sağlamak ve daha kapsamlı bir öğrenme deneyimi sunmak için önemlidir.",Kavramsal,151
Yanıt hassasiyeti neden önemlidir ve nelere dikkat edilmelidir?,"Yanıt hassasiyeti, sağlanan içeriğe dayalı özlü ve doğru yanıtlar verilmesini sağlar. Yanıtlar çok kısa olmamalı, cevabı açıkça açıklamak için yeterli bağlam vermelidir.",Nedensel,151
Bağlam farkındalığı ne anlama gelir ve neden önemlidir?,"Bağlam farkındalığı, soruların verilen metnin içeriğine derinlemesine kök saldığından ve materyalin amacını ve nüanslarını anladığından emin olmayı ifade eder. Bu, soruların ve cevapların metnin anlamıyla uyumlu olmasını sağlar.",Kavramsal,151
Tekrardan kaçınmanın önemi nedir?,"Tekrardan kaçınmanın önemi, soruların belirgin ve benzersiz olmasını sağlamaktır. Bu, gereksiz tekrarı önler ve öğrenme sürecini daha verimli hale getirir.",Nedensel,151
Olgusal sorulara bir örnek verin.,"""X ne anlama gelir?"" olgusal bir soruya örnektir. Bu tür sorular belirli bilgileri sorar.",Örnekleme,151
"""X olursa ne olur?"" ne tür bir sorudur?","""X olursa ne olur?"" varsayımsal bir sorudur. Bu tür sorular hayal edilen senaryolara dayanır.",Analitik,151
Soru-cevap çiftleri oluştururken zorluk dengesi nasıl sağlanmalıdır?,"Soru-cevap çiftleri oluştururken basit, orta ve karmaşık sorular dahil edilerek zorluk dengesi sağlanmalıdır.",Yöntemsel,151
Metinde belirtilen soru türlerinden hangisi bir konunun kısa bir özetini sorar?,"Özetleme sorusu, bir konunun kısa bir özetini veya ana noktalarını sorar.",Olgusal,151
Bu metnin temel amacı nedir?,"Bu metnin temel amacı, verilen bir metin için yüksek kaliteli soru-cevap çiftleri oluşturulmasını sağlamaktır. Bu çiftler, farklı soru türlerini içermeli ve metnin içeriğine uygun olmalıdır.",Olgusal,152
Soru-cevap çiftleri oluşturulurken nelere dikkat edilmelidir?,"Soru-cevap çiftleri oluşturulurken dil tutarlılığı, soru çeşitliliği, zorluk dengesi, yanıt hassasiyeti, bağlam farkındalığı ve tekrardan kaçınmaya dikkat edilmelidir.",Yöntemsel,152
Neden farklı soru türleri dahil edilmelidir?,"Farklı soru türleri (olgusal, kavramsal, bağlamsal vb.) dahil edilmelidir çünkü bu, metnin farklı yönlerini keşfetmeyi ve daha kapsamlı bir anlayış elde etmeyi sağlar.",Kavramsal,152
Yanıt hassasiyeti neden önemlidir?,"Yanıt hassasiyeti önemlidir çünkü doğru ve özlü yanıtlar, bilginin etkili bir şekilde aktarılmasını ve anlaşılmasını sağlar. Aşırı kısa yanıtlardan kaçınılmalı, ancak cevap açıkça açıklanmalıdır.",Kavramsal,152
Bağlam farkındalığı ne anlama gelir ve neden gereklidir?,"Bağlam farkındalığı, soruların ve cevapların verilen metnin içeriğine derinlemesine bağlı olması ve materyalin amacını anlaması anlamına gelir. Bu, alakasız veya yanlış yorumlanmış soruları önlemek için gereklidir.",Kavramsal,152
Tekrardan kaçınmanın önemi nedir?,"Tekrardan kaçınmanın önemi, gereksiz tekrarı önleyerek soru-cevap çiftlerinin verimliliğini ve değerini artırmaktır. Her sorunun benzersiz bir bakış açısı sunması amaçlanır.",Kavramsal,152
"Metin Türkçe ise, soru-cevap çiftleri hangi dilde olmalıdır?","Eğer metin Türkçe ise, sorular ve cevaplar da Türkçe olmalıdır. Dil tutarlılığı sağlanmalıdır.",Olgusal,152
Soru-cevap çiftleri hangi formatta sunulmalıdır?,"Soru-cevap çiftleri JSON formatında sunulmalıdır. Her çiftin soru, cevap ve soru_türü alanlarını içermesi gerekmektedir.",Olgusal,152
Diyelim ki metin karmaşık bir konuyu ele alıyor. Bu durumda zorluk dengesi nasıl sağlanmalıdır?,"Metin karmaşık bir konuyu ele alıyorsa, basit, orta ve karmaşık sorular dengeli bir şekilde dahil edilmelidir. Bu, farklı seviyelerdeki okuyucuların konuyu anlamasına yardımcı olur.",Varsayımsal,152
Soru-cevap çiftleri oluşturma sürecinde hangi adımlar izlenir?,"Soru-cevap çiftleri oluşturma sürecinde öncelikle metin dikkatlice okunur, ardından farklı soru türleri belirlenir, sorular ve cevaplar oluşturulur, dil tutarlılığı ve doğruluk kontrol edilir ve son olarak JSON formatında sunulur.",Yöntemsel,152
Bu görevde yapay zekadan ne oluşturması istenmektedir?,Yapay zekadan yüksek kaliteli soru-cevap çiftleri oluşturması istenmektedir.,Olgusal,153
Soru-cevap çiftleri oluşturulurken dil tutarlılığı neden önemlidir?,"Dil tutarlılığı, soruların ve cevapların metnin diliyle aynı olmasını sağlayarak anlaşılabilirliği ve erişilebilirliği artırır.",Kavramsal,153
Bu görevde kaç adet soru-cevap çifti oluşturulması istenmektedir?,Bu görevde 10 adet soru-cevap çifti oluşturulması istenmektedir.,Olgusal,153
Hangi soru türleri oluşturulmalıdır?,"Olgusal, kavramsal, bağlamsal, nedensel, yöntemsel, analitik, varsayımsal, yansıtıcı, spekülatif, listeleme ve özetleme gibi farklı türlerde sorular oluşturulmalıdır.",Listeleme,153
Yanıtlar nasıl olmalıdır?,"Yanıtlar, sağlanan içeriğe dayalı özlü ve doğru olmalıdır. Ayrıca, cevabı açıkça açıklamak için yeterli bağlam verilmelidir.",Yöntemsel,153
Neden 'Evet' veya 'Hayır' gibi kısa yanıtlardan kaçınılmalıdır?,'Evet' veya 'Hayır' gibi kısa yanıtlardan kaçınılmalıdır çünkü bu tür yanıtlar bilginin ardındaki gerekçeyi anlamak için gerekli bağlamı sağlamaz.,Nedensel,153
Bağlam farkındalığı neden önemlidir?,"Bağlam farkındalığı, soruların verilen metnin içeriğine derinlemesine kök salmasını ve materyalin amacını ve nüanslarını anlamasını sağlar.",Kavramsal,153
Bu görevdeki soru-cevap çiftleri oluşturma sürecinin temel amacı nedir?,"Bu görevdeki temel amaç, verilen metni anlamayı ve metinden çıkarılabilecek çeşitli bilgileri farklı soru türleriyle test etmektir.",Özetleme,153
Soru-cevap çiftleri oluşturulurken nelere dikkat edilmelidir?,"Soru-cevap çiftleri oluşturulurken dil tutarlılığına, soru çeşitliliğine, zorluk dengesine, yanıt hassasiyetine, bağlam farkındalığına ve tekrardan kaçınmaya dikkat edilmelidir.",Yöntemsel,153
Eğer yapay zeka metnin içeriği hakkında yeterli bilgiye sahip değilse ne yapmalıdır?,"Yapay zeka metnin içeriği hakkında yeterli bilgiye sahip değilse, metni daha dikkatli incelemeli ve içeriği anlamak için ek araştırmalar yapmalıdır.",Varsayımsal,153
Bu görevin amacı nedir?,"Bu görevin amacı, verilen metinden yüksek kaliteli çeşitli soru-cevap çiftleri oluşturmaktır.",Olgusal,154
Soru-cevap çiftleri oluşturulurken hangi hususlara dikkat edilmelidir?,"Soru-cevap çiftleri oluşturulurken dil tutarlılığı, soru çeşitliliği, zorluk dengesi, yanıt hassasiyeti, bağlam farkındalığı ve tekrardan kaçınma gibi hususlara dikkat edilmelidir.",Yöntemsel,154
Neden farklı türde sorular oluşturmak önemlidir?,"Farklı türde sorular oluşturmak, metnin çeşitli yönlerini ve derinliğini anlamayı sağlamak için önemlidir. Bu, içeriğin daha kapsamlı bir şekilde ele alınmasına ve öğrencinin farklı düşünme becerilerini geliştirmesine yardımcı olur.",Kavramsal,154
Yanıt hassasiyeti neden önemlidir ve nasıl sağlanmalıdır?,"Yanıt hassasiyeti, verilen içeriğe dayalı özlü ve doğru yanıtlar sağlamak için önemlidir. Bu, cevabı açıkça açıklamak için yeterli bağlam verirken, gereksiz ayrıntılardan kaçınarak sağlanabilir.",Kavramsal,154
Bağlam farkındalığı neden gereklidir?,"Bağlam farkındalığı, soruların verilen metnin içeriğine derinlemesine kök salmasını ve materyalin amacını ve nüanslarını anlamasını sağlamak için gereklidir.",Kavramsal,154
Tekrardan kaçınmanın önemi nedir?,"Tekrardan kaçınmak, her sorunun belirgin ve benzersiz olmasını sağlayarak, bilginin tekrarından kaynaklanan sıkıcılığı önler ve öğrenme deneyimini daha verimli hale getirir.",Kavramsal,154
Hangi soru türleri oluşturulmalıdır?,"Olgusal, kavramsal, bağlamsal, nedensel, yöntemsel, analitik, varsayımsal, yansıtıcı, spekülatif, listeleme ve özetleme gibi farklı soru türleri oluşturulmalıdır.",Listeleme,154
Dil tutarlılığı neden önemlidir?,"Dil tutarlılığı, soruların ve cevapların verilen metnin diliyle aynı olmasını sağlayarak, anlaşılabilirliği artırır ve karışıklığı önler.",Kavramsal,154
Zorluk dengesi nasıl sağlanmalıdır?,"Zorluk dengesi, basit, orta ve karmaşık soruları dahil ederek sağlanmalıdır. Bu, farklı bilgi seviyelerine sahip kişilerin içeriği anlamasına yardımcı olur.",Yöntemsel,154
Soru-cevap çiftleri oluşturulurken neden 'Evet' veya 'Hayır' gibi kısa cevaplardan kaçınılmalıdır?,"'Evet' veya 'Hayır' gibi kısa cevaplardan kaçınılmalıdır çünkü bu tür cevaplar, bilginin ardındaki gerekçeyi anlamak için gerekli bağlamı sağlamaz ve öğrenmeyi kısıtlar.",Nedensel,154
Bu metnin temel amacı nedir?,"Bu metnin temel amacı, verilen bir metinden yüksek kaliteli soru-cevap çiftleri oluşturmaktır.",Olgusal,155
Neden farklı türlerde sorular oluşturmak önemlidir?,"Farklı türlerde sorular oluşturmak, metnin anlaşılmasını derinleştirmeye ve farklı açılardan ele almaya yardımcı olur.",Kavramsal,155
Soru-cevap çiftleri oluşturulurken nelere dikkat edilmelidir?,"Soru-cevap çiftleri oluşturulurken dil tutarlılığı, soru çeşitliliği, zorluk dengesi, yanıt hassasiyeti, bağlam farkındalığı ve tekrardan kaçınmaya dikkat edilmelidir.",Yöntemsel,155
Yanıt hassasiyeti neden önemlidir?,"Yanıt hassasiyeti, verilen içeriğe dayalı olarak özlü ve doğru yanıtlar verilmesini sağlar, böylece bilginin ardındaki gerekçe anlaşılır.",Nedensel,155
Bağlam farkındalığı ne anlama gelir ve neden önemlidir?,"Bağlam farkındalığı, soruların verilen metnin içeriğine derinlemesine kök salmış olmasını ve materyalin amacını ve nüanslarını anlamasını ifade eder. Metnin doğru anlaşılması için önemlidir.",Kavramsal,155
Tekrardan kaçınmanın önemi nedir?,"Tekrardan kaçınmak, her sorunun belirgin ve benzersiz olmasını sağlayarak, içeriğin daha verimli ve kapsamlı bir şekilde ele alınmasına yardımcı olur.",Nedensel,155
Olgusal sorulara bir örnek verin.,"""X ne anlama gelir?"" sorusu olgusal bir sorudur.",Olgusal,155
"""X, Y ile nasıl karşılaştırılır?"" ne tür bir sorudur?","""X, Y ile nasıl karşılaştırılır?"" analitik bir sorudur.",Analitik,155
Metinde belirtilen soru türlerinden hangileri fikir tabanlıdır?,Metinde belirtilen soru türlerinden spekülatif sorular fikir tabanlıdır.,Olgusal,155
Varsayımsal soruların amacı nedir?,"Varsayımsal soruların amacı, hayal edilen senaryolara dayalı sorular sorarak konunun farklı boyutlarını keşfetmektir.",Kavramsal,155
