question,answer,question_type,page
Bu metnin temel amacı nedir?,"Bu metnin temel amacı, verilen bir metin için yüksek kaliteli soru-cevap çiftleri oluşturmaktır.",Olgusal,96
Soru-cevap çiftleri oluşturulurken hangi dil kuralına uyulmalıdır?,"Soruların ve cevapların, verilen metnin diliyle aynı olması gerekmektedir.",Yöntemsel,96
Neden farklı türlerde sorular sorulması önemlidir?,"Farklı türlerde sorular (olgusal, kavramsal, bağlamsal vb.) sormak, içeriğin daha kapsamlı bir şekilde anlaşılmasını sağlar ve farklı düşünme biçimlerini teşvik eder.",Kavramsal,96
Oluşturulacak soru türlerinden birkaçını örneklerle açıklayınız.,Olgusal sorular belirli bilgileri sorar (örn. 'X ne anlama gelir?'). Kavramsal sorular içeriğin ardındaki fikirleri araştırır (örn. 'X neden önemlidir?'). Bağlamsal sorular konunun daha geniş bağlamını sorar (örn. 'X hangi bağlamda belirtilmiştir?'),Olgusal,96
Cevapların çok kısa olmaması neden önemlidir?,"Cevapların çok kısa olmaması, bilginin ardındaki gerekçeyi anlamak için gerekli bağlamı sağlaması açısından önemlidir. Sadece 'Evet' veya 'Hayır' gibi cevaplar yeterli açıklama sunmaz.",Kavramsal,96
Sağlanan içeriğe dayalı yanıtların doğruluğu neden önemlidir?,"Sağlanan içeriğe dayalı yanıtların doğruluğu, yanlış veya yanıltıcı bilgilerin yayılmasını önlemek ve kullanıcıların güvenilir bilgiye erişmesini sağlamak için önemlidir.",Kavramsal,96
Tekrardan kaçınmanın önemi nedir?,"Tekrardan kaçınmak, oluşturulan soruların ve cevapların daha verimli ve bilgilendirici olmasını sağlar. Benzersiz sorular, içeriğin farklı yönlerini ele alarak daha geniş bir anlayış sunar.",Kavramsal,96
Soru-cevap çiftlerinde hangi zorluk seviyeleri bulunmalıdır?,"Soru-cevap çiftlerinde basit, orta ve karmaşık zorluk seviyeleri bulunmalıdır. Bu, farklı bilgi seviyelerine sahip kullanıcıların içeriği anlamasına yardımcı olur.",Yöntemsel,96
"Eğer bu metin farklı bir dilde olsaydı, soru-cevap çiftleri nasıl oluşturulurdu?","Eğer metin farklı bir dilde olsaydı, soru-cevap çiftleri yine aynı dilde oluşturulurdu. Dil tutarlılığı, metnin amacını ve anlamını doğru bir şekilde yansıtmak için önemlidir.",Varsayımsal,96
Bu metindeki talimatlara uyulmamasının olası sonuçları nelerdir?,"Bu metindeki talimatlara uyulmaması, düşük kaliteli, tutarsız veya yanlış bilgi içeren soru-cevap çiftlerinin oluşturulmasına yol açabilir. Bu durum, kullanıcıların içeriği anlamasını zorlaştırabilir ve güvenilirliği azaltabilir.",Yansıtıcı,96
Soru-cevap çifti oluşturma görevinin temel amacı nedir?,"Soru-cevap çifti oluşturma görevinin temel amacı, verilen metinden yola çıkarak yüksek kaliteli ve çeşitli soru-cevap çiftleri üretmektir.",Olgusal,97
Oluşturulacak soru türleri nelerdir ve neden bu kadar çeşitlilik önemlidir?,"Oluşturulacak soru türleri olgusal, kavramsal, bağlamsal, nedensel, yöntemsel, analitik, varsayımsal, yansıtıcı, spekülatif, listeleme ve özetleme gibi farklı türleri içerir. Bu çeşitlilik, metnin farklı yönlerini ve derinliklerini kapsayarak daha kapsamlı bir öğrenme deneyimi sağlar.",Kavramsal,97
"Dil tutarlılığı neden önemlidir ve bu, soru-cevap çiftlerini nasıl etkiler?","Dil tutarlılığı önemlidir çünkü soruların ve cevapların metnin orijinal dilinde olmasını sağlayarak anlaşılabilirliği ve erişilebilirliği artırır. Bu, öğrenenin metni daha kolay anlamasına ve öğrenmesine yardımcı olur.",Nedensel,97
Yanıtların 'Evet' veya 'Hayır' gibi kısa olmasından neden kaçınılmalıdır?,"'Evet' veya 'Hayır' gibi kısa yanıtlardan kaçınılmalıdır çünkü bu tür yanıtlar, bilginin ardındaki gerekçeyi anlamak için gerekli bağlamı sağlamaz ve öğrenme deneyimini kısıtlar.",Nedensel,97
"Bağlam farkındalığı neden gereklidir ve bu, soru oluşturma sürecini nasıl etkiler?","Bağlam farkındalığı gereklidir çünkü soruların verilen metnin içeriğine derinlemesine kök salmasını ve materyalin amacını ve nüanslarını anlamasını sağlar. Bu, daha alakalı ve anlamlı sorular oluşturmaya yardımcı olur.",Kavramsal,97
"Tekrardan kaçınmanın önemi nedir ve bu, soru-cevap çiftlerinin kalitesini nasıl etkiler?","Tekrardan kaçınmanın önemi, her sorunun belirgin ve benzersiz olmasını sağlayarak gereksiz tekrarı önlemek ve öğrenme sürecini daha verimli hale getirmektir. Bu, soru-cevap çiftlerinin kalitesini artırır.",Analitik,97
Metinde belirtilen farklı soru türlerine birer örnek verin.,"Olgusal: 'X ne anlama gelir?', Kavramsal: 'X neden önemlidir?', Bağlamsal: 'X hangi bağlamda belirtilmiştir?', Nedensel: 'X'e ne sebep olur?', Yöntemsel: 'X nasıl başarılır?', Analitik: 'X, Y ile nasıl karşılaştırılır?', Varsayımsal: 'X olursa ne olur?', Yansıtıcı: 'X'in hangi etkileri vardır?', Spekülatif: 'Neden birisi X'e katılmayabilir?', Listeleme: 'X'in temel unsurları nelerdir?', Özetleme: 'X'ten çıkarılacak ana ders nedir?'",Listeleme,97
Sağlanan yanıtların 'özlü' olması ne anlama gelir ve bu neden önemlidir?,"Yanıtların 'özlü' olması, cevabı açıkça açıklamak için yeterli bağlam verirken gereksiz ayrıntılardan kaçınılması anlamına gelir. Bu önemlidir çünkü öğrencinin bilgiyi daha hızlı ve verimli bir şekilde özümsemesine yardımcı olur.",Kavramsal,97
Soru-cevap çiftleri oluşturulurken zorluk dengesi nasıl sağlanmalıdır?,"Soru-cevap çiftleri oluşturulurken basit, orta ve karmaşık sorular dahil edilerek zorluk dengesi sağlanmalıdır. Bu, farklı bilgi seviyelerine sahip öğrencilere hitap etmeyi ve öğrenme sürecini daha etkili hale getirmeyi amaçlar.",Yöntemsel,97
Varsayımsal sorular oluşturmanın amacı nedir ve bu tür sorular öğrenme sürecine nasıl katkıda bulunur?,"Varsayımsal sorular oluşturmanın amacı, hayal edilen senaryolara dayalı sorular sorarak öğrencinin düşünme becerilerini geliştirmek ve farklı olasılıkları değerlendirmesine olanak tanımaktır. Bu tür sorular, öğrenme sürecine derinlik ve esneklik katar.",Kavramsal,97
Bu belgenin temel amacı nedir?,"Bu belgenin temel amacı, verilen metinden yüksek kaliteli soru-cevap çiftleri oluşturulmasını sağlamaktır.",Olgusal,98
Neden farklı soru türleri dahil edilmelidir?,"Farklı soru türleri (olgusal, kavramsal, bağlamsal vb.) dahil edilmelidir çünkü bu, metnin kapsamlı bir şekilde anlaşılmasını sağlar ve çeşitli öğrenme stillerine hitap eder.",Kavramsal,98
Dil tutarlılığı neden önemlidir?,"Dil tutarlılığı, soruların ve cevapların metnin diliyle aynı olmasını sağlayarak anlaşılabilirliği ve erişilebilirliği artırır.",Nedensel,98
Hangi soru türleri bu belgede belirtilmiştir?,"Bu belgede belirtilen soru türleri şunlardır: Olgusal, Kavramsal, Bağlamsal, Nedensel, Yöntemsel, Analitik, Varsayımsal, Yansıtıcı, Spekülatif, Listeleme ve Özetleme.",Listeleme,98
"""Evet"" veya ""Hayır"" gibi kısa cevaplardan neden kaçınılmalıdır?","""Evet"" veya ""Hayır"" gibi kısa cevaplardan kaçınılmalıdır çünkü bu tür cevaplar genellikle yeterli bağlam sağlamaz ve bilginin tam olarak anlaşılmasını engeller.",Nedensel,98
Soru-cevap çiftlerinin zorluk seviyesi nasıl olmalıdır?,"Soru-cevap çiftlerinin zorluk seviyesi basit, orta ve karmaşık soruları içerecek şekilde dengelenmelidir.",Yöntemsel,98
Bağlam farkındalığı neden önemlidir?,"Bağlam farkındalığı, soruların verilen metnin içeriğine derinlemesine kök salmasını ve materyalin amacını ve nüanslarını anlamasını sağlar.",Kavramsal,98
"Eğer metin bilimsel bir makale olsaydı, soru türleri nasıl değişirdi?","Eğer metin bilimsel bir makale olsaydı, soru türleri daha çok analitik, nedensel ve yöntemsel sorulara odaklanırdı. Ayrıca, deneysel sonuçları ve metodolojiyi sorgulayan sorular da daha sık sorulabilirdi.",Varsayımsal,98
Neden soru-cevap çiftlerinde tekrardan kaçınılmalıdır?,"Soru-cevap çiftlerinde tekrardan kaçınılmalıdır çünkü bu, içeriğin verimliliğini artırır ve okuyucunun farklı bakış açılarını keşfetmesini sağlar.",Nedensel,98
Bu talimatlara göre oluşturulan soru-cevap çiftlerinin temel özellikleri nelerdir?,"Bu talimatlara göre oluşturulan soru-cevap çiftlerinin temel özellikleri şunlardır: dil tutarlılığı, soru çeşitliliği, zorluk dengesi, yanıt hassasiyeti, bağlam farkındalığı ve tekrardan kaçınma.",Özetleme,98
Bu görevin amacı nedir?,"Bu görevin amacı, verilen metinden yüksek kaliteli ve çeşitli soru-cevap çiftleri oluşturmaktır.",Olgusal,99
Hangi soru türleri dahil edilmelidir?,"Olgusal, kavramsal, bağlamsal, nedensel, yöntemsel, analitik, varsayımsal, yansıtıcı, spekülatif, listeleme ve özetleme gibi çeşitli soru türleri dahil edilmelidir.",Listeleme,99
Yanıtların uzunluğu nasıl olmalıdır?,Yanıtlar özlü olmalı ancak bilginin ardındaki gerekçeyi anlamak için gerekli bağlamı sağlamalıdır. Aşırı kısa yanıtlardan kaçınılmalıdır.,Yöntemsel,99
Neden soruların ve cevapların dil tutarlılığı önemli?,"Dil tutarlılığı, soruların ve cevapların metnin diliyle aynı olmasını sağlayarak anlaşılabilirliği ve erişilebilirliği artırır.",Kavramsal,99
Soru-cevap çiftlerinde tekrardan kaçınmak neden önemlidir?,"Tekrardan kaçınmak, her sorunun benzersiz olmasını ve farklı bir bilgi parçasını hedeflemesini sağlayarak içeriğin verimliliğini ve kapsamını artırır.",Nedensel,99
Verilen metnin içeriğine derinlemesine kök salmak ne anlama gelir?,"Verilen metnin içeriğine derinlemesine kök salmak, soruların ve cevapların materyalin amacını ve nüanslarını anlamasını, böylece bağlamdan kopuk olmamasını ve alakalı kalmasını sağlamak anlamına gelir.",Bağlamsal,99
Eğer metin İngilizce olsaydı ne değişirdi?,"Eğer metin İngilizce olsaydı, sorular ve cevaplar da İngilizce olarak oluşturulmalıydı. Yani, dil tutarlılığı ilkesi korunmalıydı.",Varsayımsal,99
Farklı zorluk seviyelerinde sorular sormanın faydası nedir?,"Farklı zorluk seviyelerinde sorular sormak, hem temel bilgileri anlamayı hem de daha derinlemesine analiz yeteneklerini geliştirmeyi sağlar. Bu, içeriğin farklı bilgi seviyelerine hitap etmesine yardımcı olur.",Analitik,99
JSON formatında yanıt vermenin amacı nedir?,"JSON formatında yanıt vermenin amacı, verilerin yapılandırılmış ve makine tarafından okunabilir bir şekilde sunulmasını sağlamaktır. Bu, verilerin kolayca işlenmesini ve farklı sistemler arasında paylaşılmasını mümkün kılar.",Yöntemsel,99
Bu görevin çıktıları hangi amaçlarla kullanılabilir?,"Bu görevin çıktıları, eğitim materyalleri oluşturmak, bilgi sistemlerini eğitmek, sık sorulan sorular (SSS) bölümleri hazırlamak veya metin anlama yeteneklerini değerlendirmek gibi çeşitli amaçlarla kullanılabilir.",Yansıtıcı,99
Bu metnin amacı nedir?,"Bu metnin amacı, belirli bir metin için yüksek kaliteli soru-cevap çiftleri oluşturmaktır.",Olgusal,100
Oluşturulacak soru-cevap çiftlerinin sayısı kaçtır?,Oluşturulacak soru-cevap çiftlerinin sayısı 10'dur.,Olgusal,100
Soru ve cevapların hangi dilde olması gerekmektedir?,"Soru ve cevapların, sağlanan metnin diliyle aynı dilde olması gerekmektedir.",Yöntemsel,100
Hangi tür sorular dahil edilmelidir?,"Olgusal, kavramsal, bağlamsal, nedensel, yöntemsel, analitik, varsayımsal, yansıtıcı ve spekülatif gibi farklı türlerde sorular dahil edilmelidir.",Listeleme,100
Yanıtların uzunluğu nasıl olmalıdır?,Yanıtlar özlü olmalı ancak bilginin ardındaki gerekçeyi anlamak için gerekli bağlamı sağlamalıdır. Aşırı kısa yanıtlardan kaçınılmalıdır.,Yöntemsel,100
Neden farklı türde sorular sorulması önemlidir?,"Farklı türde sorular sormak, içeriğin daha kapsamlı bir şekilde anlaşılmasını sağlar ve farklı düşünme becerilerini teşvik eder.",Kavramsal,100
Tekrardan kaçınmanın önemi nedir?,"Tekrardan kaçınmak, her sorunun benzersiz ve anlamlı olmasını sağlayarak, gereksiz sorularla zaman kaybını önler ve içeriğin verimli bir şekilde ele alınmasına yardımcı olur.",Kavramsal,100
Yanıtların doğruluğu ne kadar önemlidir?,Yanıtların doğruluğu son derece önemlidir; sağlanan içeriğe dayalı özlü ve doğru yanıtlar verilmelidir.,Kavramsal,100
JSON formatında yanıt verilmesinin nedeni nedir?,"JSON formatında yanıt verilmesi, verinin yapılandırılmış ve makine tarafından kolayca işlenebilir olmasını sağlar.",Nedensel,100
"Bu görevin amacı, yapay zekanın hangi yeteneklerini geliştirmektir?","Bu görevin amacı, yapay zekanın soru üretme, metin anlama, bilgi çıkarma ve tutarlı yanıtlar oluşturma yeteneklerini geliştirmektir.",Analitik,100
