question,answer,question_type,page
Bu görevin amacı nedir?,"Bu görevin amacı, verilen metin için yüksek kaliteli çeşitli soru-cevap çiftleri oluşturmaktır.",Olgusal,176
Hangi soru türleri dahil edilmelidir?,"Olgusal, kavramsal, bağlamsal, nedensel, yöntemsel, analitik, varsayımsal, yansıtıcı, spekülatif, listeleme ve özetleme gibi farklı türde sorular dahil edilmelidir.",Listeleme,176
Neden 'Evet' veya 'Hayır' gibi aşırı kısa yanıtlardan kaçınılmalıdır?,"'Evet' veya 'Hayır' gibi aşırı kısa yanıtlardan kaçınılmalıdır çünkü yanıt, bilginin ardındaki gerekçeyi anlamak için gerekli bağlamı sağlamalıdır.",Nedensel,176
Soru ve cevapların dil tutarlılığı neden önemlidir?,"Soru ve cevapların dil tutarlılığı önemlidir çünkü sorular ve cevaplar verilen metnin diliyle aynı olmalıdır; bu, anlaşılabilirliği ve tutarlılığı sağlar.",Kavramsal,176
Hangi formatta çıktı verilmelidir?,"Çıktı doğrudan JSON formatında verilmelidir. Markdown işaretleri kullanılmamalıdır ve başka açıklama eklenmemelidir, sadece düz JSON verisi verilmelidir.",Yöntemsel,176
Soru zorluk seviyeleri nasıl olmalıdır?,"Sorular basit, orta ve karmaşık seviyelerde dengelenmelidir.",Yöntemsel,176
Bağlam farkındalığı neden önemlidir?,Bağlam farkındalığı önemlidir çünkü tüm soruların verilen metnin içeriğine derinlemesine kök saldığından ve materyalin amacını ve nüanslarını anladığından emin olunmalıdır.,Kavramsal,176
Tekrardan kaçınmanın nedeni nedir?,"Tekrardan kaçınmanın nedeni, tüm soruların belirgin ve benzersiz olmasını sağlamaktır, bu da bilgi çeşitliliğini ve kapsamlılığını artırır.",Nedensel,176
"Eğer metin İngilizce ise, soru ve cevaplar hangi dilde olmalıdır?","Eğer metin İngilizce ise, soru ve cevaplar da İngilizce olmalıdır.",Varsayımsal,176
Yanıtların hassasiyeti nasıl olmalıdır?,"Yanıtlar sağlanan içeriğe dayalı özlü ve doğru olmalıdır. Ancak, yanıtların çok kısa olmamasına dikkat edilmelidir; cevabı açıkça açıklamak için yeterli bağlam vermelidir.",Analitik,176
Soru-cevap çiftleri oluşturmanın temel amacı nedir?,"Temel amaç, verilen bir metinden insanların sorabileceği çeşitli türlerde sorular üretmek ve bunlara kapsamlı yanıtlar sağlamaktır.",Kavramsal,177
Soru ve cevapların dil tutarlılığı neden önemlidir?,"Dil tutarlılığı, soruların ve cevapların metnin diliyle aynı olmasını sağlayarak anlaşılabilirliği ve erişilebilirliği artırır.",Nedensel,177
Hangi farklı soru türleri oluşturulmalıdır?,"Olgusal, kavramsal, bağlamsal, nedensel, yöntemsel, analitik, varsayımsal, yansıtıcı, spekülatif, listeleme ve özetleme gibi farklı soru türleri oluşturulmalıdır.",Listeleme,177
Neden 'Evet' veya 'Hayır' gibi kısa cevaplardan kaçınılmalıdır?,"'Evet' veya 'Hayır' gibi kısa cevaplardan kaçınılmalıdır çünkü cevap, bilginin ardındaki gerekçeyi anlamak için gerekli bağlamı sağlamalıdır.",Nedensel,177
Bağlam farkındalığı neden önemlidir?,"Bağlam farkındalığı, tüm soruların verilen metnin içeriğine derinlemesine kök salmasını ve materyalin amacını ve nüanslarını anlamasını sağlar.",Kavramsal,177
Oluşturulan soruların zorluk seviyesi nasıl olmalıdır?,"Oluşturulan soruların zorluk seviyesi basit, orta ve karmaşık olmak üzere dengeli olmalıdır.",Olgusal,177
Neden soruların benzersiz olması gerekmektedir?,"Soruların benzersiz olması, gereksiz tekrarlardan kaçınarak içeriğin daha verimli ve etkili bir şekilde ele alınmasını sağlar.",Nedensel,177
Yanıtların hassasiyeti ve doğruluğu nasıl sağlanmalıdır?,"Yanıtların hassasiyeti ve doğruluğu, sağlanan içeriğe dayalı özlü ve doğru bilgiler vererek sağlanmalıdır. Ancak, yanıtlar çok kısa olmamalı, cevabı açıkça açıklamak için yeterli bağlam vermelidir.",Yöntemsel,177
Soru-cevap çifti oluşturma sürecinde nelere dikkat edilmelidir?,"Dil tutarlılığına, soru çeşitliliğine, zorluk dengesine, yanıt hassasiyetine, bağlam farkındalığına ve tekrardan kaçınmaya dikkat edilmelidir.",Özetleme,177
Metinde belirtilen JSON formatının amacı nedir?,"Metinde belirtilen JSON formatının amacı, oluşturulan soru-cevap çiftlerini yapılandırılmış ve makine tarafından okunabilir bir şekilde sunmaktır.",Kavramsal,177
Bu metnin temel amacı nedir?,"Bu metnin temel amacı, verilen bir metinden yüksek kaliteli soru-cevap çiftleri oluşturmak için bir yapay zekayı görevlendirmektir.",Olgusal,178
Yapay zekanın oluşturması gereken soru türleri nelerdir?,"Yapay zekanın olgusal, kavramsal, bağlamsal, nedensel, yöntemsel, analitik, varsayımsal, yansıtıcı, spekülatif, listeleme ve özetleme gibi farklı türlerde sorular oluşturması gerekmektedir.",Listeleme,178
Neden sorular ve cevaplar metnin diliyle aynı olmalıdır?,"Sorular ve cevaplar metnin diliyle aynı olmalıdır çünkü dil tutarlılığı sağlanmalıdır. Bu, anlaşılabilirliği ve tutarlılığı artırır.",Nedensel,178
Yapay zeka oluşturduğu cevaplarda nelere dikkat etmelidir?,"Yapay zeka oluşturduğu cevaplarda özlü ve doğru olmaya, sağlanan içeriğe dayanmaya ve gerekli bağlamı sağlamaya dikkat etmelidir. Ayrıca, cevaplar çok kısa olmamalı ve bilginin ardındaki gerekçeyi anlamak için yeterli bağlam içermelidir.",Yöntemsel,178
Bağlam farkındalığı neden önemlidir?,Bağlam farkındalığı önemlidir çünkü soruların verilen metnin içeriğine derinlemesine kök saldığından ve materyalin amacını ve nüanslarını anladığından emin olunmasını sağlar.,Kavramsal,178
Yapay zeka neden tekrardan kaçınmalıdır?,"Yapay zeka tekrardan kaçınmalıdır çünkü tüm soruların belirgin ve benzersiz olması hedeflenir. Tekrardan kaçınmak, farklı ve değerli soru-cevap çiftleri oluşturulmasını sağlar.",Nedensel,178
Soru-cevap çiftleri oluşturulurken hangi zorluk seviyeleri dikkate alınmalıdır?,"Soru-cevap çiftleri oluşturulurken basit, orta ve karmaşık zorluk seviyeleri dikkate alınmalıdır.",Olgusal,178
Eğer yapay zeka 'Evet' veya 'Hayır' gibi kısa cevaplar verirse ne olur?,"'Evet' veya 'Hayır' gibi aşırı kısa yanıtlardan kaçınılmalıdır. Yanıt, bilginin ardındaki gerekçeyi anlamak için gerekli bağlamı sağlamalıdır.",Varsayımsal,178
Metnin amacı doğrultusunda oluşturulacak soru-cevap çiftlerinin temel özellikleri nelerdir?,"Metnin amacı doğrultusunda oluşturulacak soru-cevap çiftlerinin temel özellikleri, dil tutarlılığı, soru çeşitliliği, zorluk dengesi, yanıt hassasiyeti, bağlam farkındalığı ve tekrardan kaçınmadır.",Özetleme,178
Bu görevin başarıyla tamamlanmasının sonuçları neler olabilir?,"Bu görevin başarıyla tamamlanması, yüksek kaliteli ve çeşitli soru-cevap çiftleri oluşturulmasını sağlar. Bu da metnin daha iyi anlaşılmasına ve öğrenme süreçlerinin geliştirilmesine katkıda bulunabilir.",Yansıtıcı,178
Bu metnin temel amacı nedir?,"Bu metnin temel amacı, verilen bir metinden yüksek kaliteli soru-cevap çiftleri oluşturmak için bir yapay zeka modeline talimat vermektir.",Olgusal,179
Yapay zekanın oluşturması gereken soru-cevap çiftlerinde hangi türde sorular bulunmalıdır?,"Yapay zeka, olgusal, kavramsal, bağlamsal, nedensel, yöntemsel, analitik, varsayımsal, yansıtıcı, spekülatif, listeleme ve özetleme gibi farklı türlerde sorular oluşturmalıdır.",Listeleme,179
Oluşturulan cevapların uzunluğu nasıl olmalıdır?,Cevaplar özlü olmalı ancak konuyu açıkça açıklamak için yeterli bağlamı sağlamalıdır. Aşırı kısa cevaplardan kaçınılmalıdır.,Yöntemsel,179
Neden 'Evet' veya 'Hayır' gibi kısa cevaplardan kaçınılmalıdır?,"'Evet' veya 'Hayır' gibi kısa cevaplardan kaçınılmalıdır çünkü bu tür cevaplar, bilginin ardındaki gerekçeyi anlamak için gerekli bağlamı sağlamaz.",Nedensel,179
Soru-cevap çiftlerinin zorluk seviyesi nasıl olmalıdır?,"Soru-cevap çiftleri basit, orta ve karmaşık zorluk seviyelerinde olmalıdır.",Olgusal,179
Bağlam farkındalığı neden önemlidir?,"Bağlam farkındalığı, soruların verilen metnin içeriğine derinlemesine kök saldığından ve materyalin amacını ve nüanslarını anladığından emin olmak için önemlidir.",Kavramsal,179
Tekrardan kaçınmanın önemi nedir?,"Tekrardan kaçınmak önemlidir çünkü her sorunun belirgin ve benzersiz olmasını sağlar, böylece yapay zeka tarafından üretilen soru-cevap çiftlerinin çeşitliliğini ve kapsamını artırır.",Kavramsal,179
Yapay zeka modelinin hangi dilde soru-cevap çiftleri oluşturması beklenmektedir?,"Yapay zeka modelinin, verilen metnin diliyle aynı dilde soru-cevap çiftleri oluşturması beklenmektedir.",Olgusal,179
"Eğer metin İngilizce olsaydı, soru-cevap çiftleri nasıl olurdu?","Eğer metin İngilizce olsaydı, sorular ve cevaplar da İngilizce olurdu. Örneğin, 'What is the main purpose of this text?' gibi sorular sorulurdu.",Varsayımsal,179
Bu görevin başarılı bir şekilde tamamlanmasının sonuçları neler olabilir?,"Bu görevin başarılı bir şekilde tamamlanması, farklı metin türleri için çeşitli ve yüksek kaliteli soru-cevap çiftleri oluşturabilen daha etkili bir yapay zeka modeliyle sonuçlanabilir. Bu da, eğitim materyallerinin geliştirilmesinde ve bilgiye erişimde büyük fayda sağlayabilir.",Yansıtıcı,179
Soru-cevap çifti oluşturma görevinin temel amacı nedir?,Verilen metinden insanların sorabileceği çeşitli türlerde sorular üretmek ve bunlara kapsamlı yanıtlar sağlamaktır.,Olgusal,180
Soru ve cevapların dil tutarlılığı neden önemlidir?,"Soru ve cevapların dil tutarlılığı, metnin anlaşılabilirliğini ve erişilebilirliğini sağlamak için önemlidir. Soruların ve cevapların aynı dilde olması, okuyucunun bilgiyi daha kolay anlamasına ve özümsemesine yardımcı olur.",Kavramsal,180
Oluşturulacak soru türleri nelerdir?,"Oluşturulacak soru türleri şunlardır: Olgusal, Kavramsal, Bağlamsal, Nedensel, Yöntemsel, Analitik, Varsayımsal, Yansıtıcı, Spekülatif, Listeleme ve Özetleme.",Listeleme,180
Neden 'Evet' veya 'Hayır' gibi kısa cevaplardan kaçınılmalıdır?,'Evet' veya 'Hayır' gibi kısa cevaplardan kaçınılmalıdır çünkü bu tür cevaplar genellikle yeterli bağlam ve açıklama sağlamaz. Cevabın gerekçesini anlamak için gerekli olan bağlamı sağlamak önemlidir.,Nedensel,180
Yanıt hassasiyeti nasıl sağlanmalıdır?,"Yanıt hassasiyeti, sağlanan içeriğe dayalı özlü ve doğru yanıtlar vererek sağlanmalıdır. Ancak, yanıtların çok kısa olmaması ve cevabı açıkça açıklamak için yeterli bağlam içermesi önemlidir.",Yöntemsel,180
Soru-cevap çiftleri oluşturulurken nelere dikkat edilmelidir?,"Soru-cevap çiftleri oluşturulurken dil tutarlılığı, soru çeşitliliği, zorluk dengesi, yanıt hassasiyeti, bağlam farkındalığı ve tekrardan kaçınmaya dikkat edilmelidir.",Özetleme,180
Metnin amacı ve nüansları anlaşılmadan soru oluşturulursa ne olur?,"Metnin amacı ve nüansları anlaşılmadan soru oluşturulursa, sorular anlamsız veya konu dışı olabilir, bu da soru-cevap çiftlerinin kalitesini düşürür.",Varsayımsal,180
Analitik soru türüne bir örnek verin.,"Analitik soru türüne bir örnek: 'X, Y ile nasıl karşılaştırılır?' Bu tür sorular, konuları karşılaştırmayı, karşıtlaştırmayı veya değerlendirmeyi amaçlar.",Olgusal,180
Spekülatif sorular ne tür yanıtlara yol açabilir?,"Spekülatif sorular, fikir tabanlı veya keşifsel yanıtlara yol açabilir. Bu tür sorular, farklı bakış açılarını ve olasılıkları değerlendirmeyi amaçlar.",Yansıtıcı,180
Bağlam farkındalığı neden önemlidir?,"Bağlam farkındalığı, tüm soruların verilen metnin içeriğine derinlemesine kök saldığından ve materyalin amacını ve nüanslarını anladığından emin olmak için önemlidir. Bu, soruların alakalı ve anlamlı olmasını sağlar.",Kavramsal,180
