question,answer,question_type,page
Zeytinin yetişmesi için en uygun iklim hangisidir?,Metinde zeytinin yetişmesi için en uygun iklimin ne olduğu belirtilmemiştir. Bu sorunun cevabı için ek bilgi gereklidir.,Olgusal,126
Ülkemizde zeytinin en çok yetiştirildiği yerler nerelerdir?,Metinde ülkemizde zeytinin en çok yetiştirildiği yerler belirtilmemiştir. Bu sorunun cevabı için ek bilgi gereklidir.,Olgusal,126
Bu iklimde başka hangi ürünler yetiştirilir?,Metinde hangi iklimden bahsedildiği ve bu iklimde hangi ürünlerin yetiştirildiği belirtilmemiştir. Bu sorunun cevabı için zeytin için en uygun iklimin ne olduğunun bilinmesi gerekir.,Olgusal,126
İgloda yaşam sürenler hangi iklimin etkisi altında yaşamaktadırlar?,"İgloda yaşam sürenler, soğuk ve dondurucu bir iklimin etkisi altında yaşamaktadırlar; bu genellikle kutup iklimi olarak adlandırılır.",Olgusal,126
İnsanlar neden buzdan bir ev yapmaya ihtiyaç duymuş olabilirler?,"İnsanlar, bulundukları bölgede kolayca erişilebilen ve yalıtım sağlayan bir malzeme olduğu için buzdan ev yapmaya ihtiyaç duymuş olabilirler. Buz, soğuk iklimlerdeki en yaygın yapı malzemelerinden biridir.",Nedensel,126
Burada yaşayanlar soğuktan korunmak için ne yapıyor olabilirler?,"Burada yaşayanlar soğuktan korunmak için kalın giysiler giyebilir, ateş yakabilir, hayvan postlarından yararlanabilir ve iglolarının içini sıcak tutmak için çeşitli yöntemler kullanabilirler.",Yöntemsel,126
Muson yağmurları en çok hangi ülkelerde görülmektedir?,Metinde muson yağmurlarının en çok hangi ülkelerde görüldüğü belirtilmemiştir. Bu sorunun cevabı için ek bilgi gereklidir.,Olgusal,126
Muson yağmurları en çok hangi mevsimde görülmektedir?,Metinde muson yağmurlarının en çok hangi mevsimde görüldüğü belirtilmemiştir. Bu sorunun cevabı için ek bilgi gereklidir.,Olgusal,126
Muson yağmurları günlük yaşamı nasıl etkilemektedir?,Metinde muson yağmurlarının günlük yaşamı nasıl etkilediği hakkında detaylı bilgi verilmemiştir. Ancak görselde muson yağmurlarının hayatı zorlaştırdığı anlaşılmaktadır.,Yansıtıcı,126
Hindistan cevizi hangi iklimde yetişmektedir? Neden?,Metinde Hindistan cevizinin hangi iklimde yetiştiği belirtilmemiştir. Bu sorunun cevabı için ek bilgi gereklidir.,Olgusal,126
Hindistan cevizi hangi ülkelerde yetişmektedir?,Metinde Hindistan cevizinin hangi ülkelerde yetiştiği belirtilmemiştir. Bu sorunun cevabı için ek bilgi gereklidir.,Olgusal,126
Hindistan cevizinin yetiştiği iklimde başka hangi meyveler yetişmektedir?,Metinde Hindistan cevizinin yetiştiği iklimde başka hangi meyvelerin yetiştiği belirtilmemiştir. Bu sorunun cevabı için ek bilgi gereklidir.,Olgusal,126
İglo nedir ve neden önemlidir?,"İglo, buzdan yapılan bir evdir. Soğuk iklimlerde yaşayan insanlar için barınma sağlar ve hayatta kalmalarına yardımcı olur.",Kavramsal,126
Muson yağmurlarının etkileri neler olabilir?,"Muson yağmurları aşırı su baskınlarına, toprak kaymalarına ve ulaşım sorunlarına neden olabilir. Ayrıca, tarım için hem faydalı hem de zararlı olabilir.",Yansıtıcı,126
"Zeytin, Hindistan cevizi ve igloların ortak noktası nedir?","Zeytin, Hindistan cevizi ve iglolar farklı iklimlerdeki insanların ve bitkilerin çevreye uyum sağlama yöntemlerini temsil eder. Her biri, belirli bir coğrafi bölgenin ve iklimin özelliklerine uyum sağlamıştır.",Analitik,126
Bu değerlendirme formunun amacı nedir?,"Bu değerlendirme formunun amacı, öğrencinin ünitenin işlenişi sırasındaki performansını değerlendirmesine yardımcı olmaktır.",Olgusal,127
"Öğrenci, performansını nasıl değerlendirecek?","Öğrenci, her bir ölçüt için kendisine uygun olan yüz ifadesinin bulunduğu kutucuğa 'X' işareti koyarak performansını değerlendirecektir.",Yöntemsel,127
Formda hangi cevap seçenekleri bulunmaktadır?,"Formda 'Katılıyorum', 'Kararsızım' ve 'Katılmıyorum' olmak üzere üç cevap seçeneği bulunmaktadır.",Listeleme,127
Öğrencinin anlamakta zorlandığı konuları belirtmesi neden önemlidir?,"Öğrencinin anlamakta zorlandığı konuları belirtmesi, öğrenme sürecindeki eksiklikleri tespit etmeye ve bu eksiklikleri gidermeye yönelik çalışmalar yapmaya yardımcı olur.",Kavramsal,127
Etkinlikleri tamamlarken zorlanmak öğrenme sürecini nasıl etkiler?,"Etkinlikleri tamamlarken zorlanmak, öğrencinin motivasyonunu düşürebilir ve konuyu daha derinlemesine anlamasını engelleyebilir.",Yansıtıcı,127
"En çok hoşlanılan konu veya etkinlik, öğrencinin hangi yönlerini desteklemiş olabilir?","En çok hoşlanılan konu veya etkinlik, öğrencinin ilgi alanlarını, yeteneklerini ve öğrenme stilini desteklemiş olabilir.",Analitik,127
Öğrencinin bu ünitenin işlenişinde başarılı olup olmadığını düşünmesi neden önemlidir?,"Öğrencinin bu ünitenin işlenişinde başarılı olup olmadığını düşünmesi, öz değerlendirme becerisini geliştirmesine ve gelecekteki öğrenme süreçlerine daha bilinçli bir şekilde yaklaşmasına yardımcı olur.",Kavramsal,127
Başarıyı arttırmak için plan yapmanın önemi nedir?,"Başarıyı arttırmak için plan yapmak, öğrencinin hedeflerine ulaşmak için somut adımlar atmasına ve öğrenme sürecini daha etkili bir şekilde yönetmesine yardımcı olur.",Kavramsal,127
Derse hazırlıklı gelmek öğrenme sürecini nasıl etkiler?,"Derse hazırlıklı gelmek, öğrencinin derse daha aktif katılımını sağlar, konuyu daha iyi anlamasına yardımcı olur ve öğrenme sürecini daha verimli hale getirir.",Nedensel,127
Ders sırasında not almanın faydaları nelerdir?,"Ders sırasında not almak, öğrencinin dikkatini derse odaklamasına, önemli bilgileri kaydetmesine ve daha sonra tekrar gözden geçirmesine yardımcı olur.",Listeleme,127
Sınıfta gerçekleşen konuşmalara katılmanın öğrenciye ne gibi katkıları olabilir?,"Sınıfta gerçekleşen konuşmalara katılmak, öğrencinin farklı bakış açılarını anlamasına, düşüncelerini ifade etmesine ve iletişim becerilerini geliştirmesine yardımcı olur.",Yansıtıcı,127
Verilen görevleri zamanında yerine getirmemenin sonuçları neler olabilir?,"Verilen görevleri zamanında yerine getirmemek, öğrencinin öğrenme sürecinde geri kalmasına, notlarının düşmesine ve motivasyonunun azalmasına neden olabilir.",Varsayımsal,127
Bu formdaki ölçütler genel olarak neyi hedeflemektedir?,"Bu formdaki ölçütler genel olarak öğrencinin derse katılımını, anlama düzeyini, öğrenme sorumluluğunu ve öz değerlendirme becerisini hedeflemektedir.",Özetleme,127
Öğrencinin anlamadığı konular hakkında farklı kaynaklardan bilgi edinmesi neden önemlidir?,"Öğrencinin anlamadığı konular hakkında farklı kaynaklardan bilgi edinmesi, konuyu farklı açılardan anlamasına ve eksiklerini gidermesine yardımcı olur.",Nedensel,127
Ders kitabını ve gerekli materyalleri düzenli olarak getirmenin önemi nedir?,"Ders kitabını ve gerekli materyalleri düzenli olarak getirmek, öğrencinin derse aktif katılımını sağlar, öğrenme materyallerine kolayca erişmesini sağlar ve öğrenme sürecini daha verimli hale getirir.",Nedensel,127
Ekvator çizgisine paralel olarak eşit aralıklarla çizilen çizgilere ne denir?,"Ekvator çizgisine paralel olarak eşit aralıklarla çizilen çizgilere 'paralel' denir, 'meridyen' değil.",Olgusal,128
Dünya üzerinde okyanusların karalardan daha fazla yer kapladığı doğru mudur?,"Evet, dünya üzerinde okyanuslar karalardan daha fazla yer kaplamaktadır.",Olgusal,128
Türkiye topraklarının büyük çoğunluğu hangi kıtada yer almaktadır?,"Türkiye topraklarının büyük çoğunluğu Asya kıtasında yer almaktadır, Avrupa kıtasında değil.",Olgusal,128
Türkiye'nin kuzey ve güneyinde denize paralel uzanan sıradağlar var mıdır?,"Evet, Türkiye'nin kuzey ve güneyinde denize paralel olarak uzanan sıradağlar bulunmaktadır.",Olgusal,128
Türkiye'nin en büyük gölü hangisidir?,Türkiye'nin en büyük gölü Van Gölü'dür.,Olgusal,128
Ekonomik faaliyetlerin yoğun olduğu yerlerde nüfus yoğunluğu nasıldır?,Ülkemizde ekonomik faaliyetlerin yoğun olduğu yerlerde nüfus da yoğundur.,Olgusal,128
Kutup ikliminin görüldüğü yerlerde ekonomik faaliyetlerin başında ne gelmektedir?,Kutup ikliminin görüldüğü yerlerde tarım ekonomik faaliyetlerin başında gelmemektedir. Genellikle sınırlı faaliyetler görülür.,Olgusal,128
Bir ülkenin coğrafi konumu ekonomisini ve dış politikasını etkiler mi?,"Bir ülkenin coğrafi konumu, ekonomisini ve dış politikasını doğrudan etkiler.",Kavramsal,128
Türkiye'ye her yıl milyonlarca turistin gelmesinin nedeni nedir?,Türkiye'ye her yıl milyonlarca yabancı turist gelerek tatil yapmaktadır. Bunun nedenleri arasında tarihi ve doğal güzellikler sayılabilir.,Nedensel,128
Ülkemize gelen turist sayısının ülke ekonomisine etkileri nelerdir?,"Ülkemize gelen turist sayısı arttıkça turizm gelirleri de artar, bu da ülke ekonomisine olumlu katkı sağlar.",Yansıtıcı,128
"Eğer Türkiye topraklarının tamamı Avrupa'da olsaydı, bu durum ülkenin jeopolitik konumunu nasıl etkilerdi?","Eğer Türkiye topraklarının tamamı Avrupa'da olsaydı, Avrupa Birliği ile ilişkileri ve Avrupa üzerindeki etkisi artabilirdi.",Varsayımsal,128
Coğrafi konumun bir ülkenin dış politikası üzerindeki etkisini açıklayınız.,"Coğrafi konum, bir ülkenin komşularıyla ilişkilerini, ticaret yollarını ve stratejik önemini etkileyerek dış politikasını şekillendirir.",Kavramsal,128
Türkiye'deki dağların denize paralel uzanmasının iklim üzerindeki etkileri nelerdir?,"Türkiye'deki dağların denize paralel uzanması, kıyı bölgelerinde yağışın artmasına ve iç bölgelere nemin ulaşmasını engellemesine neden olur.",Nedensel,128
Ekonomik faaliyetlerin yoğun olduğu yerlerde nüfusun yoğun olmasının nedenleri nelerdir?,"Ekonomik faaliyetlerin yoğun olduğu yerlerde iş imkanları daha fazla olduğu için insanlar bu bölgelere göç eder, bu da nüfus yoğunluğunu artırır.",Nedensel,128
Bu ünitede öğrenilenlerin kısa bir özetini nasıl inceleyebiliriz?,Ünitede öğrenilenlerin kısa bir özetini yandaki karekodu okutarak inceleyebilirsiniz.,Yöntemsel,128
Türkiye hangi yer altı kaynakları bakımından zengin ülkelere komşudur?,Türkiye petrol gibi yer altı kaynakları bakımından zengin ülkelere komşudur.,Olgusal,129
Dünya'nın en büyük kara parçası hangi kıtadır?,Dünya’nın en büyük kara parçası Asya kıtasıdır.,Olgusal,129
Türkiye fiziki haritasına bakarak ne hakkında çıkarımlarda bulunmak mümkündür?,Türkiye fiziki haritasına bakarak ülkemizin yeryüzü şekilleri hakkında çıkarımlarda bulunmak mümkündür.,Olgusal,129
Türkiye'de kaç farklı iklim görülmektedir?,Ülkemizde üç farklı iklim görülmektedir.,Olgusal,129
Ülkemizde farklı ekonomik faaliyetlerin yapıldığı illerden biri hangisidir?,Ülkemizde farklı ekonomik faaliyetlerin yapıldığı illerden biri de Kocaeli ilimizdir.,Olgusal,129
Ülkemizde hangi ildeki nüfusun bir bölümü taş kömürü madenine bağlı olarak yaşamaktadır?,Ülkemizde Zonguldak ilindeki nüfusun bir bölümü taş kömürü madenine bağlı olarak burada yaşamaktadır.,Olgusal,129
Ülkemiz hangi kaynaklar açısından zengin bir ülkedir?,Ülkemiz maden kaynakları açısından zengin bir ülkedir.,Olgusal,129
Hangi iklimin görüldüğü yerlerde belirli dönemlerde yoğun yağmur yağışı olur?,Muson ikliminin görüldüğü yerlerde belirli dönemlerde yoğun yağmur yağışı olur.,Olgusal,129
İnsanların hangi ihtiyaçlarını belirleyen unsurlardan biri de iklimdir?,"İnsanların giyinme, barınma gibi ihtiyaçlarını belirleyen unsurlardan biri de iklimdir.",Olgusal,129
Türkiye'nin en verimli topraklarının yer aldığı ovada yılda kaç kez ürün alınır?,Türkiye’nin en verimli topraklarının yer aldığı Amik Ovası’nda yılda birkaç kez ürün alınır.,Olgusal,129
Karadeniz ikliminin görüldüğü illere örnek veriniz.,"Karadeniz ikliminin görüldüğü illere Sinop, Trabzon, Rize, Giresun, Ordu örnek verilebilir.",Listeleme,129
Karasal iklimin görüldüğü illere örnek veriniz.,"Karasal iklimin görüldüğü illere Erzurum, Konya, Ağrı, Van, Yozgat örnek verilebilir.",Listeleme,129
Akdeniz ikliminin görüldüğü illere örnek veriniz.,"Akdeniz ikliminin görüldüğü illere Antalya, Mersin, Adana, Osmaniye örnek verilebilir.",Listeleme,129
Muson ikliminin görüldüğü ülkelere örnek veriniz.,"Muson ikliminin görüldüğü ülkelere Çin, Japonya, Hindistan, Bangladeş örnek verilebilir.",Listeleme,129
Kutup ikliminin görüldüğü yerlere örnek veriniz.,Kutup ikliminin görüldüğü yerlere Grönland Adası’nın iç kısımları ve Antarktika örnek verilebilir.,Listeleme,129
Türkiye'nin matematik konumu ile ilgili olmayan özellik hangisidir?,"Türkiye'nin üç tarafının denizlerle çevrili olması matematik konumu ile ilgili değildir, özel konumuyla ilgilidir.",Olgusal,130
Türkiye'nin mutlak konumu ile ilgili olmayan coğrafi özellik hangisidir?,"Türkiye'nin üç tarafının denizlerle çevrili olması mutlak konumu ile ilgili değildir, özel konumuyla ilgilidir.",Olgusal,130
Hangi ürün ve iklim eşleştirmesinde verim alınamaz?,"Buğdayın Karadeniz iklimi ile eşleştirildiği durumda verim alınamaz, çünkü buğday Karadeniz ikliminde yetişmez.",Olgusal,130
"Yüzey şekillerinin iklim üzerindeki etkisine göre, günlük yaşamla ilgili hangi çıkarım doğrudur?","Yüksek kesimlerde yaşayanların kalın giysiler giymesi gerekliliği, yüzey şekillerinin iklim üzerindeki etkisine bağlı olarak doğru bir çıkarımdır.",Analitik,130
Büyükbaş hayvancılığın yaygın olarak yapılması beklenen yer neresidir ve neden?,"Kars'ta büyükbaş hayvancılığın yaygın olarak yapılması beklenir, çünkü yaz yağışlarının fazla olması bitki örtüsünün otlak ve çayırlardan oluşmasını sağlar.",Nedensel,130
Metinde boş bırakılan yere hangi iklim türü gelmelidir ve bu iklimin özellikleri nelerdir?,"Metinde boş bırakılan yere Muson iklimi gelmelidir. Bu iklimde yağışlar mayıs sonlarına doğru etkisini göstermeye başlar, haziranın ilk haftası ile birlikte başlayıp temmuz ayının sonlarına kadar yoğun yağışlar görülür.",Bağlamsal,130
Türkiye'nin matematik konumu ne anlama gelir?,"Türkiye'nin matematik konumu, Dünya üzerindeki yerinin enlem ve boylam dereceleri ile ifade edilmesidir.",Kavramsal,130
Mutlak konum ve özel konum arasındaki fark nedir?,"Mutlak konum bir yerin enlem ve boylam değerleriyle belirlenen yeridir. Özel konum ise bir yerin; yeryüzü şekilleri, denizlere göre konumu, yer altı kaynakları, bitki örtüsü, ulaşım, ticaret gibi kendine has özellikleriyle belirlenen yeridir.",Analitik,130
Yüzey şekillerinin iklimi nasıl etkilediğine dair örnekler nelerdir?,"Yükselti arttıkça sıcaklık azalır, dağların uzanış yönü yağışların dağılımını etkiler, kıyıdan iç kesimlere doğru sıcaklıklar azalır.",Listeleme,130
Büyükbaş hayvancılığın dağılımını etkileyen faktörler nelerdir?,Yaz yağışlarının fazla olması ve bitki örtüsünün otlak ve çayırlardan oluşması büyükbaş hayvancılığın dağılımını etkileyen temel faktörlerdir.,Listeleme,130
Muson ikliminin Türkiye'deki etkileri nelerdir?,"Metinde bahsedilen muson iklimi Türkiye'de görülmez. Metin, muson ikliminin görüldüğü bölgelerde yaşayanların alması gereken tedbirlerden bahsetmektedir.",Yansıtıcı,130
Türkiye'de dört mevsimin belirgin olarak yaşanmasının nedeni nedir?,Türkiye'nin orta kuşakta yer alması ve eksen eğikliği nedeniyle dört mevsim belirgin olarak yaşanır.,Nedensel,130
"Eğer Türkiye Ekvator üzerinde bulunsaydı, iklimi nasıl olurdu?","Eğer Türkiye Ekvator üzerinde bulunsaydı, sıcak ve yağışlı bir iklime sahip olurdu, belirgin mevsimler yaşanmazdı.",Varsayımsal,130
Türkiye'nin coğrafi özellikleri ekonomik faaliyetleri nasıl etkiler?,"Türkiye'nin coğrafi özellikleri tarım ürünlerinden hayvancılığa, turizmden sanayiye kadar birçok ekonomik faaliyeti etkiler. Örneğin, kıyı bölgelerinde turizm gelişirken, iç bölgelerde tarım ve hayvancılık ön plana çıkar.",Yansıtıcı,130
Metnin ana fikri nedir?,"Metnin ana fikri, Türkiye'nin coğrafi konumunun ve iklim özelliklerinin çeşitli örnekler üzerinden değerlendirilmesidir.",Özetleme,130
