question,answer,question_type,page
Türkiye hangi iklim kuşağında yer almaktadır?,"Türkiye, yarı sıcak iklim kuşağında yer almaktadır.",Olgusal,111
Türkiye'de görülen farklı iklim tiplerinin nedenleri nelerdir?,Türkiye'de mutlak ve göreceli konuma bağlı olarak farklı iklim tipleri görülmektedir.,Nedensel,111
Karasal iklimin özellikleri nelerdir?,"Karasal iklimde yazlar sıcak ve kurak, kışlar ise soğuk ve kar yağışlıdır. Sıcaklık yazın 40 dereceye kadar çıkarken, kışın -30 derecelere kadar düşebilir.",Olgusal,111
Akdeniz ikliminin tipik özellikleri nelerdir?,"Akdeniz ikliminde yazlar sıcak ve kurak, kışlar ılık ve yağışlıdır. Kar yağışı nadiren görülür.",Olgusal,111
Karadeniz iklimini diğer iklimlerden ayıran temel özellik nedir?,"Karadeniz ikliminde dört mevsim yağış görülür. Yazlar ılık, kışlar ise ılık ve yağışlıdır.",Analitik,111
Türkiye'de karasal iklimin en çok görüldüğü bölgeler hangileridir?,"Metinde belirtildiği üzere, Türkiye'nin büyük bir bölümünde karasal iklim görülmektedir, ancak haritadan ve metinden belirli bölgeler çıkarılamamaktadır.",Olgusal,111
Akdeniz ikliminin görüldüğü yerlerde bitki örtüsü nasıldır?,Metinde Akdeniz ikliminin görüldüğü yerlerdeki bitki örtüsü hakkında bilgi verilmemiştir.,Çıkarımsal,111
Karadeniz ikliminin görüldüğü yerlerde hangi ağaç türleri yaygındır?,Karadeniz ikliminin görüldüğü yerlerde geniş yapraklı ağaçlar yaygındır.,Olgusal,111
Ülkemizde görülen iklim tiplerinin dağılışında hangi coğrafi faktörler etkilidir?,Ülkemizde görülen iklim tiplerinin dağılışında mutlak ve göreceli konum etkilidir.,Nedensel,111
"Eğer Türkiye'de Karadeniz iklimi hiç olmasaydı, bu durum ülke ekonomisini nasıl etkilerdi?","Bu varsayımsal bir senaryo olduğundan, kesin etkileri belirlemek zordur. Ancak, Karadeniz ikliminin tarım ürünleri ve turizm üzerindeki etkisi düşünüldüğünde, bu sektörlerde önemli değişiklikler olabilirdi.",Varsayımsal,111
Harita 3.8'de gösterilen iklim bölgelerinin gelecekteki olası değişiklikleri neler olabilir?,"İklim değişikliği nedeniyle, Türkiye'deki iklim bölgelerinde sıcaklık artışı ve yağış düzeninde değişiklikler görülebilir. Bu durum, mevcut iklim tiplerinin dağılışını etkileyebilir.",Spekülatif,111
Karasal iklimin görüldüğü bölgelerde yaşayan insanlar hangi zorluklarla karşılaşabilir?,"Karasal iklimin görüldüğü bölgelerde yaşayan insanlar, aşırı sıcak ve soğuk hava koşulları, kuraklık ve su kıtlığı gibi zorluklarla karşılaşabilirler.",Yansıtıcı,111
Akdeniz ikliminin Türkiye ekonomisine katkıları nelerdir?,"Akdeniz iklimi, tarım (özellikle sebze ve meyve yetiştiriciliği) ve turizm açısından önemli katkılar sağlar.",Yansıtıcı,111
Karadeniz ikliminin görüldüğü bölgelerde hangi tarım ürünleri daha yaygın olarak yetiştirilir?,Metinde Karadeniz ikliminin görüldüğü bölgelerde yetiştirilen tarım ürünleri hakkında bilgi verilmemiştir.,Çıkarımsal,111
Türkiye'deki iklim çeşitliliğinin turizm potansiyeli açısından önemi nedir?,"Türkiye'deki iklim çeşitliliği, farklı mevsimlerde farklı turizm aktivitelerinin yapılabilmesine olanak sağlar. Örneğin, Akdeniz kıyılarında yaz turizmi, Karadeniz bölgesinde ise doğa turizmi gelişmiştir.",Analitik,111
İklim elemanları bir yerin bitki örtüsünü nasıl etkiler?,"İklim elemanları (sıcaklık, nem, yağış, rüzgâr, ışık) bir yerin bitki örtüsünü doğrudan etkileyerek, bitki türlerinin dağılımını ve gelişimini belirler.",Nedensel,112
Farklı iklimlerin görüldüğü yerlerde bitki örtüsü nasıldır?,"Farklı iklimlerin görüldüğü yerlerde zengin doğal bitki örtüsü bulunur, çünkü her iklim farklı bitki türlerinin yetişmesine olanak sağlar.",Olgusal,112
Karadeniz bölgesindeki bitki örtüsünün temel özellikleri nelerdir?,"Karadeniz bölgesinde yüksek nem ve yağışın etkisiyle yeşilin her tonu görülür. Dağların kuzeye bakan yamaçlarında geniş yapraklı ormanlar, yükseklerde ise iğne yapraklı ormanlar bulunur.",Listeleme,112
Karadeniz'deki geniş yapraklı ormanlar hangi yüksekliğe kadar devam eder?,Karadeniz'deki geniş yapraklı ormanlar genellikle 1.200 metreye kadar devam eder.,Olgusal,112
Akdeniz ikliminin bitki örtüsü üzerindeki temel etkisi nedir?,"Akdeniz ikliminde yaz kuraklığı bitki örtüsünü önemli ölçüde etkiler. Bu durum bitkilerin yeterince yetişememesine, yaprakların küçülmesine, sertleşmesine veya dikensi bir yapıya dönüşmesine neden olur.",Nedensel,112
Akdeniz ikliminde görülen baskın bitki örtüsü türleri nelerdir?,Akdeniz ikliminin etkili olduğu yerlerde maki bitki örtüsü ve kızılçam baskındır.,Listeleme,112
Maki bitki örtüsünün özellikleri nelerdir?,Maki bitki örtüsü yaz kış yaprağını dökmeyen bitkilerden oluşur ve yaz kuraklığından etkilenir.,Olgusal,112
Karasal iklimin bitki örtüsü üzerindeki etkisi nasıldır?,"Karasal iklimin etkili olduğu yerlerde bitki örtüsü bozkırdır. Bozkır, ilkbaharda yeşeren ve yazın sararıp kuruyan otsu bitkilerden oluşur.",Nedensel,112
Bozkır bitki örtüsünün temel özellikleri nelerdir?,"Bozkır bitki örtüsü, ilkbaharda yeşermeye başlayan ve yazın sararıp kuruyan otsu bitkilerden oluşur.",Olgusal,112
Türkiye'deki ormanlar hakkında daha fazla bilgi edinmek için hangi web sitesi ziyaret edilebilir?,Türkiye'deki ormanlar hakkında daha fazla bilgi sahibi olmak için www.ogm.gov.tr genel ağ adresi ziyaret edilebilir.,Yöntemsel,112
"Eğer Karadeniz bölgesinde yağış miktarı azalsaydı, bitki örtüsü nasıl etkilenirdi?","Eğer Karadeniz bölgesinde yağış miktarı azalsaydı, bitki örtüsü daha kuraklığa dayanıklı türlere dönüşebilir ve ormanların yoğunluğu azalabilirdi.",Varsayımsal,112
Akdeniz bitki örtüsünde yaprakların küçülmesinin veya sertleşmesinin nedeni nedir?,"Akdeniz bitki örtüsünde yaprakların küçülmesi veya sertleşmesi, bitkilerin yaz kuraklığına karşı adaptasyon mekanizmasıdır. Bu sayede su kaybını azaltarak hayatta kalmayı hedeflerler.",Nedensel,112
Bozkır bitki örtüsünün tarım açısından önemi nedir?,"Bozkır bitki örtüsü, hayvancılık için önemli bir otlak alanıdır. Ayrıca, bazı bozkır bitkileri erozyonu önlemede ve toprak verimliliğini artırmada rol oynar.",Yansıtıcı,112
Karadeniz'deki iğne yapraklı ormanların yoğunluğunun artmasının sebebi nedir?,"Karadeniz'de yükselti arttıkça sıcaklık düşer ve bu durum iğne yapraklı ormanların daha iyi yetişmesine olanak sağlar, bu yüzden yoğunlukları artar.",Nedensel,112
Türkiye'deki bitki örtüsünün dağılımını etkileyen temel faktörler nelerdir?,"Türkiye'deki bitki örtüsünün dağılımını etkileyen temel faktörler iklim (sıcaklık, yağış, nem), yükselti, toprak özellikleri ve insan faaliyetleridir.",Listeleme,112
Türkiye fiziki haritası kullanılarak hangi çalışmaların yapılması istenmektedir?,"Yaşadığınız ilin işaretlenmesi, yeryüzü şekilleri ve bitki örtüsünün belirtilmesi, en az beş dağ, ova, nehir, göl belirlenip işaretlenmesi ve iklimlerin etkili olduğu yerlerin tespit edilerek haritaya yazılması istenmektedir.",Olgusal,113
Bu etkinlik neden Türkiye fiziki haritasını kullanmayı gerektiriyor?,"Türkiye fiziki haritası, yeryüzü şekilleri, bitki örtüsü, dağlar, ovalar, nehirler, göller ve iklim bölgeleri gibi coğrafi özellikleri gösterdiği için bu etkinlik için gereklidir. Öğrencilerin bu özellikleri harita üzerinde görselleştirmesi ve ilişkilendirmesi amaçlanmaktadır.",Kavramsal,113
Etkinlikte yaşadığınız ilin yeryüzü şekillerini ve bitki örtüsünü haritaya yazmanın amacı nedir?,"Amaç, öğrencilerin yaşadıkları bölgenin coğrafi özelliklerini tanımalarını ve harita okuma becerilerini geliştirmelerini sağlamaktır.",Yöntemsel,113
"En az beş dağ, ova, nehir ve göl belirleyip haritaya işaretlemek neden önemlidir?","Bu, öğrencilerin Türkiye'nin farklı coğrafi bölgelerindeki önemli yer şekillerini öğrenmelerini ve harita üzerinde konumlarını belirleyebilmelerini sağlar.",Nedensel,113
Ülkemizde görülen iklimlerin etkili olduğu yerleri harita üzerinde tespit etmenin önemi nedir?,"Bu, öğrencilerin Türkiye'deki iklim çeşitliliğini ve bu iklimlerin farklı bölgeler üzerindeki etkilerini anlamalarına yardımcı olur.",Kavramsal,113
Bu etkinlikte kullanılan harita türü nedir?,Bu etkinlikte Türkiye dilsiz fiziki haritası kullanılmaktadır.,Olgusal,113
Dilsiz fiziki harita ne anlama gelir ve bu etkinlik için neden tercih edilmiştir?,"Dilsiz fiziki harita, üzerinde sadece yeryüzü şekilleri ve sınırları gösteren, isimlerin yazılmadığı bir harita türüdür. Bu etkinlikte öğrencilerin isimleri kendilerinin yazması ve böylece coğrafi bilgileri daha iyi öğrenmeleri amaçlandığı için tercih edilmiştir.",Kavramsal,113
Bu etkinliğin öğrencilere sağlayabileceği faydalar nelerdir?,"Bu etkinlik, öğrencilerin harita okuma becerilerini geliştirmelerine, Türkiye'nin coğrafi özelliklerini tanımalarına ve coğrafi bilgileri görselleştirerek daha iyi anlamalarına yardımcı olur.",Yansıtıcı,113
Eğer bir öğrenci yaşadığı ilin yeryüzü şekillerini bilmiyorsa ne yapmalıdır?,"Öğrenci, coğrafya ders kitaplarından, internet kaynaklarından veya öğretmeninden yardım alarak yaşadığı ilin yeryüzü şekilleri hakkında bilgi edinmelidir.",Varsayımsal,113
Bu etkinlikte belirtilen 'bitki örtüsü' kavramı neyi ifade etmektedir?,"Bitki örtüsü, bir bölgede doğal olarak yetişen bitki türlerinin genelini ifade eder. Örneğin, ormanlar, çalılıklar, otlaklar gibi farklı bitki örtüsü türleri vardır.",Olgusal,113
Türkiye'deki iklim çeşitliliğinin nedenleri nelerdir?,"Türkiye'deki iklim çeşitliliğinin nedenleri arasında; enlem, yükselti, denize göre konum, dağların uzanış yönü ve farklı hava kütlelerinin etkileri bulunmaktadır.",Nedensel,113
Bu etkinliği yaparken karşılaşılabilecek zorluklar neler olabilir?,"Harita okuma becerisinin yetersiz olması, coğrafi terimlerin bilinmemesi veya harita üzerinde yer şekillerini doğru bir şekilde işaretleyememe gibi zorluklar yaşanabilir.",Yansıtıcı,113
"Bu etkinlikte belirtilen coğrafi unsurların (dağ, ova, nehir, göl) her biri için örnekler veriniz.","Dağ: Ağrı Dağı, Ova: Konya Ovası, Nehir: Kızılırmak, Göl: Van Gölü",Listeleme,113
Bu etkinlikten çıkarılacak ana ders nedir?,"Bu etkinlikten çıkarılacak ana ders, Türkiye'nin coğrafi özelliklerinin çeşitliliğini ve bu özelliklerin harita üzerinde nasıl temsil edildiğini anlamaktır.",Özetleme,113
Bu etkinliğin amacı öğrencilere coğrafya dersini sevdirmek olabilir mi?,"Evet, bu tür etkileşimli etkinlikler, öğrencilerin coğrafya dersini daha eğlenceli ve ilgi çekici bulmalarını sağlayarak derse olan motivasyonlarını artırabilir.",Spekülatif,113
Nahçıvan Özerk Cumhuriyeti'nin nüfusu hangi aralıklarda olabilir?,Haritada verilen bilgilere göre Nahçıvan Özerk Cumhuriyeti'nin nüfusu 3.000 ile 6.000 kişi arasında olabilir.,Olgusal,114
Türkiye nüfus yoğunluğu haritasında hangi renkler hangi nüfus yoğunluklarını temsil etmektedir?,"Haritada kullanılan renkler, kilometre kare başına düşen kişi sayısını (nüfus yoğunluğunu) temsil etmektedir. Renklerin hangi yoğunlukları gösterdiği harita üzerindeki 'Nüfus Yoğunluğu' başlığı altındaki lejanttan öğrenilebilir.",Olgusal,114
Kocaeli ve Bayburt illerinin yüz ölçümleri karşılaştırıldığında nüfusları neden bu kadar farklıdır?,"Kocaeli ve Bayburt illerinin yüz ölçümleri birbirine yakın olmasına rağmen, Kocaeli'nin nüfusu Bayburt'tan çok daha fazladır. Bunun nedeni Kocaeli'nin sanayileşme, ulaşım imkanları, iş olanakları ve daha gelişmiş yaşam koşulları gibi faktörlerdir.",Nedensel,114
İnsanlar tarih boyunca yerleşim yeri seçimi yaparken nelere dikkat etmişlerdir?,"İnsanlar tarih boyunca yerleşim yeri seçimi yaparken tarıma elverişli araziler, yer altı ve yer üstü kaynakları, uygun iklim koşulları ve yaşamı kolaylaştıran yer yüzü şekilleri gibi faktörlere dikkat etmişlerdir.",Olgusal,114
Türkiye'nin her yerinde nüfusun aynı oranda dağılmamasının temel nedeni nedir?,"Türkiye'nin her yerinde nüfusun aynı oranda dağılmamasının temel nedeni, ülkenin farklı bölgelerinin aynı yaşam koşullarını ve kaynakları sunmamasıdır. Bazı bölgeler daha elverişli iklime, verimli topraklara veya ekonomik fırsatlara sahipken, diğerleri daha az çekicidir.",Nedensel,114
Harita 3.11'e göre Türkiye nüfusu en çok hangi bölgelerde yoğunlaşmıştır?,Harita 3.11'e göre Türkiye nüfusu batıda ve kıyı kesimlerinde yoğunlaşmaktadır.,Olgusal,114
Ankara'nın çevresindeki illere göre daha fazla nüfusa sahip olmasının nedenleri nelerdir?,"Ankara'nın çevresindeki illere göre daha fazla nüfusa sahip olmasının nedenleri arasında başkent olması, ulaşım yolları üzerinde bulunması, eğitim ve sağlık hizmetlerinin diğer yerlere göre daha iyi olması gibi özellikler sayılabilir.",Nedensel,114
Nüfus yoğunluğu en fazla olan iller hangileridir?,"Metinde belirtilenlere göre İstanbul, İzmir ve Kocaeli nüfus yoğunluğu sıralamasında başı çekmektedir.",Olgusal,114
Nüfus yoğunluğu en az olan iller hangileridir?,"Metinde belirtilenlere göre Tunceli, Ardahan ve Erzincan nüfus yoğunluğu az olan illerimizdendir.",Olgusal,114
Yaşanılan yerde nüfus yoğunluğunu etkileyen faktörler neler olabilir?,"Yaşanılan yerde nüfus yoğunluğunu etkileyen faktörler arasında iş imkanları, ulaşım olanakları, eğitim ve sağlık hizmetlerinin kalitesi, iklim koşulları, doğal kaynakların varlığı ve coğrafi konum sayılabilir.",Yansıtıcı,114
"Eğer bir ilin yüz ölçümü büyük ancak nüfusu az ise, bu durumun olası sonuçları neler olabilir?","Eğer bir ilin yüz ölçümü büyük ancak nüfusu az ise, bu durum kaynakların verimli kullanılmaması, ekonomik gelişimin yavaş olması, hizmetlere erişimin zorlaşması ve sosyal imkanların sınırlı olması gibi sonuçlar doğurabilir.",Varsayımsal,114
Türkiye'deki nüfus dağılımını etkileyen coğrafi faktörler nelerdir?,"Türkiye'deki nüfus dağılımını etkileyen coğrafi faktörler arasında yer şekilleri (dağlık veya ovalık alanlar), iklim koşulları (yağış miktarı, sıcaklık), toprak verimliliği ve su kaynaklarının varlığı sayılabilir.",Nedensel,114
Türkiye'deki illerin nüfus yoğunlukları arasındaki farklılıkların giderilmesi için neler yapılabilir?,"Türkiye'deki illerin nüfus yoğunlukları arasındaki farklılıkların giderilmesi için geri kalmış bölgelere yatırım yapılması, iş imkanlarının artırılması, eğitim ve sağlık hizmetlerinin iyileştirilmesi, ulaşım altyapısının geliştirilmesi ve kırsal kalkınma projelerinin desteklenmesi gibi önlemler alınabilir.",Yöntemsel,114
Nüfus yoğunluğu fazla olan bir bölgede yaşamanın avantajları ve dezavantajları nelerdir?,"Nüfus yoğunluğu fazla olan bir bölgede yaşamanın avantajları arasında daha fazla iş imkanı, çeşitli kültürel etkinliklere erişim, gelişmiş ulaşım ve altyapı sistemleri sayılabilirken; dezavantajları arasında ise yüksek yaşam maliyeti, trafik sıkışıklığı, hava kirliliği ve sosyal yaşamın karmaşıklığı yer alır.",Analitik,114
Türkiye'nin nüfus yoğunluğu haritası ve ekonomik faaliyetler arasındaki ilişkiyi nasıl açıklarsınız?,"Türkiye'nin nüfus yoğunluğu haritası genellikle ekonomik faaliyetlerin yoğunlaştığı bölgelerle paralellik gösterir. Sanayi, ticaret, turizm gibi ekonomik faaliyetlerin geliştiği bölgelerde nüfus yoğunluğu daha fazladır. Bu durum, iş imkanlarının ve yaşam standartlarının yüksek olduğu bölgelerin daha fazla insanı çekmesiyle açıklanabilir.",Kavramsal,114
Türkiye'de nüfus yoğunluğunun en fazla olduğu yer neresidir?,Türkiye'de nüfus yoğunluğunun en fazla olduğu yer İstanbul ve çevresidir.,Olgusal,115
İstanbul ve çevresinin nüfus yoğunluğunun fazla olmasının temel nedeni nedir?,"İstanbul ve çevresinin nüfus yoğunluğunun fazla olmasının temel nedeni, İstanbul'un sanayi, hizmet, eğitim ve turizm gibi alanlarda ülkenin merkezi olmasıdır.",Nedensel,115
Sürekli göç alan bir şehirde nüfus yoğunluğu nasıl değişir?,Sürekli göç alan bir şehirde nüfus oranı ve yoğunluğu her geçen yıl artar.,Olgusal,115
Türkiye'de illerin nüfus dağılımını etkileyen faktörler nelerdir?,Türkiye'de illerin nüfus dağılımını etkileyen faktörler iklim ve yer şekilleridir.,Listeleme,115
Doğu Karadeniz ve Anadolu'da nüfus yoğunluğu neden düşüktür?,Doğu Karadeniz ve Anadolu'da yükseklik ve engebeli araziler tarımsal faaliyetleri engellediği için nüfus yoğunluğu düşüktür.,Nedensel,115
İstanbul ve çevresinin sanayide gelişmesi nüfus yoğunluğunu nasıl etkiler?,"İstanbul ve çevresinin sanayide gelişmesi, her yıl çok fazla göç almasına neden olarak nüfus yoğunluğunu artırır.",Nedensel,115
Bitki örtüsü ve toprak verimliliği nüfus dağılımını nasıl etkiler?,"Bitki örtüsü ve toprak verimliliği, nüfus yoğunluğunun illere farklı şekillerde dağılmasına neden olur.",Nedensel,115
Turizmin nüfus dağılımı üzerindeki etkisi nedir?,"Turizm, nüfusun dağılımını etkileyen önemli faktörlerden biridir. Yaz turizminin yoğun olduğu Antalya gibi yerlerde nüfus yoğunluğu fazladır.",Olgusal,115
Yerleşmeyi etkileyen faktörlere örnekler nelerdir?,"Metinde yerleşmeyi etkileyen faktörlere doğrudan bir liste verilmemiştir. Ancak iklim, yer şekilleri, sanayi, hizmet, eğitim, turizm, bitki örtüsü ve toprak verimliliği gibi faktörlerin yerleşimi etkilediği belirtilmiştir.",Çıkarımsal,115
Nüfus yoğunluğunun fazla olmasını etkileyen faktörler nelerdir?,"Nüfus yoğunluğunun fazla olmasını etkileyen faktörler arasında sanayi, hizmet, eğitim, turizm gibi alanlardaki gelişmeler ve uygun iklim koşulları sayılabilir.",Listeleme,115
Nüfus yoğunluğunun az olmasını etkileyen faktörler nelerdir?,Nüfus yoğunluğunun az olmasını etkileyen faktörler arasında engebeli araziler ve tarımsal faaliyetleri engelleyen arazi şartları sayılabilir.,Listeleme,115
Nüfusun dağılışına etki eden ekonomik faaliyetlere örnekler nelerdir?,"Nüfusun dağılışına etki eden ekonomik faaliyetlere örnek olarak tarım, madencilik, sanayi, ticaret, bankacılık, güvenlik, iletişim ve ulaşım verilebilir.",Listeleme,115
Ekonomik faaliyetler nelerdir ve neden önemlidirler?,"Ekonomik faaliyetler, insanların temel istek ve ihtiyaçlarını karşılayabilmek, gelir elde edebilmek için yaptıkları üretim ve faaliyetlerdir. Bunlar toplumların gelişimi ve refahı için önemlidir.",Kavramsal,115
Türkiye'deki ekonomik faaliyetlerden bazıları nelerdir?,"Türkiye'deki ekonomik faaliyetlerden bazıları tarım, madencilik, sanayi, ticaret, bankacılık, güvenlik, iletişim ve ulaşımdır.",Listeleme,115
"Eğer İstanbul'da sanayi sektörü gelişmeseydi, nüfus yoğunluğu nasıl etkilenirdi?","Eğer İstanbul'da sanayi sektörü gelişmeseydi, şehre olan göç azalır ve nüfus yoğunluğu da muhtemelen daha düşük olurdu.",Varsayımsal,115
