question,answer,question_type,page
Anadolu'daki Türk beyliklerinin sınırları en çok hangi denizlere kadar genişlemiştir?,"Türk beylikleri, Bizans İmparatorluğu'nun topraklarını fethederek sınırlarını Ege ve Marmara Denizi kıyılarına kadar genişlettiler.",Olgusal,81
Anadolu'da Türk nüfusunun artmasında hangi olay etkili olmuştur?,Moğol baskısından kaçanların Anadolu'ya gelmesiyle Türk nüfusu artmıştır.,Nedensel,81
Türk beyliklerinin olduğu bölgelerde halkın durumu nasıldı?,Anadolu'nun doğusu Moğollar nedeniyle kargaşa içindeyken Türk beyliklerinin olduğu yerlerde halk huzur ve güven içindeydi.,Olgusal,81
Türk beylikleri fethettikleri yerlerde halkın hizmetine hangi tür yapılar sunmuşlardır?,"Türk beylikleri fethettikleri yerlere cami, medrese, türbe, külliye, han, kervansaray, köprü gibi yapılar yaparak bunları halkın hizmetine sundular.",Listeleme,81
Aydınoğlu İsa Bey Camii hangi şehirdedir?,Aydınoğlu İsa Bey Camii İzmir'dedir.,Olgusal,81
Türkiye Selçuklu Devleti ve Anadolu beyliklerine ait eserleri incelemek için hangi web sitesi ziyaret edilebilir?,Türkiye Selçuklu Devleti ve Anadolu beyliklerine ait eserleri İstanbul’da bulunan Türk ve İslam Eserleri Müzesinin www.sanalmuze.gov.tr genel ağ adresini ziyaret ederek inceleyebilirsiniz.,Yöntemsel,81
II. Beylikler Dönemi Anadolu'da nasıl ortaya çıkmıştır?,"Moğolların baskısı karşısında Doğu ve Orta Anadolu’da yaşayan Türk boyları Anadolu’nun batısına göç etti. Bu boylar, 13. yüzyıl sonlarına doğru Anadolu’da Moğol baskısının zayıflamasından yararlanarak ve Türkiye Selçuklu Devleti ile ilişkilerini keserek bağımsızlıklarını ilan ettiler. Böylece Anadolu’da siyasi birlik parçalandı ve yeniden çok sayıda Türk beyliği kuruldu.",Nedensel,81
Anadolu'da siyasi birliğin parçalanmasının temel sebebi nedir?,"Anadolu'da siyasi birliğin parçalanmasının temel sebebi, Moğol baskısının zayıflaması ve Türk beyliklerinin Türkiye Selçuklu Devleti ile ilişkilerini keserek bağımsızlıklarını ilan etmeleridir.",Nedensel,81
Harita 2.13 neyi göstermektedir?,Harita 2.13 Anadolu Türk beylikleri haritasını (13. yüzyıl) göstermektedir.,Olgusal,81
Moğol baskısının Anadolu üzerindeki etkileri neler olmuştur?,Moğol baskısı nedeniyle Doğu ve Orta Anadolu'da yaşayan Türk boyları batıya göç etmiş ve bu durum Anadolu'da siyasi yapının değişmesine neden olmuştur.,Yansıtıcı,81
Anadolu'daki Türk beyliklerinin halkın huzurunu sağlaması ne gibi sonuçlar doğurmuştur?,"Türk beyliklerinin halkın huzurunu sağlaması, kültürel ve ekonomik kalkınmaya zemin hazırlamış, cami, medrese gibi yapıların inşa edilmesini sağlamıştır.",Yansıtıcı,81
"Eğer Moğol baskısı olmasaydı, Anadolu'daki siyasi yapı nasıl değişebilirdi?","Moğol baskısı olmasaydı, Türkiye Selçuklu Devleti'nin otoritesi devam edebilir ve Anadolu'da beylikler dönemi yaşanmayabilirdi.",Varsayımsal,81
Anadolu beylikleri dönemi neden önemlidir?,"Anadolu beylikleri dönemi, Türk kültürünün ve sanatının gelişimi, Anadolu'nun Türkleşmesi ve İslamlaşması açısından önemlidir. Ayrıca Osmanlı Devleti'nin temelleri bu dönemde atılmıştır.",Kavramsal,81
Osmanoğulları Beyliği'nin diğer beyliklerden farkı neydi?,"Metinde doğrudan belirtilmemekle birlikte, Osmanoğulları Beyliği'nin diğer beyliklerden farkı, daha sonra bir imparatorluğa dönüşecek kadar güçlü bir siyasi ve askeri yapı kurabilmesidir.",Analitik,81
Anadolu'da kurulan beyliklerin isimlerinden birkaçını sayar mısınız?,"Anadolu'da kurulan beyliklerden bazıları şunlardır: Osmanoğulları, Candaroğulları, Karesioğulları, Saruhanoğulları, Aydınoğulları, Menteşeoğulları, Hamitoğulları, Karamanoğulları, Dulkadiroğulları, Ramazanoğulları, Germiyanoğulları.",Listeleme,81
İbni Battuta'nın seyahatnamesine göre Anadolu'daki ekonomik faaliyetler nelerdir?,"Seyahatnameye göre Anadolu'daki ekonomik faaliyetler arasında Alanya'da kereste üretimi ve ihracatı, Aksaray'da halı ve kilim üretimi ve ihracatı, Erzincan'da kumaş dokumacılığı ve bakır eşya üretimi bulunmaktadır.",Olgusal,82
İbni Battuta'nın metnine dayanarak Anadolu'nun Türk yurdu olduğundan söz edilebilir mi? Neden?,"Evet, metne dayanarak Anadolu'nun Türk yurdu olduğundan söz edilebilir. Çünkü Alanya'nın ahalisi Türkmen'dir ve Türkmenlerin yaşadığı her yerde Ahiler bulunmaktadır. Ayrıca Aksaray halıları ve Erzincan kumaşları gibi Türk kültürüne özgü ürünler üretilip ihraç edilmektedir.",Yorumlama,82
Ahiler kimlerdir ve ne tür bir cemiyettir?,"Ahiler, Türkmenlerin yaşadığı yerlerde bulunan, bekâr ve sanat sahibi gençlerin oluşturduğu bir tür cemiyettir. Birbirleriyle sıkı bir dayanışma içindedirler ve halk içinde muteber meslekleri vardır.",Olgusal,82
Ahilerin temel işlevleri nelerdir?,"Ahilerin temel işlevleri arasında yabancılara yardım etmek, zorbaları yola getirmek ve kötüleri ortadan kaldırmak yer alır. Ayrıca dini ve mesleki birlik sağlamak da amaçları arasındadır.",Olgusal,82
Fütüvvet nedir?,"Fütüvvet, Ahilerin bir araya gelerek oluşturduğu cemiyete verilen addır ve dini ve mesleki birliği, esnaf teşkilatını ifade eder.",Olgusal,82
Alanya nasıl bir şehirdir ve hangi ticari faaliyetler yapılmaktadır?,"Alanya, deniz kıyısında büyük bir Türkmen şehridir. Mısır, İskenderiye ve Şam tüccarları alışveriş yapmak için buraya gelirler. Kereste üretimi ve ihracatı önemli bir ekonomik faaliyettir.",Olgusal,82
Alanya'da hangi yapılar bulunmaktadır?,"Alanya'da bir cami, medrese, birçok hamam ve tertipli geniş çarşılar bulunmaktadır. Şehir, mahalleleri de içine alacak şekilde surlarla çevrilidir.",Olgusal,82
Aksaray'ın hangi ürünü meşhurdur ve nerelere ihraç edilmektedir?,"Aksaray'ın koyun yününden üretilen zarif halı ve kilimleri meşhurdur. Bu ürünler Şam, Mısır, Irak, Hindistan, Çin ve diğer Türk ülkelerine ihraç edilmektedir.",Olgusal,82
Erzincan'ın ekonomik faaliyetleri nelerdir?,Erzincan'da dokuma tezgâhlarında nefis kumaşlar dokunur ve bu kumaşlar çeşitli beldelere ihraç edilir. Ayrıca şehirdeki madenlerden çıkarılan bakırlarla çeşitli kaplar ve şamdanlar yapılır.,Olgusal,82
İbni Battuta kimdir?,"İbni Battuta, Büyük Dünya Seyahatnamesi'nin yazarıdır ve bir gezgindir.",Olgusal,82
Anadolu'daki beyliklerin ekonomik alanda yaptıkları faaliyetler neler olabilir?,"Anadolu'daki beyliklerin ekonomik alanda yaptıkları faaliyetler arasında ticareti teşvik etmek, kervansaraylar inşa etmek, tarımı geliştirmek ve zanaatkarları desteklemek sayılabilir.",Varsayımsal,82
Anadolu'nun Türkleşmesinde Ahilerin rolü ne olmuştur?,"Ahiler, Anadolu'nun Türkleşmesinde önemli bir rol oynamışlardır. Türkmenlerin yaşadığı bölgelerde sosyal dayanışmayı sağlamışlar, yerel halkla iyi ilişkiler kurmuşlar ve İslam'ın yayılmasına katkıda bulunmuşlardır.",Yorumlama,82
İbni Battuta'nın seyahatnamesinden Anadolu'nun kültürel yapısı hakkında ne gibi çıkarımlar yapılabilir?,"İbni Battuta'nın seyahatnamesinden Anadolu'nun kültürel yapısının zengin ve çeşitli olduğu çıkarımı yapılabilir. Türkmen kültürü, İslam kültürü ve yerel Anadolu kültürlerinin bir arada harmanlandığı bir yapı söz konusudur.",Analitik,82
Alanya'nın coğrafi konumu ticaret için neden önemlidir?,"Alanya'nın deniz kıyısında bulunması, deniz ticaretine olanak sağlaması ve farklı bölgelerden gelen tüccarların buluşma noktası olması nedeniyle ticaret için önemlidir.",Nedensel,82
"Eğer Aksaray halıları günümüzde üretilmiyor olsaydı, bu durum Aksaray ekonomisini nasıl etkilerdi?","Eğer Aksaray halıları günümüzde üretilmiyor olsaydı, Aksaray ekonomisi olumsuz etkilenirdi. Çünkü halıcılık, yörenin önemli bir gelir kaynağıdır ve turizmi de desteklemektedir. Üretimin durması, istihdam kaybına ve ekonomik daralmaya yol açabilirdi.",Varsayımsal,82
Tarihi ticaret yolları ne anlama gelir?,"Tarihi ticaret yolları, geçmiş dönemlerde insanların istek ve ihtiyaçlarını karşılamak amacıyla kullandıkları, farklı bölgeler arasındaki mal ve kültür alışverişini sağlayan güzergahlardır.",Olgusal,83
Ticaretin gelişmesinde paranın rolü nedir?,"Paranın kullanılması ticareti kolaylaştırmış, malların değerini belirleme ve takas işlemlerini basitleştirmiştir. Bu durum ticaretin daha hızlı ve yaygın bir şekilde yapılmasına olanak sağlamıştır.",Kavramsal,83
Kral Yolu hangi medeniyetler arasında kullanılmıştır ve önemi nedir?,"Kral Yolu, Batı Anadolu'dan Mezopotamya'ya kadar uzanıyordu. Anadolu ve Mezopotamya medeniyetleri arasındaki ilişkileri geliştirmiş, kültürel etkileşime ve bilgi alışverişine katkıda bulunmuştur.",Bağlamsal,83
Çivi yazısının Anadolu'ya gelmesine ne sebep olmuştur?,"Mezopotamya ile Anadolu arasındaki ticari ilişkiler, Mezopotamya'da kullanılan çivi yazısının Anadolu'ya gelmesine ve burada da kullanılmaya başlanmasına neden olmuştur.",Nedensel,83
İpek Yolu'nun güzergahı nasıldır?,"İpek Yolu, Çin'in Şian kentinden başlayıp Orta Asya'dan geçerek Hazar Denizi'nin güneyinden ve kuzeyinden iki kol halinde Avrupa'ya uzanan tarihi bir ticaret yoludur.",Yöntemsel,83
İpek Yolu ve Baharat Yolu'nun 16. yüzyıla kadar önemini korumasının nedenleri nelerdir?,"Bu yollar, Asya ile Avrupa kıtaları arasında siyasi, kültürel ve ekonomik ilişkiler kurulmasını sağlayarak 16. yüzyıla kadar önemini korumuştur. Farklı bölgeler arasındaki mal, fikir ve kültür alışverişine aracılık etmişlerdir.",Analitik,83
İpek Yolu üzerinde bir savaş çıksaydı ticaret nasıl etkilenirdi?,"İpek Yolu üzerinde bir savaş çıkması durumunda ticaret olumsuz etkilenirdi. Güvenlik sorunları artar, ticaret yolları kapanabilir veya tehlikeli hale gelebilirdi. Bu durum, mal akışını yavaşlatır ve ticaret hacmini azaltırdı.",Varsayımsal,83
Tarihi ticaret yollarının günümüzdeki etkileri nelerdir?,"Tarihi ticaret yolları, günümüzde farklı kültürlerin etkileşimini ve ticaretin gelişimini anlamak için önemli bir referans noktasıdır. Ayrıca, bu yollar üzerindeki şehirlerin kültürel mirası turizm açısından değerlidir.",Yansıtıcı,83
İpek Yolu ve Baharat Yolu'nun önemini yitirmesinin olası nedenleri neler olabilir?,"Yeni deniz yollarının keşfi, sömürgecilik faaliyetleri ve siyasi istikrarsızlıklar gibi faktörler İpek Yolu ve Baharat Yolu'nun önemini yitirmesine neden olmuş olabilir.",Spekülatif,83
İlk Çağ'daki önemli ticaret yolları nelerdir?,"İlk Çağ'daki önemli ticaret yolları Kral Yolu, İpek Yolu ve Baharat Yolu'dur.",Listeleme,83
Metne göre tarihi ticaret yollarının önemi nedir?,"Metne göre tarihi ticaret yolları, farklı medeniyetler arasındaki kültürel, ekonomik ve siyasi etkileşimi sağlayarak tarihin şekillenmesinde önemli bir rol oynamıştır.",Özetleme,83
Baharat Yolu hangi kıtalardan geçmekteydi?,"Baharat Yolu, Hindistan'dan başlayıp Akdeniz üzerinden Avrupa'ya uzanmaktaydı, dolayısıyla Asya ve Avrupa kıtalarından geçmekteydi.",Olgusal,83
Ticaretin başlamasında hangi faktörler etkili olmuştur?,"İnsanların tarım yapmaya başlaması, hayvanları evcilleştirmesi ve elde ettikleri fazla ürünleri başkalarıyla değiş tokuş etmeleri ticaretin başlamasında etkili olmuştur.",Kavramsal,83
Harita 2.14'te hangi denizler gösterilmektedir?,"Harita 2.14'te Akdeniz, Karadeniz, Hazar Denizi, Kızıldeniz, Hint Okyanusu ve Büyük Okyanus gösterilmektedir.",Olgusal,83
İpek Yolu ve Baharat Yolu üzerinde kurulan Türk devletlerinin bu yollar üzerindeki etkileri nelerdi?,"Metinde İpek Yolu ve Baharat Yolu üzerinde kurulan Türk devletleri belirtilmemiştir, bu nedenle bu devletlerin yollar üzerindeki etkileri hakkında bilgi vermek mümkün değildir.",Cevap Bulunamadı,83
Orta Asya'da kurulan Türk devletleri neden komşu devletlerle mücadele etmişlerdir?,"Orta Asya'da kurulan Türk devletleri, İpek Yolu'nun kontrolünü ele geçirmek amacıyla başta Çin olmak üzere komşu devletlerle mücadele etmişlerdir.",Nedensel,84
İpek Yolu'nun Ortaçağ'daki önemi neydi?,"Ortaçağ'da İpek Yolu, birçok devletin sahip olmak istediği ve sağladığı ekonomik faydalar sebebiyle devletlerin zaman zaman birbirleriyle savaştığı önemli bir ticaret güzergahıydı.",Kavramsal,84
İpek Yolu'nun Çin'deki başlangıç noktalarında ne tür insanlara rastlanırdı?,İpek Yolu'nun Çin'deki başlangıç noktalarında her milletten ve dinden insana rastlamak mümkündü.,Olgusal,84
Müslüman tüccarlar İpek Yolu'na ne zaman gelip gitmeye başladılar?,"Müslüman tüccarlar, Emevîler döneminden itibaren İpek Yolu'na gelip gitmeye başlamışlardır.",Olgusal,84
İpek Yolu'nun deniz bağlantıları nasıldı?,"İpek Yolu'nun deniz bağlantıları, doğuda Çin Denizi limanlarına götürülen ipek ve diğer malların batıya doğru uzun bir yolculuğa çıkacak gemilere yüklenmesi ve bir kısmının Seylan'a götürülerek buradan başka gemilerle Basra Körfezi'ne gönderilmesi şeklindeydi.",Yöntemsel,84
Müslümanların eline İpek Yolu'nun hangi güzergahları geçti?,"Irak, İran, Suriye, Azerbaycan, Anadolu’nun büyük bir bölümü ve Mısır’ın fethedilmesiyle İpek Yolu’nun hemen hemen bütün güzergâhları Müslümanların eline geçti.",Olgusal,84
Hangi dönemlerde İpek Yolu ticareti işlemeye devam etti?,Emevi ve Abbasi dönemlerinde İpek Yolu ticareti işlemeye devam etti.,Olgusal,84
Büyük Selçuklu Devleti'nin Orta Doğu'ya egemen olmasının İpek Yolu üzerindeki etkisi ne oldu?,Büyük Selçuklu Devleti'nin Orta Doğu'ya egemen olmasıyla İpek Yolu'nun kontrolü yeniden Türklere geçti.,Nedensel,84
Erzurum'un İpek Yolu üzerindeki önemi neydi?,"1048-1049’da Selçuklular’ın eline geçen Doğu Anadolu’daki Erzurum, İpek Yolu üzerinde önemli bir ticaret merkeziydi.",Kavramsal,84
Erzurum ve Kafkasya'dan Trabzon Limanı'na gönderilen mallar hangi güzergahları izlerdi?,Erzurum ve Kafkasya'dan Trabzon Limanı'na gönderilen mallar İstanbul'a ve Batı ülkelerine ulaşırdı.,Olgusal,84
İpek Yolu'nun tarih boyunca kültürel etkisi ne olmuştur?,"İpek Yolu, tarih boyunca farklı ırk ve dinlerden pek çok insanı ve kültürlerini kaynaştırmış, özellikle Müslüman tüccarların İslâmiyet’i Çin, Hindistan, Doğu Hint adaları ve Filipinler’e kadar yaymalarına vasıta olmuştur.",Yansıtıcı,84
İpek Yolu üzerinde bulunan Jia-yuguan Kalesi ne işe yarıyordu?,"Jia-yuguan Kalesi, İpek Yolu üzerindeki gümrük noktalarından biriydi.",Olgusal,84
Metinde bahsedilen bronz kemer tokası nereden bulunmuştur ve hangi yüzyıla aittir?,Metinde bahsedilen bronz kemer tokası Moğolistan'da bulunmuştur ve II. yüzyıla aittir.,Olgusal,84
İpek Yolu'nun kontrolü için yapılan mücadelelerin temel sebebi neydi?,"İpek Yolu'nun kontrolü için yapılan mücadelelerin temel sebebi, yolun sağladığı ekonomik faydalardan yararlanmaktı.",Nedensel,84
İpek Yolu'nun İslamiyet'in yayılmasındaki rolünü özetleyin.,"İpek Yolu, Müslüman tüccarların İslamiyet'i Çin, Hindistan, Doğu Hint adaları ve Filipinler'e kadar yaymalarına olanak sağlayarak İslamiyet'in geniş coğrafyalara yayılmasında önemli bir rol oynamıştır.",Özetleme,84
İpek Yolu'nun canlanmasını sağlayan olay nedir?,"Göktürk Devleti'nin Çin ile yaptığı barış, İpek Yolu ticaretinin yeniden canlanmasını sağlamıştır.",Olgusal,85
Göktürk tüccarlarının Çin'e sattığı başlıca ürünler nelerdir?,"Göktürk tüccarları Çin'e yün, deri, koyun ve at satmışlardır.",Listeleme,85
İpek Yolu'nun adının kaynağı nedir?,"İpek Yolu'nun adının kaynağı, Çin'den alınan ipek kumaşın çok talep görmesi ve bu yolun Çin'den Avrupa'ya uzanmasıdır.",Nedensel,85
Göktürk tüccarlarının batıda ticaret yapmak için yolculuk yaptıkları devlet hangisidir?,"Göktürk tüccarları, batıda ticaret yapmak için İran'da bulunan Sasani Devleti'ne yolculuk yapmışlardır.",Olgusal,85
Göktürk tüccarlarının İpek Yolu üzerindeki seyahatlerinde karşılaştıkları zorluklar nelerdir?,"Göktürk tüccarları, çöllerle kaplı yolda zorlu iklim koşulları ve haydut saldırılarıyla karşılaşmışlardır.",Listeleme,85
İstemi Yabgu'nun ticaretin gelişmesine verdiği önem nasıl anlaşılmaktadır?,"İstemi Yabgu, ticaretin gelişmesine büyük önem veriyor ve bu nedenle İpek Yolu'nun güvenliğini sağlamak için elinden geleni yapıyordu.",Çıkarsama,85
Sasanilerin Türk tüccarlara karşı tutumu neden değişmiştir?,"Sasaniler, ticaretten daha fazla pay almak istedikleri için Türk tüccarlardan daha fazla vergi istemişler ve ticaretlerini engellemeye başlamışlardır.",Nedensel,85
Göktürklerin Sasanilere karşı Bizans İmparatorluğu ile ittifak kurmasının amacı nedir?,"Göktürkler, Sasanilere karşı Bizans İmparatorluğu ile ittifak kurarak hem Sasanilerin baskısını azaltmayı hem de Bizans ile ticarete başlamayı amaçlamışlardır.",Analitik,85
Bizans elçisi Göktürk otağında nelerden etkilenmiştir?,"Bizans elçisi, altın ve gümüşten yapılmış eşyalardaki ustalıktan etkilenmiş ve hayranlığını dile getirmiştir.",Olgusal,85
Türk devletlerinin İpek Yolu üzerindeki kontrolünün ekonomik ve siyasi güçleriyle ilişkisi nasıldır?,"Türk devletleri İpek Yolu'nu kontrol ettikleri dönemlerde ekonomik ve siyasi olarak güçlenmişler, yolun kontrolünü kaybettiklerinde ise zayıflamışlardır.",Kavramsal,85
I. Göktürk Devleti'nin İpek Yolu'nun batısı için kiminle mücadele ettiği belirtilmiştir?,"I. Göktürk Devleti, İpek Yolu'nun batısının kontrolü için Sasanilerle ittifak yaparak Akhun Devleti ile mücadele etmiştir.",Olgusal,85
Göktürk tüccarının Sasani topraklarında sattığı son ürünler nelerdir?,"Göktürk tüccarı, Sasani topraklarında elinde kalan son ipek kumaş ve porseleni satarak dönüş yoluna koyulmuştur.",Olgusal,85
"Göktürklerin Bizans'a demir satma önerisi, hangi amaca hizmet etmiştir?","Göktürklerin Bizans'a demir satma önerisi, hem Sasanilere karşı ittifak yapma hem de Bizans ile ticarete başlama amacına hizmet etmiştir.",Analitik,85
İpek Yolu'nun kontrolünü kaybetmenin Türk devletleri üzerindeki olası etkileri neler olmuştur?,"İpek Yolu'nun kontrolünü kaybetmek, Türk devletlerinin ekonomik ve siyasi olarak zayıflamasına neden olmuştur.",Yansıtıcı,85
İpek Yolu üzerindeki ticaretin canlanmasının Göktürk Devleti için önemi nedir?,"İpek Yolu üzerindeki ticaretin canlanması, Göktürk Devleti'nin ekonomik olarak güçlenmesine ve refahının artmasına katkı sağlamıştır.",Kavramsal,85
