question,answer,question_type,page
Sağlıklı bir yaşam için canlıların en önemli doğal kaynak gereksinimi nedir?,Sağlıklı bir yaşam için canlıların en önemli doğal kaynak gereksinimi sudur.,Olgusal,181
"Suyun bilinçli kullanılmamasının deniz, göl ve akarsular üzerindeki etkileri nelerdir?","Suyun bilinçli kullanılmaması, deniz, göl ve akarsulara bırakılan atık maddeler nedeniyle buralarda yaşayan canlı türlerinin azalmasına veya yok olmasına yol açmaktadır.",Nedensel,181
Ormanların bilinçsizce yok edilmesinin sonuçları nelerdir?,"Ormanların bilinçsizce yok edilmesi, içindeki canlıların yok olmasına, oksijen kaynağımızın bitmesine ve dünyamızın tehdit altında olmasına sebep olur. Ayrıca, bu kaynakların tekrar kazanılması onlarca yıl sürebilir.",Yansıtıcı,181
Küresel ısınmanın en belirgin tehditleri nelerdir?,"Küresel ısınmanın en belirgin tehditleri arasında kutuplardaki buzulların erimesi, deniz suyunun yükselmesi ve denize kıyısı olan yerlerin sular altında kalması yer almaktadır.",Listeleme,181
Kaynakları bilinçli kullanmadığımız sürece küresel ısınma tehditlerinin boyutları nasıl değişir?,Kaynakları bilinçli kullanmadığımız sürece küresel ısınma tehditlerinin boyutları daha da artacaktır.,Varsayımsal,181
Küresel ısınma hangi doğal afetlere sebep olabilir?,"Küresel ısınma iklim değişikliklerine, düzensiz ve aşırı yağışlara, kuraklığa ve benzeri birçok doğal afete sebep olabilir.",Nedensel,181
Orman yangınlarının temel sebepleri nelerdir?,Metinde orman yangınlarının temel sebepleri arasında piknik yaptıktan sonra söndürülmemiş ateşler belirtilmiştir.,Olgusal,181
Orman yangınlarında canlı türlerinin yok olmasının doğal yaşam üzerindeki etkileri nelerdir?,"Orman yangınlarında canlı türlerinin yok olması, biyoçeşitliliğin azalmasına ve ekosistemin dengesinin bozulmasına neden olur.",Analitik,181
Orman yangınlarını en aza indirgemek için hangi önlemler alınabilir?,"Orman yangınlarını en aza indirgemek için piknik alanlarında ateşin dikkatli yakılması ve tamamen söndürülmesi, ormanlık alanlarda sigara içilmemesi ve yangın riskine karşı bilinçlendirme çalışmaları yapılması gibi önlemler alınabilir.",Yöntemsel,181
Ormanların azalması veya tamamen yok olması durumunda hangi felaketler yaşanabilir?,"Ormanların azalması veya tamamen yok olması durumunda oksijen seviyesi düşer, toprak erozyonu artar, su kaynakları azalır, iklim değişiklikleri hızlanır ve birçok canlı türü yok olur.",Yansıtıcı,181
Su kaynaklarının önemi nedir?,"Su kaynakları, canlıların yaşamlarını sürdürebilmeleri için hayati öneme sahiptir ve aynı zamanda birçok besinin kaynağını oluşturur.",Kavramsal,181
Bilinçli su kullanımı ne anlama gelir?,"Bilinçli su kullanımı, suyu gereksiz yere tüketmemek, israfı önlemek ve su kaynaklarını kirletmemek anlamına gelir.",Kavramsal,181
Küresel ısınmaya karşı duyarlı olmak neden önemlidir?,"Küresel ısınmaya karşı duyarlı olmak, gelecekte yaşanabilecek olumsuz etkileri azaltmak ve daha sürdürülebilir bir dünya için önemlidir.",Kavramsal,181
Deniz suyunun yükselmesinin kıyı bölgeleri üzerindeki potansiyel etkileri nelerdir?,"Deniz suyunun yükselmesi, kıyı bölgelerinde su baskınlarına, erozyona ve yerleşim yerlerinin sular altında kalmasına neden olabilir.",Yansıtıcı,181
Bu metnin ana fikri nedir?,"Bu metnin ana fikri, doğal kaynakların bilinçli kullanılmasının önemi ve küresel ısınmanın olası sonuçlarına karşı duyarlı olunmasıdır.",Özetleme,181
Haberde kaynakların bilinçsiz kullanımının sonucu olarak hangi canlı türlerinin yok olduğu veya yok olma tehlikesiyle karşı karşıya kaldığı soruluyor?,"Haberde doğrudan hangi canlı türlerinin yok olduğu veya yok olma tehlikesiyle karşı karşıya kaldığı belirtilmemektedir. Bu, haberin okuyuculara sorduğu bir sorudur.",Olgusal,182
"Yok olma tehlikesi bulunan canlıların devamlılığını sağlamak için neler yapılması gerektiği sorusu, haberde ne amaçla sorulmaktadır?","Bu soru, okuyucuları konu hakkında düşünmeye ve çözüm önerileri geliştirmeye teşvik etmek amacıyla sorulmaktadır.",Kavramsal,182
Haber ne zaman yayınlanmıştır?,"Haber, 23 Nisan 2018 tarihinde yayınlanmıştır.",Olgusal,182
Haberde küresel ısınmanın vatandaşlar arasında neye sebep olduğu belirtiliyor?,Haberde küresel ısınmanın vatandaşlar arasında merak konusu olduğu belirtiliyor.,Nedensel,182
Küresel ısınma hakkında bilgi edinmek isteyen vatandaşlar hangi soruları sorguluyor?,"Vatandaşlar küresel ısınmanın ne olduğunu, nedenlerini ve sonuçlarını sorguluyor.",Listeleme,182
Haberin ana konusu nedir?,"Haberin ana konusu, dünyadaki doğal yaşamı tehdit eden küresel ısınma ve kaynakların bilinçsiz kullanımının canlı türleri üzerindeki etkileridir.",Özetleme,182
Haberde küresel ısınmanın tanımı yapılıyor mu?,"Haberde küresel ısınmanın tanımı doğrudan yapılmıyor, ancak vatandaşların bu konuda bilgi edinmek istediği belirtiliyor.",Olgusal,182
Haberde yok olma tehlikesi altındaki canlı türlerinin devamlılığını sağlamak için somut adımlar öneriliyor mu?,"Haberde somut adımlar önerilmiyor, ancak bu konuda ne yapılması gerektiği sorusu okuyuculara yöneltiliyor.",Analitik,182
Eğer kaynaklar bilinçsizce kullanılmaya devam ederse ne olur?,"Eğer kaynaklar bilinçsizce kullanılmaya devam ederse, daha fazla canlı türü yok olma tehlikesiyle karşı karşıya kalabilir ve doğal yaşam zarar görebilir.",Varsayımsal,182
Haberde küresel ısınmanın sonuçları hakkında bilgi var mı?,"Haberde küresel ısınmanın sonuçları hakkında doğrudan bilgi verilmiyor, ancak vatandaşların bu konuda bilgi edinmek istediği belirtiliyor.",Olgusal,182
Bu haberin amacı nedir?,"Bu haberin amacı, okuyucuların dikkatini küresel ısınma ve kaynakların bilinçsiz kullanımının sonuçlarına çekmek ve onları bu konularda düşünmeye teşvik etmektir.",Kavramsal,182
Haberde yer alan 'etkinlik zamanı' ifadesi ne anlama geliyor?,"'Etkinlik zamanı' ifadesi, haberin okuyucuları harekete geçmeye ve belirtilen sorunlar üzerinde düşünmeye teşvik ettiğini gösteriyor.",Bağlamsal,182
Haberde bahsedilen sorunların çözümü için bireysel olarak neler yapılabilir?,"Bireysel olarak enerji tasarrufu yapmak, geri dönüşüme önem vermek, bilinçli tüketim yapmak ve çevre konusunda farkındalık yaratmak gibi adımlar atılabilir.",Yöntemsel,182
"Haberdeki soruların amacı, okuyucuları hangi konular üzerinde düşünmeye sevk etmektir?","Haberdeki soruların amacı, okuyucuları küresel ısınma, kaynakların bilinçsiz kullanımı ve canlı türlerinin korunması gibi konular üzerinde düşünmeye sevk etmektir.",Yansıtıcı,182
Küresel ısınma ve canlı türlerinin yok olması konularında insanların farklı görüşleri olabilir mi? Neden?,"Evet, bu konularda insanların farklı görüşleri olabilir. Bazı insanlar küresel ısınmanın insan kaynaklı olduğuna inanırken, bazıları doğal süreçlerin etkisiyle oluştuğunu düşünebilir. Benzer şekilde, canlı türlerinin yok olmasının nedenleri ve öncelikleri konusunda da farklı görüşler olabilir.",Spekülatif,182
"Bir ülkenin kaynaklarının zengin olması, o ülkenin gelişmişlik seviyesi hakkında kesin bir bilgi verir mi? Neden?","Hayır, bir ülkenin kaynaklarının zengin olması tek başına o ülkenin gelişmiş ve refah seviyesi yüksek olduğunu göstermez. Kaynakların nasıl kullanıldığı, yönetildiği ve ekonomiye nasıl entegre edildiği de önemlidir.",Kavramsal,183
Yatırım nedir?,"Yatırım, belirli bir kaynağın gelir sağlamak amacıyla kalıcı bir biçimde kullanılmasıdır.",Olgusal,183
Yatırım ve pazarlamanın başarıya ulaşması için hangi unsurlar önemlidir?,"Yatırım yapılan yerde bol miktarda ham madde olması, ham maddeden elde edilecek ürüne yakın çevrenin ihtiyaç duyması, ürünün taşınmasına engel durumun olmaması, yatırımın yapılacağı yerin yeryüzü şekillerinin uygun olması, iklim şartlarının yatırıma uygun olması, gerekli enerji kaynaklarının olması, uygun pazarlama stratejilerinin uygulanabilir olması, ürünün genel ağ üzerinden tanıtılması, taşınma ve kullanma kolaylığının olması, küresel ısınmaya neden olmaması, çevreyi kirletmemesi, canlılara zarar vermemesi, kaliteli üretim yapılması, uzman kişilerden destek alınması ve ürünün tüm dünyada ihtiyaç duyulan bir ürün olması gibi unsurlar önemlidir.",Listeleme,183
Ham madde nedir?,"Ham madde, bir maddenin işlenmeden önceki doğal durumudur.",Olgusal,183
Sermaye ne anlama gelir?,"Sermaye, bir ticaret işinin kurulması, yürütülmesi için gereken anapara ve paraya çevrilebilir malların tamamıdır.",Olgusal,183
İş gücü kavramı neyi ifade eder?,"İş gücü, ekonomik mal ve hizmetlerin üretimi için emek ortaya koyabilen çalışan nüfustur.",Olgusal,183
Pazarlama nedir?,"Pazarlama, bir ürünün, bir malın, bir hizmetin satışını geliştirmek amacıyla tanıtmayı, paketlemeyi, satış elemanlarının yetişmesini, piyasa gereksinimlerini belirlemeyi ve karşılamayı içeren etkinliklerin bütünüdür.",Olgusal,183
Bir yatırımın başarılı olması için yeryüzü şekillerinin uygun olması neden önemlidir?,"Yeryüzü şekillerinin uygun olması, yatırımın yapılacağı alanın inşaat maliyetlerini düşürebilir, ulaşım imkanlarını kolaylaştırabilir ve doğal afet riskini azaltabilir. Bu da yatırımın verimliliğini ve sürdürülebilirliğini artırır.",Nedensel,183
Bir ürünün küresel ısınmaya neden olmaması neden önemlidir?,"Bir ürünün küresel ısınmaya neden olmaması, çevresel sürdürülebilirlik açısından önemlidir. Tüketiciler ve yatırımcılar, çevresel etkiyi azaltan ürünlere daha fazla değer vermektedirler. Ayrıca, çevre dostu ürünler yasal düzenlemelere uyum sağlamak açısından da avantajlıdır.",Nedensel,183
Pazarlama stratejileri neden önemlidir?,"Pazarlama stratejileri, ürün veya hizmetin hedef kitleye etkili bir şekilde ulaşmasını, marka bilinirliğinin artmasını ve satışların yükselmesini sağlar. İyi bir pazarlama stratejisi, rekabet avantajı yaratır ve işletmenin büyümesine katkıda bulunur.",Kavramsal,183
"Gelecekte bir yatırım yapmayı planlasaydınız, hangi faktörleri göz önünde bulundururdunuz?","Gelecekte bir yatırım yapmayı planlasaydım, öncelikle pazar araştırması yaparak talep görecek bir ürün veya hizmet belirlerdim. Ardından, yatırımın yapılacağı yerin uygunluğunu, hammadde kaynaklarına yakınlığını, ulaşım imkanlarını ve yasal düzenlemeleri dikkate alırdım. Son olarak, finansman kaynaklarını ve risk analizini yaparak yatırımın fizibilitesini değerlendirirdim.",Varsayımsal,183
"Yatırım yapılan bir bölgede, gerekli enerji kaynaklarının olması neden önemlidir?","Yatırım yapılan bir bölgede gerekli enerji kaynaklarının olması, üretim süreçlerinin kesintisiz ve verimli bir şekilde yürütülmesini sağlar. Enerji maliyetlerinin düşmesi, ürün maliyetini azaltır ve rekabet gücünü artırır.",Nedensel,183
Ürünün genel ağ (internet) üzerinden tanıtılmasının faydaları nelerdir?,"Ürünün genel ağ üzerinden tanıtılması, geniş bir kitleye ulaşmayı sağlar, tanıtım maliyetlerini düşürür, hedef kitleye özel reklamlar yapma imkanı sunar ve satışları artırır. Ayrıca, müşteri geri bildirimlerini toplamak ve ürün geliştirme süreçlerine dahil etmek için de önemli bir araçtır.",Listeleme,183
Bir yatırım projesinde uzman kişilerden destek almanın önemi nedir?,"Bir yatırım projesinde uzman kişilerden destek almak, olası riskleri minimize etmeye, doğru kararlar almaya ve kaynakları verimli kullanmaya yardımcı olur. Uzmanlar, pazar analizi, finansal planlama, yasal düzenlemeler ve operasyonel süreçler gibi konularda bilgi ve deneyimleriyle projeye değer katarlar.",Kavramsal,183
Yatırım ve pazarlama faaliyetlerinde çevresel faktörlerin dikkate alınmaması durumunda ne gibi sonuçlar ortaya çıkabilir?,"Yatırım ve pazarlama faaliyetlerinde çevresel faktörlerin dikkate alınmaması durumunda, çevresel kirlilik, doğal kaynakların tükenmesi, biyoçeşitliliğin azalması ve insan sağlığına olumsuz etkiler gibi sonuçlar ortaya çıkabilir. Ayrıca, yasal yaptırımlar, tüketici tepkisi ve marka itibarının zarar görmesi gibi ticari sonuçlar da yaşanabilir.",Yansıtıcı,183
Elif ne tür bir proje yapmaya karar vermiştir?,"Elif, bor madeni ile ilgili bir yatırım ve pazarlama projesi yapmaya karar vermiştir.",Olgusal,184
Elif'in yaşadığı yer neresidir ve bu yerin proje için önemi nedir?,"Elif Balıkesir'de yaşamaktadır ve yaşadığı yerde yeterince bor madeni bulunmaktadır, bu da projesi için önemli bir avantajdır.",Bağlamsal,184
"Elif, bor madeninin önemi hakkında ne öğrenmiştir?","Elif, borun ne kadar değerli olduğunu ve dünyada en çok ülkemizde bulunduğunu, ancak bu madenden yeterince yararlanamadığımızı öğrenmiştir.",Kavramsal,184
Projenin amacı nedir?,"Projenin amacı, tüm dünyada gelişen uzay araştırmalarında kullanılacak teknolojide ülkemizin söz sahibi olmasıdır.",Olgusal,184
Bor bileşiklerinin hangi alanda petrol yakıtı yerine kullanıldığı belirtilmiştir?,Bor bileşiklerinin petrol yakıtı yerine kullanıldığı bir otomobilin geliştirildiği belirtilmiştir.,Olgusal,184
Bilim insanları bor yakıtını nasıl tanımlamışlardır?,Bilim insanları bor yakıtını en temiz yakıt olarak tanımlamışlardır.,Olgusal,184
Hayalet uçakların yakıtı neyden elde edilmektedir?,Hayalet uçak olarak bilinen uçakların yakıtlarının bordan elde edildiği belirtilmiştir.,Olgusal,184
Tomahawk füzelerinin imalatında hangi madenden yararlanılmaktadır?,Tomahawk füzelerinin imalatında bordan yararlanılmaktadır.,Olgusal,184
Projenin yatırım aşamasındaki adımlardan bazıları nelerdir?,"Projenin yatırım aşamasındaki adımlardan bazıları şunlardır: madeni çıkaracak bir tesis kurmak, tesiste çalışacak uzman iş gücünü temin etmek, gerekli sermaye için ortaklar bulmak ve yasal işlemleri yerine getirmek.",Listeleme,184
Projenin pazarlama aşamasındaki adımlardan bazıları nelerdir?,"Projenin pazarlama aşamasındaki adımlardan bazıları şunlardır: bor madenini tanıtmak, yatırım tesisini tanıtmak, ürünleri ve kullanım alanlarını tanıtmak, genel ağ ortamında tanıtım ve pazarlama yapmak, ülke içindeki sanayi kuruluşları ile iletişim hâlinde olup onlara ürün satmak ve satılan ürünlere bakım, onarım ve kullanım desteği sağlamak.",Listeleme,184
Bor madeninin uzay teknolojilerindeki potansiyel kullanım alanları neler olabilir?,"Bor madeni, uzay araçlarının yakıtı, ısıya dayanıklı malzemelerin üretimi ve hafif yapısal bileşenlerin geliştirilmesi gibi uzay teknolojilerinde çeşitli alanlarda kullanılabilir.",Spekülatif,184
Elif'in projesinin başarılı olması için hangi faktörler önemlidir?,"Elif'in projesinin başarılı olması için uygun yatırım ortamı, uzman iş gücü, yeterli sermaye, etkili pazarlama stratejileri ve yasal düzenlemelere uyum gibi faktörler önemlidir.",Analitik,184
Bor madeninden elde edilen ürünlere örnekler nelerdir (metinde bahsedilen)?,Metinde bordan üretilmiş deterjanlar ve mutfak eşyaları örnek olarak verilmiştir.,Olgusal,184
Bor madeni projesinin Türkiye ekonomisine ne gibi katkıları olabilir?,"Bor madeni projesi, istihdam yaratma, ihracatı artırma, teknolojik gelişimi teşvik etme ve ülke ekonomisine katma değer sağlama gibi katkılar sağlayabilir.",Yansıtıcı,184
Eğer Elif projesinde ortak bulmakta zorlanırsa ne gibi alternatif çözümler üretebilir?,"Elif projesinde ortak bulmakta zorlanırsa, devlet destekli hibe programlarına başvurabilir, melek yatırımcılardan destek arayabilir veya bankalardan kredi çekebilir.",Varsayımsal,184
Gübre nedir?,"Gübre, bitkilerin beslenebilmesi için gerekli mineralleri bünyesinde barındıran, toprağın fiziksel ve kimyasal yapısını düzenleyerek bitkilerin topraktan daha kolay beslenmesini sağlayan maddedir.",Olgusal,185
Organik gübre nasıl oluşur?,"Organik gübre, hayvan atıklarından, fosillerden ve benzeri maddelerden doğal yollarla oluşur.",Olgusal,185
Solucan gübresi ne tür bir gübredir?,"Solucan gübresi, organik gübreye bir örnektir.",Olgusal,185
Organik gübre ile yetiştirilen domateslerde ne gibi farklılıklar gözlemlenmiştir?,"Organik gübreyle yetiştirilen domateslerde diğerlerine göre daha iri ve parlak olma, bitki boyunda, çiçek sayısında ve çapında belirli oranlarda artış gözlemlenmiştir.",Olgusal,185
Mardin kara yolu üzerinde kurulan organik gübre üretim tesisi kaç dönümlük bir alana kurulmuştur?,Mardin kara yolu üzerinde kurulan organik gübre üretim tesisi 230 dönümlük bir alana kurulmuştur.,Olgusal,185
Organik gübre üretim tesisinin faaliyete geçmesiyle kaç kişiye iş imkanı sağlanması beklenmektedir?,Organik gübre üretim tesisinin faaliyete geçmesiyle 150 kişiye iş imkanı sağlanması beklenmektedir.,Olgusal,185
Üretilecek organik gübre hangi pazarlara sunulacaktır?,"Üretilecek organik gübre, Türkiye ve Avrupa piyasasına doğal ve organik olarak sunulacaktır.",Olgusal,185
"Firmanın genel müdür yardımcısı, organik gübre üretimiyle ilgili ne tür bir iddiada bulunmuştur?","Firmanın genel müdür yardımcısı, üretecekleri organik gübrenin Türkiye’de ilk defa gelişmiş bir teknolojiyle yapılacağını ve bitki ve hayvanlara kesinlikle zarar vermeyeceğini iddia etmiştir.",Olgusal,185
Türkiye'nin organik gübre ihtiyacının ne kadarı ithalat yoluyla karşılanmaktadır?,Türkiye'nin 5.9 milyon tonluk organik gübre ihtiyacının 2 milyon tonu Hindistan'dan ve diğer ülkelerden karşılanmaktadır.,Olgusal,185
"Üretilecek organik gübrenin ne kadarı Türkiye iç piyasasına sunulacak, ne kadarı ihraç edilecektir?","Üretilecek organik gübrenin yüzde 60’ı Türkiye’deki iç piyasaya sunulacak, diğer yüzde 40’lık bölümü ise Avrupa’ya ihraç edilmeyi hedeflenmektedir.",Olgusal,185
Organik gübre üretim tesisinin Şanlıurfa'da kurulmasının nedenleri neler olabilir?,"Şanlıurfa'nın seçilmesinin nedeni, bölgede hayvansal atıkların kolaylıkla temin edilebilmesi ve Türkiye'nin besicilikte önemli bir ülke olmasıdır.",Nedensel,185
Organik gübre kullanımının domatesler üzerindeki etkileri nelerdir?,"Organik gübre kullanımının domatesler üzerindeki etkileri, domateslerin daha iri ve parlak olması, bitki boyunda, çiçek sayısında ve çapında artış gözlemlenmesidir.",Yansıtıcı,185
Organik gübre üretim tesisi için neden Şanlıurfa seçilmiştir?,"Şanlıurfa, hayvansal organik gübre üretimi için uygun bir bölge olarak değerlendirildiği için seçilmiştir. Ayrıca, Türkiye'nin besicilikte önemli bir ülke olması da bu kararda etkili olmuştur.",Nedensel,185
Türkiye'nin organik gübre ihtiyacının karşılanmasında bu yatırımın ne gibi bir etkisi olabilir?,"Bu yatırım, Türkiye'nin organik gübre ihtiyacının bir kısmını yerli üretimle karşılamasına yardımcı olabilir ve ithalat bağımlılığını azaltabilir.",Yansıtıcı,185
Organik gübre üretiminde kullanılan teknoloji neden önemlidir?,"Organik gübre üretiminde kullanılan teknoloji, gübrenin kalitesini artırarak bitkilere daha faydalı olmasını sağlar ve çevreye zarar vermesini önler. Ayrıca, daha verimli bir üretim süreci sağlayabilir.",Kavramsal,185
