question,answer,question_type,page
Türkiye'nin uluslararası alanda önemli roller üstlenmesinde etkili olan kuruluşlar hangileridir?,"Türkiye, Yunus Emre Enstitüsü, Türkiye Maarif Vakfı, Yurtdışı Türkler ve Akraba Topluluklar Başkanlığı (YTB) ve TİKA gibi kuruluşların çalışmaları sonucunda uluslararası alanda önemli roller üstlenmektedir.",Olgusal,266
Türkiye'nin hangi alanlarda aktif bir ülke olduğu belirtilmiştir?,"Türkiye, siyasi, ekonomik, kültürel ve askeri alanlarda aktif bir ülkedir.",Olgusal,266
Yunus Emre Enstitüsü'nün temel amacı nedir?,"Yunus Emre Enstitüsü'nün temel amacı, kültür ve sanat alanında yaptığı çalışmalar ile toplumları birbirine yakınlaştırmaktır.",Kavramsal,266
Türkiye Maarif Vakfı'nın diğer eğitim kurumlarından farkı nedir?,"Türkiye Maarif Vakfı, yurt dışında Türkiye Cumhuriyeti adına T. C. Millî Eğitim Bakanlığı dışında eğitim kurumu açma yetkisine sahip tek kuruluştur.",Analitik,266
Yurtdışı Türkler ve Akraba Topluluklar Başkanlığı (YTB) hangi bölgelere hizmet götürmektedir?,"Yurtdışı Türkler ve Akraba Topluluklar Başkanlığı, Türklerin ve Müslümanların yaşadığı her yere hizmet götürmektedir.",Olgusal,266
Mehmetçiğin Somali'deki faaliyetleri nelerdir?,Mehmetçik Somali'de Somali Silahlı Kuvvetleri'ni eğitmekte ve bölgedeki ihtiyaç sahibi halka Türkiye'nin yardımlarını ulaştırmaktadır.,Olgusal,266
Somali Türk Görev Kuvveti Komutanlığı'nın yerel halka yaptığı yardımlar nelerdir?,"Somali Türk Görev Kuvveti Komutanlığı, yerel halka gıda yardımlarının yanı sıra engellilere tekerlekli sandalye ve protez yardımları da yapmaktadır.",Listeleme,266
Somali'deki yetimhanelere kim destek vermektedir?,"Somali'deki yetimhanelerdeki çocukların rehabilitasyonuna, zaman zaman Anadolu Kışlası'ndaki personel de destek vermektedir.",Olgusal,266
Metinde TİKA'nın faaliyetlerine ek olarak hangi kuruluşların çalışmalarından bahsedilmektedir?,"Metinde TİKA'nın faaliyetlerinin yanı sıra Yunus Emre Enstitüsü, Türkiye Maarif Vakfı ve Yurtdışı Türkler ve Akraba Topluluklar Başkanlığı'nın (YTB) çalışmalarından bahsedilmektedir.",Olgusal,266
Türk askerinin Somali'deki varlığının Somali halkı üzerindeki etkileri nelerdir?,"Türk askerinin Somali'deki varlığı, Somali halkının yüzünde gülümsemeye dönüşmekte ve onlara yardım eli uzatılmaktadır.",Yansıtıcı,266
Türkiye Maarif Vakfı'nın yurt dışındaki eğitim faaliyetlerinin önemi nedir?,"Türkiye Maarif Vakfı'nın yurt dışındaki eğitim faaliyetleri, Türkiye'nin kültürel ve eğitsel etkisini uluslararası alanda yaygınlaştırmasına ve farklı ülkelerdeki öğrencilere kaliteli eğitim imkanı sunmasına olanak tanır.",Kavramsal,266
YTB'nin faaliyetleri neden önemlidir?,"YTB'nin faaliyetleri, yurt dışında yaşayan Türk vatandaşlarının ve akraba toplulukların haklarını korumak, onlara destek sağlamak ve Türkiye ile bağlarını güçlendirmek açısından önemlidir.",Kavramsal,266
Somali'deki Türk Görev Gücü Komutanlığı'nın faaliyetleri sadece askeri eğitimle mi sınırlıdır?,"Hayır, Somali'deki Türk Görev Gücü Komutanlığı'nın faaliyetleri sadece askeri eğitimle sınırlı değildir. Aynı zamanda bölgedeki ihtiyaç sahibi halka yardım ulaştırmakta ve sosyal sorumluluk projeleri yürütmektedir.",Analitik,266
Türkiye'nin uluslararası alanda aktif rol oynamasının potansiyel sonuçları neler olabilir?,"Türkiye'nin uluslararası alanda aktif rol oynaması, ülkenin bölgesel ve küresel etkisini artırabilir, ekonomik ve siyasi ilişkilerini güçlendirebilir ve uluslararası arenada daha fazla söz sahibi olmasına katkıda bulunabilir.",Spekülatif,266
Metinde bahsedilen kuruluşların ortak amacı nedir?,"Metinde bahsedilen kuruluşların ortak amacı, Türkiye'nin uluslararası alandaki etkinliğini artırmak, kültürel bağlarını güçlendirmek, ihtiyaç sahiplerine yardım etmek ve Türkiye'nin olumlu imajını yaymaktır.",Özetleme,266
Kültürün bir toplum için önemi nedir?,"Kültür, bir topluma kimliğini veren değerler zinciridir.",Kavramsal,267
Günümüzde tüm insanlığa mal edilebilecek ortak değerlerden bazıları nelerdir?,"Özgürlük, eşitlik, adalet, demokrasi, insan hakları, dürüstlük ve yardımseverlik günümüzde tüm insanlığa mal edilebilecek ortak değerlerdir.",Listeleme,267
Kültürel yakınlaşmayı sağlayabilecek alanlar hangileridir?,"Sanat, edebiyat, moda ve spor alanlarında yapılan çalışmalar kültürel yakınlaşmayı sağlayabilir.",Listeleme,267
Kültür merkezlerinin en önemli işlevi nedir?,"Kültür merkezlerinin en önemli işlevi, ilgili ülkenin dilinin, kültürünün, sanatının ve tarihinin tanıtılmasına katkıda bulunmaktır.",Olgusal,267
TÜRKSOY ne zaman ve nasıl kurulmuştur?,"TÜRKSOY, 1993 yılında Azerbaycan, Kazakistan, Kırgızistan, Özbekistan, Türkmenistan ve Türkiye Cumhuriyeti kültür bakanları tarafından imzalanan anlaşmayla kurulmuştur.",Olgusal,267
TÜRKSOY'un temel amacı nedir?,"TÜRKSOY'un temel amacı, Türk halklarının gönül birlikteliğini ve kardeşliğini güçlendirmek, ortak Türk kültürünü gelecek nesillere aktarmak ve dünyaya tanıtmaktır.",Olgusal,267
TÜRKSOY'un Türk dünyasındaki rolü nedir?,"TÜRKSOY, Türk Dünyasında sürekli ve kalıcı bir etkileşim sağlamaktadır.",Analitik,267
"Türkiye, kişi başına düşen gelirine göre dünyada en çok yardım yapan ülke olmasının nedeni nedir?","Bu başarı, Türk milletinin devletine ve sivil toplum kuruluşlarına duyduğu güvenle sağlanmıştır.",Nedensel,267
Türkiye'nin Gazze'ye yaptığı insani yardımlar ne kadar miktara ulaşmıştır?,Türkiye'nin Gazze'ye yaptığı insani yardımlar 42 bin tona ulaşmıştır.,Olgusal,267
"Türkiye, Gazze'ye en fazla yardım sağlayan kaçıncı ülkedir?","Türkiye, Gazze'ye en fazla yardım sağlayan ikinci ülkedir.",Olgusal,267
Türkiye'nin Gazze'ye yaptığı yardımların toplam yardımlara oranı nedir?,"Türkiye, Gazze'ye yapılan toplam yardımların yüzde 24'ünü temin etmektedir.",Olgusal,267
"Türkiye, Gazze'ye hangi türde yardımlar sağlamaktadır?","Türkiye, Gazze'ye insani yardım sağlamakta ve ortalama olarak her hafta 127 ton içme suyu Mısır'dan Gazze'ye ulaştırmaktadır.",Listeleme,267
"Türkiye, Gazze'lilere başka ne gibi destekler sağlamaktadır?","Türkiye, 400'ün üzerinde Gazzeli hasta ve yaralının tedavisini üstlenmektedir.",Olgusal,267
Uluslar arasında bilgi paylaşımını kolaylaştıracak araçların geliştirilmesi nasıl bir etki yaratır?,"Uluslar arasında bilgi paylaşımını kolaylaştıracak araçların geliştirilmesi, farklı ulusların kültürlerini birbirine yaklaştırmaktadır.",Nedensel,267
Türkiye'nin insani yardım konusunda bu kadar aktif olmasının uzun vadeli etkileri neler olabilir?,"Türkiye'nin insani yardım konusundaki aktif rolü, uluslararası alanda itibarını artırabilir, diğer ülkelerle ilişkilerini güçlendirebilir ve bölgede barış ve istikrarın sağlanmasına katkıda bulunabilir.",Spekülatif,267
Ülkemizin uluslararası faaliyetlerini hangi alanlarda araştırmamız isteniyor?,"Siyasi, askerî, ekonomik ve kültürel alanlarda ülkemizin uluslararası faaliyetleri araştırılmalıdır.",Olgusal,268
Bu araştırmanın amacı nedir?,"Araştırmanın amacı, Türkiye'nin uluslararası alandaki rollerini anlamak ve bu faaliyetleri ilgili yerlere bildirmektir.",Kavramsal,268
Türkiye'nin dünyadaki rollerini yerine getiren kaç kamu kurum ve kuruluşu araştırılmalıdır?,Türkiye'nin dünyadaki rollerini yerine getiren üç kamu kurum ve kuruluşu araştırılmalıdır.,Olgusal,268
Bu kurum ve kuruluşların faaliyetlerine ne örnek verilmelidir?,Bu kurum ve kuruluşların her birinin faaliyetlerine birer örnek verilmelidir.,Yöntemsel,268
Siyasi alanda Türkiye'nin uluslararası faaliyetlerine bir örnek verebilir misiniz?,"Örneğin, Türkiye'nin Birleşmiş Milletler'deki (BM) diplomatik girişimleri siyasi bir faaliyettir.",Örnekleme,268
Askerî alanda Türkiye'nin uluslararası faaliyetlerine bir örnek verebilir misiniz?,Türkiye'nin NATO bünyesindeki askerî tatbikatlara katılımı askerî bir faaliyettir.,Örnekleme,268
Ekonomik alanda Türkiye'nin uluslararası faaliyetlerine bir örnek verebilir misiniz?,Türkiye'nin diğer ülkelerle yaptığı ticaret anlaşmaları ekonomik bir faaliyettir.,Örnekleme,268
Kültürel alanda Türkiye'nin uluslararası faaliyetlerine bir örnek verebilir misiniz?,Türkiye'nin yurt dışında düzenlediği kültürel etkinlikler ve festivaller kültürel bir faaliyettir.,Örnekleme,268
Bu araştırmayı yaparken hangi kaynaklardan yararlanabiliriz?,"Resmi devlet kurumlarının web siteleri, haber kaynakları ve akademik yayınlar gibi çeşitli kaynaklardan yararlanılabilir.",Yöntemsel,268
Bu araştırmanın sonuçları nereye yazılmalıdır?,"Araştırmanın sonuçları ilgili yerlere yazılmalıdır, ancak metinde ilgili yerlerin neresi olduğu belirtilmemiştir.",Olgusal,268
Türkiye'nin uluslararası alandaki faaliyetlerinin önemi nedir?,"Türkiye'nin uluslararası alandaki faaliyetleri, ülkenin itibarını artırması, ekonomik ilişkilerini geliştirmesi ve bölgesel istikrara katkıda bulunması açısından önemlidir.",Kavramsal,268
Türkiye'nin uluslararası faaliyetlerini etkileyen faktörler nelerdir?,"Türkiye'nin uluslararası faaliyetlerini etkileyen faktörler arasında coğrafi konumu, ekonomik gücü, siyasi istikrarı ve kültürel mirası sayılabilir.",Listeleme,268
Türkiye'nin uluslararası faaliyetlerinin gelecekte nasıl bir değişim göstermesi beklenir?,"Küresel gelişmeler ve Türkiye'nin iç dinamikleri doğrultusunda, uluslararası faaliyetlerin daha da çeşitlenmesi ve derinleşmesi beklenir.",Spekülatif,268
Türkiye'nin uluslararası faaliyetlerine katılımının faydaları nelerdir?,"Türkiye'nin uluslararası faaliyetlere katılımı, ekonomik büyüme, siyasi nüfuz ve kültürel alışveriş gibi çeşitli faydalar sağlar.",Yansıtıcı,268
Türkiye'nin uluslararası faaliyetleri ile ilgili olası zorluklar nelerdir?,"Uluslararası rekabet, siyasi istikrarsızlıklar ve ekonomik dalgalanmalar Türkiye'nin uluslararası faaliyetleri ile ilgili olası zorluklardır.",Analitik,268
Kültürün temel unsurları nelerdir?,"Bir milletin inancı, dili, millet sevgisi, tarihi, müziği, edebiyatı, sanatı ve kısaca tüm birikimi kültürünü oluşturur. Kültür aynı zamanda giyim kuşam alışkanlıkları, gıda tercihleri, evlerin mimarisi, eğitim, yönetim ve hukuk sistemleri gibi yaşamın tüm yanlarını kapsar.",Olgusal,269
Popüler kültürün Türk Dil Kurumu'ndaki tanımı nedir?,"Türk Dil Kurumu, popüler kültür kavramını “belli bir dönem için geçerli olan, hızlı üretilen ve hızlı tüketilen kültürel ögelerin bütünü” olarak tanımlamaktadır.",Olgusal,269
Popüler kültürün kalıcı olmamasının nedeni nedir?,"Popüler kültür üretkenliğin sınırlı kalması nedeniyle kalıcı değildir, yalnızca yaşandığı dönemde geçerlidir.",Nedensel,269
Popüler kültürü yaygınlaştırmada en etkili kitle iletişim aracı hangisidir ve neden?,"Hem göze hem kulağa hitap eden televizyon, kitle iletişim araçları içinde popüler kültürü yaygınlaştırmada en etkili olanlardan biridir.",Analitik,269
Popüler kültürün tüketim alışkanlıklarımız üzerindeki etkileri nelerdir?,"Popüler kültür; tüketim geleneklerimizi, iletişim biçimlerimizi ve zaman kavramımızı fazlasıyla değiştirdi. Artık sosyal medyada daha çok vakit harcıyoruz ve alışveriş merkezlerini temiz havaya tercih ediyoruz.",Yansıtıcı,269
Kültürün kuşaktan kuşağa aktarılmasının önemi nedir?,Kültürü oluşturan değerler kuşaktan kuşağa devredilen sosyal bir miras olarak hayatın içinde yer alır ve yıllarca canlılığını korur. Bir milletin yaşam biçimi olan kültür o milleti diğer milletlerden ayırır.,Kavramsal,269
"Günümüzdeki iletişim araçlarının (genel ağ, televizyon, akıllı telefon, radyo) hayatımızdaki rolü nedir?","Genel ağ, televizyon, akıllı telefon ve radyo artık hiç olmadığı kadar hayatımızın içindedir ve günlük hayatımızda bizi önceleri sıkı sıkıya bağlı olduğumuz değerlerden uzaklaştırabiliyor.",Bağlamsal,269
Popüler kültürün yaygınlaşmasıyla birlikte sosyal hayatta ne gibi değişiklikler gözlemlenmektedir?,"Sosyal medyada daha çok vakit harcıyoruz, alışveriş merkezlerini temiz havaya tercih ediyoruz, buluşma saatlerimizi televizyon dizilerine göre ayarlıyoruz ve birbirimizle sohbet yerine dizilerdeki gelişmeleri konuşuyoruz.",Yansıtıcı,269
Gelenek ve göreneklerin günümüzde azalmasının nedenleri neler olabilir?,"Medyanın etkisiyle popüler kültürün yaygınlaşması, gelenek ve göreneklerin önemini azaltmış ve unutulmasına neden olmuş olabilir.",Spekülatif,269
Kültür ve popüler kültür arasındaki temel farklar nelerdir?,"Kültür, bir milletin uzun yıllar boyunca oluşturduğu kalıcı değerler bütünü iken, popüler kültür belirli bir dönem için geçerli olan, hızlı üretilen ve tüketilen kültürel ögelerdir.",Analitik,269
Alışveriş merkezlerinin tüketim alışkanlıkları üzerindeki etkileri nelerdir?,"Alışveriş merkezleri, insanları tüketmeye teşvik ederek ve farklı ürünlere kolayca ulaşılmasını sağlayarak tüketim alışkanlıklarını artırmaktadır.",Yansıtıcı,269
Medyanın kültürel değerler üzerindeki olumsuz etkilerini azaltmak için neler yapılabilir?,"Medyanın kültürel değerler üzerindeki olumsuz etkilerini azaltmak için kültürel bilinci artıracak eğitimler verilebilir, yerel ve milli değerlere sahip çıkan yapımlar desteklenebilir ve medyanın sorumlu yayıncılık yapması teşvik edilebilir.",Yöntemsel,269
"Eğer popüler kültür olmasaydı, toplumlar nasıl bir değişim gösterirdi?","Eğer popüler kültür olmasaydı, toplumlar geleneksel değerlerine daha bağlı kalabilir, kültürel çeşitlilik daha yavaş değişebilir ve tüketim alışkanlıkları daha farklı bir yönde gelişebilirdi.",Varsayımsal,269
Kültürün bir millet için önemi nedir?,"Kültür, bir milleti diğer milletlerden ayırır, o milletin kimliğini oluşturur ve sosyal bir miras olarak gelecek nesillere aktarılır. Bir milletin yaşam biçimidir.",Kavramsal,269
Popüler kültürün olumlu yönleri olabilir mi?,"Popüler kültürün olumlu yönleri arasında farklı kültürlerin tanınması, yeni trendlerin ortaya çıkması ve hızlı bilgi akışı sayılabilir. Ancak bu olumlu yönler, kültürel değerlerin aşınması gibi olumsuz etkilerle dengelenmelidir.",Spekülatif,269
Metne göre günümüzde hangi alanlarda popüler kültürün etkisiyle yozlaşma görülmektedir?,"Giyim, yeme içme, selamlaşma, hal hatır sorma, alışveriş, çalışma, evlenme, kutlama, iletişim, medya, eğitim, müzik, sanat, mimari, estetik gibi hayatın hemen her alanında popüler kültürün etkisiyle yozlaşma görülmektedir.",Olgusal,270
Popüler kültürün yaygınlaşmasının milli kültüre etkisi nedir?,Popüler kültürün yaygınlaşması sonucu milli kültürümüze ait ögeler değersiz görülmeye başlanmıştır.,Nedensel,270
Popüler kültür en çok kimleri etkilemektedir?,Popüler kültür özellikle gençleri çok fazla etkilemektedir.,Olgusal,270
Popüler kültürün gençlerin davranışları üzerindeki etkileri nelerdir?,"Gençlerin büyüklerin yanında oturuşları, konuşma şekilleri, davranış biçimleri ve saygı kavramının anlamı bile değişmiştir.",Analitik,270
Popüler kültürün aile içi ilişkilere etkisi nasıl olmuştur?,Aile içi ve kuşaklar arası çatışmalar popüler kültürün etkisiyle artmıştır.,Nedensel,270
Popüler kültürün gücü neye benzetilmektedir?,"Popüler kültür, kitleleri peşinde koşturacak ve herkesi birbirine benzetebilecek kadar güçlü durumdadır.",Analitik,270
Popüler kültürün kalıcılığı hakkında ne söylenebilir?,Hayatımızın birçok alanını kuşatan popüler kültür kalıcı değildir.,Olgusal,270
Popüler kültürün sinema ve televizyon yapımlarına etkisi nasıldır?,"Sinema ya da televizyon yapımları, dönemin popüler konularını ele alarak yapılmışsa muhtemelen 20 yıl sonra kimse o yapımları hatırlamayacaktır.",Yansıtıcı,270
Popüler kültürün yayılma ve etkileme süreci nasıl işler?,"Popüler kültür, hızlı şekilde yayılır; bir süre toplumu etkisi altına alır, sindirilir ve bitirilir.",Yöntemsel,270
Popüler kültürün gençlerin giyim tarzları üzerindeki etkisine bir örnek veriniz.,"Popüler kıyafet ne ise, neredeyse tüm gençler benzer şekilde giyinebiliyor.",Olgusal,270
Popüler kültürün müzik tercihleri üzerindeki etkisi nedir?,Popüler şarkılardan neler varsa insanların çoğu o müziği dinliyor ya da bulunduğu ortamlarda dinlemek zorunda kalıyor.,Olgusal,270
Popüler kültürün olumsuz etkilerinden korunmak için neler yapılabilir?,"Metinde bu konuda doğrudan bir bilgi bulunmamaktadır, ancak milli kültüre sahip çıkarak ve eleştirel düşünerek popüler kültürün etkilerini azaltmak mümkün olabilir.",Spekülatif,270
Popüler kültürün yaygınlaşmasıyla birlikte hangi tür çatışmalar artmıştır?,Popüler kültürün etkisiyle aile içi ve kuşaklar arası çatışmalar artmıştır.,Olgusal,270
Metinde popüler kültürün hangi yönleri vurgulanmaktadır?,"Metinde popüler kültürün yozlaştırıcı etkisi, gençleri etkilemesi, milli kültürü değersizleştirmesi ve kalıcı olmaması gibi yönleri vurgulanmaktadır.",Özetleme,270
"Popüler kültürün gençler üzerindeki etkileri düşünüldüğünde, bunun uzun vadeli sonuçları neler olabilir?","Bu soruya metinde net bir cevap bulunmamaktadır, ancak kültürel kimlik kaybı, değerlerin değişmesi ve kuşaklar arası uyumsuzluk gibi sonuçlar doğurabileceği düşünülebilir.",Varsayımsal,270
