question,answer,question_type,page
Soru-cevap oluşturma sürecinde hangi tür soruların sonuçlar veya etkiler hakkında bilgi edinmeyi amaçladığı söylenebilir?,"Yansıtıcı sorular, bir konunun sonuçları veya etkileri hakkında bilgi edinmeyi amaçlar.",Analitik,94
Soru-cevap çiftleri oluşturma görevinde temel amaç nedir?,"Temel amaç, verilen metinden insanların sorabileceği çeşitli türlerde sorular üretmek ve bunlara kapsamlı yanıtlar sağlamaktır.",Olgusal,95
Soru ve cevapların dil tutarlılığı neden önemlidir?,"Dil tutarlılığı, soruların ve cevapların verilen metnin diliyle aynı olmasını sağlayarak, anlaşılabilirliği ve bilginin doğru aktarımını kolaylaştırır.",Kavramsal,95
Hangi türde sorular dahil edilmelidir?,"Olgusal, kavramsal, bağlamsal, nedensel, yöntemsel, analitik, varsayımsal, yansıtıcı, spekülatif, listeleme ve özetleme gibi farklı türlerde sorular dahil edilmelidir.",Listeleme,95
Neden 'Evet' veya 'Hayır' gibi kısa cevaplardan kaçınılmalıdır?,'Evet' veya 'Hayır' gibi kısa cevaplardan kaçınılmalıdır çünkü bu tür cevaplar bilginin ardındaki gerekçeyi anlamak için gerekli bağlamı sağlamaz.,Nedensel,95
Bağlam farkındalığı neden önemlidir?,"Bağlam farkındalığı, tüm soruların verilen metnin içeriğine derinlemesine kök salmasını ve materyalin amacını ve nüanslarını anlamasını sağlar.",Kavramsal,95
Soru-cevap çiftleri oluştururken zorluk dengesi nasıl sağlanmalıdır?,"Basit, orta ve karmaşık sorular dahil edilerek zorluk dengesi sağlanmalıdır, böylece farklı bilgi seviyelerine hitap edilir.",Yöntemsel,95
Yanıt hassasiyeti ne anlama gelir?,"Yanıt hassasiyeti, sağlanan içeriğe dayalı özlü ve doğru yanıtlar vermeyi ifade eder. Yanıtlar, cevabı açıkça açıklamak için yeterli bağlamı içermelidir.",Olgusal,95
Tekrardan kaçınmanın önemi nedir?,"Tekrardan kaçınmak, tüm soruların belirgin ve benzersiz olmasını sağlayarak, gereksiz tekrarı önler ve bilginin daha verimli sunulmasına yardımcı olur.",Kavramsal,95
Metinde bahsedilen soru türlerinden 'nedensel' soruya bir örnek verin.,"'X'e ne sebep olur?' sorusu, metinde bahsedilen nedensel soru türüne bir örnektir.",Olgusal,95
Oluşturulan soru-cevap çiftlerinin kalitesi nasıl değerlendirilir?,"Oluşturulan soru-cevap çiftlerinin kalitesi, dil tutarlılığı, soru çeşitliliği, zorluk dengesi, yanıt hassasiyeti, bağlam farkındalığı ve tekrardan kaçınma gibi kriterlere göre değerlendirilir.",Analitik,95
"Metinde 'X' ile kastedilen nedir, 'X' her zaman aynı şeyi mi ifade eder?",Metinde 'X' genel bir yer tutucudur ve bağlama bağlı olarak farklı anlamlara gelebilir. 'X' her zaman aynı şeyi ifade etmez; içeriğe göre değişir.,Bağlamsal,95
Varsayımsal bir soruya örnek verin.,"'X olursa ne olur?' sorusu, varsayımsal bir soruya örnektir ve hayali senaryoları temel alır.",Olgusal,95
Soru-cevap çifti oluşturma sürecinde hangi adımlar izlenir?,"Süreç, metnin dilini belirleme, farklı türlerde sorular oluşturma, kapsamlı yanıtlar sağlama, zorluk dengesini sağlama, yanıt hassasiyetini sağlama, bağlam farkındalığını sağlama ve tekrardan kaçınma adımlarını içerir.",Yöntemsel,95
"Eğer bu talimatlar olmasaydı, soru-cevap çiftleri oluşturma görevi nasıl farklı olurdu?","Eğer bu talimatlar olmasaydı, soru-cevap çiftleri daha az yapılandırılmış, daha az çeşitli ve potansiyel olarak daha düşük kalitede olabilirdi. Talimatlar, görevin tutarlı ve yüksek kalitede tamamlanmasını sağlar.",Varsayımsal,95
Bu metinden çıkarılacak ana ders nedir?,"Bu metinden çıkarılacak ana ders, yüksek kaliteli soru-cevap çiftleri oluşturmanın, dil tutarlılığı, soru çeşitliliği, zorluk dengesi, yanıt hassasiyeti, bağlam farkındalığı ve tekrardan kaçınma gibi çeşitli faktörlere dikkat etmeyi gerektirdiğidir.",Özetleme,95
Soru-cevap çiftleri oluşturulurken nelere dikkat edilmelidir?,"Soru-cevap çiftleri oluşturulurken dil tutarlılığı, soru çeşitliliği (olgu, kavramsal, bağlamsal, nedensel, yöntemsel, analitik, varsayımsal, yansıtıcı, spekülatif, listeleme, özetleme), zorluk dengesi, yanıt hassasiyeti, bağlam farkındalığı ve tekrardan kaçınma gibi unsurlara dikkat edilmelidir.",Yöntemsel,96
Dil tutarlılığı neden önemlidir?,"Dil tutarlılığı, soruların ve cevapların metnin diliyle aynı olmasını sağlayarak anlaşılabilirliği ve erişilebilirliği artırır.",Nedensel,96
Hangi tür soru çeşitleri dikkate alınmalıdır?,"Olgusal, kavramsal, bağlamsal, nedensel, yöntemsel, analitik, varsayımsal, yansıtıcı, spekülatif, listeleme ve özetleme gibi farklı soru türleri dikkate alınmalıdır.",Listeleme,96
Neden farklı zorluk seviyelerinde sorular oluşturulmalıdır?,"Farklı zorluk seviyelerinde sorular, içeriğin farklı derinliklerde anlaşılmasını sağlayarak hem temel bilgileri test etmeye hem de daha karmaşık düşünmeyi teşvik etmeye olanak tanır.",Nedensel,96
Yanıt hassasiyeti ne anlama gelir?,"Yanıt hassasiyeti, verilen içeriğe dayalı özlü ve doğru yanıtlar vermek anlamına gelir. Yanıtlar, konuyu açıkça açıklamak için yeterli bağlamı sağlamalı, ancak gereksiz ayrıntılardan kaçınmalıdır.",Kavramsal,96
Bağlam farkındalığı neden önemlidir?,"Bağlam farkındalığı, soruların verilen metnin içeriğine derinlemesine kök salmasını ve materyalin amacını ve nüanslarını anlamasını sağlar.",Nedensel,96
Tekrardan kaçınmanın önemi nedir?,"Tekrardan kaçınmak, her sorunun belirgin ve benzersiz olmasını sağlayarak gereksiz tekrarları ve kafa karışıklığını önler.",Nedensel,96
Olgusal sorulara bir örnek verin.,"Örneğin, 'X ne anlama gelir?' gibi belirli bilgileri soran doğrudan sorular olgusal sorulardır.",Örnekleme,96
Kavramsal soruların amacı nedir?,"Kavramsal sorular, içeriğin ardındaki fikirleri ve prensipleri araştırmayı amaçlar.",Kavramsal,96
Bağlamsal sorular neyi hedefler?,"Bağlamsal sorular, konunun daha geniş bağlamı veya arka planı hakkında bilgi edinmeyi hedefler.",Kavramsal,96
Varsayımsal bir soru nasıl formüle edilir?,"Varsayımsal sorular, hayal edilen senaryolara dayalı olarak 'X olursa ne olur?' şeklinde formüle edilebilir.",Yöntemsel,96
Yansıtıcı soruların odak noktası nedir?,"Yansıtıcı sorular, bir konunun sonuçları veya etkileri hakkında bilgi edinmeye odaklanır.",Kavramsal,96
Neden 'Evet' veya 'Hayır' gibi aşırı kısa yanıtlardan kaçınılmalıdır?,"'Evet' veya 'Hayır' gibi aşırı kısa yanıtlardan kaçınılmalıdır çünkü bu tür yanıtlar, bilginin ardındaki gerekçeyi anlamak için gerekli bağlamı sağlamaz.",Nedensel,96
Spekülatif sorular ne tür yanıtlara yol açabilir?,"Spekülatif sorular, uygun olduğunda fikir tabanlı veya keşifsel yanıtlara yol açabilir.",Analitik,96
Soru-cevap çifti oluşturma sürecinde en önemli adımlar nelerdir?,"Soru-cevap çifti oluşturma sürecinde en önemli adımlar; metnin dikkatlice okunması, farklı soru türlerinin belirlenmesi, uygun zorluk seviyesinde soruların oluşturulması, doğru ve kapsamlı cevapların hazırlanması ve son olarak tekrarlardan kaçınılmasıdır.",Özetleme,96
Bu görevin temel amacı nedir?,"Bu görevin temel amacı, verilen metinden yola çıkarak yüksek kaliteli ve çeşitli soru-cevap çiftleri oluşturmaktır.",Olgusal,97
Soru-cevap çiftleri oluşturulurken hangi dilsel tutarlılık sağlanmalıdır?,"Sorular ve cevaplar, verilen metnin diliyle aynı olmalıdır. Örneğin, metin Türkçe ise sorular ve cevaplar da Türkçe olmalıdır.",Kavramsal,97
Hangi farklı soru türleri soru-cevap çiftlerine dahil edilmelidir?,"Olgusal, kavramsal, bağlamsal, nedensel, yöntemsel, analitik, varsayımsal, yansıtıcı, spekülatif, listeleme ve özetleme gibi farklı soru türleri dahil edilmelidir.",Listeleme,97
Neden yanıtlarda 'Evet' veya 'Hayır' gibi aşırı kısa cevaplardan kaçınılmalıdır?,"Aşırı kısa cevaplardan kaçınılmalıdır çünkü yanıt, bilginin ardındaki gerekçeyi anlamak için gerekli bağlamı sağlamalıdır.",Nedensel,97
Yanıtların uzunluğu nasıl olmalıdır?,"Yanıtlar, sağlanan içeriğe dayalı özlü ve doğru olmalıdır. Ancak, yanıtların çok kısa olmaması sağlanmalı; cevabı açıkça açıklamak için yeterli bağlam verirken hala özlü olmalıdırlar.",Yöntemsel,97
Bağlam farkındalığı neden önemlidir?,Bağlam farkındalığı önemlidir çünkü tüm soruların verilen metnin içeriğine derinlemesine kök saldığından ve materyalin amacını ve nüanslarını anladığından emin olunmasını sağlar.,Kavramsal,97
Tekrardan kaçınmanın önemi nedir?,Tekrardan kaçınmak önemlidir çünkü tüm soruların belirgin ve benzersiz olmasını sağlar.,Nedensel,97
Olgusal sorulara bir örnek verin.,"Örneğin, 'X ne anlama gelir?' olgusal bir sorudur.",Olgusal,97
Kavramsal sorular neyi araştırır?,"Kavramsal sorular, içeriğin ardındaki fikirleri araştırır. Örneğin, 'X neden önemlidir?' gibi.",Kavramsal,97
Varsayımsal sorulara bir örnek verin.,"Örneğin, 'X olursa ne olur?' varsayımsal bir sorudur.",Varsayımsal,97
Analitik sorular ne yapar?,"Analitik sorular, karşılaştırma, karşıtlaştırma veya değerlendirme yapar. Örneğin, 'X, Y ile nasıl karşılaştırılır?' gibi.",Analitik,97
Yansıtıcı sorular ne hakkında bilgi ister?,"Yansıtıcı sorular, sonuçlar veya etkiler hakkında bilgi ister. Örneğin, 'X'in hangi etkileri vardır?' gibi.",Yansıtıcı,97
Listeleme sorularının amacı nedir?,"Listeleme sorularının amacı, bir konuyla ilgili öğelerin, adımların veya unsurların bir listesini istemektir. Örneğin, 'X'in temel unsurları nelerdir?' gibi.",Listeleme,97
Özetleme soruları neyi hedefler?,"Özetleme soruları, bir konunun kısa bir özetini veya ana noktalarını sormayı hedefler. Örneğin, 'X'ten çıkarılacak ana ders nedir?' gibi.",Özetleme,97
Soru-cevap çiftlerinin zorluk seviyesi nasıl olmalıdır?,"Soru-cevap çiftlerinin zorluk seviyesi dengeli olmalı, yani basit, orta ve karmaşık soruları içermelidir.",Yöntemsel,97
Bu metnin temel amacı nedir?,"Bu metnin temel amacı, verilen bir metinden yüksek kaliteli soru-cevap çiftleri oluşturmaktır. Bu çiftlerin çeşitli soru türlerini kapsaması ve metnin içeriğine uygun, doğru ve özlü yanıtlar içermesi beklenmektedir.",Olgusal,98
Soru-cevap çiftleri oluşturulurken hangi dilsel tutarlılık gereklidir?,"Soru-cevap çiftleri oluşturulurken, soruların ve cevapların verilen metnin diliyle aynı olması gerekmektedir. Örneğin, metin Türkçe ise sorular ve cevaplar da Türkçe olmalıdır.",Olgusal,98
Neden farklı türde sorular oluşturulması önemlidir?,"Farklı türde sorular oluşturulması, metnin içeriğinin daha kapsamlı bir şekilde anlaşılmasını sağlamak ve çeşitli düşünme becerilerini teşvik etmek için önemlidir. Olgusal, kavramsal, bağlamsal, nedensel, yöntemsel, analitik, varsayımsal, yansıtıcı ve spekülatif gibi farklı soru türleri, konunun farklı açılardan ele alınmasına olanak tanır.",Kavramsal,98
Hangi soru türleri metinde belirtilmiştir?,"Metinde belirtilen soru türleri şunlardır: olgusal, kavramsal, bağlamsal, nedensel, yöntemsel, analitik, varsayımsal, yansıtıcı, spekülatif, listeleme ve özetleme.",Listeleme,98
Yanıtların doğruluğu neden önemlidir?,"Yanıtların doğruluğu, doğru bilgi sunulmasını sağlamak ve yanlış anlamaları önlemek için önemlidir. Verilen içeriğe dayalı özlü ve doğru yanıtlar, kullanıcının metni doğru bir şekilde anlamasına yardımcı olur.",Nedensel,98
Bağlam farkındalığı neden önemlidir?,"Bağlam farkındalığı, soruların ve cevapların verilen metnin içeriğine derinlemesine kök salmasını ve materyalin amacını ve nüanslarını anlamasını sağlamak için önemlidir. Bu, soruların ve cevapların metnin genel anlamıyla tutarlı olmasını ve metinde belirtilen konulara odaklanmasını sağlar.",Nedensel,98
Tekrardan kaçınmanın önemi nedir?,"Tekrardan kaçınmanın önemi, soruların belirgin ve benzersiz olmasını sağlamak ve gereksiz tekrarı önlemektir. Bu, kullanıcının farklı ve ilgili sorular aracılığıyla metni daha verimli bir şekilde keşfetmesine olanak tanır.",Kavramsal,98
"Eğer metin İngilizce olsaydı, soru-cevap çiftleri nasıl oluşturulmalıydı?","Eğer metin İngilizce olsaydı, soru-cevap çiftleri de İngilizce olarak oluşturulmalıydı. Dil tutarlılığı ilkesi, soruların ve cevapların her zaman kaynak metnin diliyle aynı olmasını gerektirir.",Varsayımsal,98
Neden 'Evet' veya 'Hayır' gibi kısa yanıtlardan kaçınılmalıdır?,"'Evet' veya 'Hayır' gibi kısa yanıtlardan kaçınılmalıdır çünkü bu tür yanıtlar, bilginin ardındaki gerekçeyi anlamak için gerekli bağlamı sağlamaz. Cevaplar, konuyu açıkça açıklamak için yeterli bağlamı verirken hala özlü olmalıdır.",Nedensel,98
Bu metinde 'zorluk dengesi' ne anlama gelir?,"Bu metinde 'zorluk dengesi', basit, orta ve karmaşık soruların dahil edilmesi anlamına gelir. Bu, farklı bilgi düzeylerine sahip kullanıcıların metni anlamasına ve farklı düşünme becerilerini geliştirmesine yardımcı olur.",Kavramsal,98
Soru oluştururken hangi hususlara dikkat edilmelidir?,"Soru oluştururken, sorunun açık ve anlaşılır olmasına, metnin içeriğiyle ilgili olmasına, farklı düşünme becerilerini teşvik etmesine ve tekrardan kaçınılmasına dikkat edilmelidir.",Yöntemsel,98
Bu görevin sonuçları nelerdir?,"Bu görevin sonuçları, yüksek kaliteli ve çeşitli soru-cevap çiftleri oluşturarak metnin daha iyi anlaşılmasını sağlamak, farklı düşünme becerilerini teşvik etmek ve kullanıcıların metni daha verimli bir şekilde keşfetmesine olanak tanımaktır.",Yansıtıcı,98
"Metinde bahsedilen soru türlerinden hangisi, neden-sonuç ilişkilerini anlamaya yöneliktir?","Metinde bahsedilen soru türlerinden 'nedensel' sorular, neden-sonuç ilişkilerini anlamaya yöneliktir. Bu tür sorular, bir olayın veya durumun nedenlerini veya sebeplerini sorgular.",Olgusal,98
Bu metni okuyan biri neden soru-cevap çiftleri oluşturmakta zorlanabilir?,"Bu metni okuyan biri, soru türlerini anlama, metnin içeriğine uygun sorular formüle etme veya özlü ve doğru cevaplar verme konularında zorlanabilir. Ayrıca, tekrardan kaçınma ve bağlam farkındalığı gibi hususlara dikkat etmek de zorlayıcı olabilir.",Spekülatif,98
Bu metinden çıkarılacak ana ders nedir?,"Bu metinden çıkarılacak ana ders, yüksek kaliteli soru-cevap çiftleri oluşturmanın, metinlerin daha iyi anlaşılması ve öğrenilmesi için önemli bir araç olduğudur. Soru-cevap çiftleri oluştururken dil tutarlılığına, soru çeşitliliğine, yanıt hassasiyetine, bağlam farkındalığına ve tekrardan kaçınmaya dikkat etmek gerekmektedir.",Özetleme,98
Bu metnin amacı nedir?,"Bu metnin amacı, verilen bir metinden yüksek kaliteli soru-cevap çiftleri oluşturmaktır.",Olgusal,99
Neden farklı türde sorular oluşturulması önemlidir?,"Farklı türde sorular oluşturmak, metnin farklı yönlerini anlamayı ve kapsamlı bir öğrenme deneyimi sağlamayı amaçlar.",Kavramsal,99
Soru-cevap çiftlerinin oluşturulmasında dil tutarlılığı neden önemlidir?,"Dil tutarlılığı, metni okuyan kişinin soruları ve cevapları kolayca anlamasını ve metinle etkileşim kurmasını sağlar.",Nedensel,99
Hangi soru türleri oluşturulmalıdır?,"Olgusal, kavramsal, bağlamsal, nedensel, yöntemsel, analitik, varsayımsal, yansıtıcı, spekülatif, listeleme ve özetleme gibi farklı soru türleri oluşturulmalıdır.",Listeleme,99
Neden cevaplar çok kısa olmamalıdır?,"Cevaplar çok kısa olmamalıdır, çünkü cevabı açıkça açıklamak için yeterli bağlam sağlamaları ve bilginin ardındaki gerekçeyi anlamak için gerekli bilgiyi sunmaları gerekir.",Nedensel,99
Bağlam farkındalığı ne anlama gelir ve neden önemlidir?,"Bağlam farkındalığı, soruların verilen metnin içeriğine derinlemesine kök saldığından ve materyalin amacını ve nüanslarını anladığından emin olmayı ifade eder. Metnin doğru anlaşılması için önemlidir.",Kavramsal,99
Tekrardan kaçınmanın önemi nedir?,"Tekrardan kaçınmak, her sorunun belirgin ve benzersiz olmasını sağlayarak, gereksiz tekrarı önler ve farklı açılardan bilgi edinilmesine olanak tanır.",Nedensel,99
Bu görevde yapay zekanın rolü nedir?,"Bu görevde yapay zekanın rolü, yüksek kaliteli ve çeşitli soru-cevap çiftleri oluşturmaktır.",Olgusal,99
"Eğer cevap 'Evet' veya 'Hayır' ise, ne yapılmalıdır?",'Evet' veya 'Hayır' gibi aşırı kısa cevaplardan kaçınılmalı ve cevabı destekleyen bağlam ve gerekçe sunulmalıdır.,Yöntemsel,99
Soru-cevap çiftleri hangi formatta verilmelidir?,Soru-cevap çiftleri doğrudan JSON formatında verilmelidir.,Olgusal,99
Soru-cevap çiftleri oluşturulurken hangi zorluk seviyeleri dikkate alınmalıdır?,"Soru-cevap çiftleri oluşturulurken basit, orta ve karmaşık zorluk seviyeleri dikkate alınmalıdır.",Yöntemsel,99
Metnin dilinde soru-cevap çiftleri oluşturulmasının nedeni nedir?,"Metnin dilinde soru-cevap çiftleri oluşturulmasının nedeni, anlaşılabilirliği ve erişilebilirliği artırmaktır.",Nedensel,99
Varsayımsal bir soru örneği verin.,"Eğer bu metinde farklı soru türleri belirtilmemiş olsaydı, soru-cevap çiftleri ne kadar etkili olurdu?",Varsayımsal,99
Soru çeşitliliğinin öğrenme üzerindeki etkileri nelerdir?,"Soru çeşitliliği, öğrenme sürecini daha ilgi çekici hale getirir, farklı düşünme becerilerini geliştirir ve bilginin daha derinlemesine anlaşılmasını sağlar.",Yansıtıcı,99
Bu yaklaşımın potansiyel dezavantajları neler olabilir?,"Bu yaklaşımın potansiyel dezavantajları, doğru ve bağlamsal olarak uygun sorular oluşturmanın zorluğu ve zaman alıcı olması olabilir.",Spekülatif,99
Soru-cevap çiftleri oluşturmanın temel amacı nedir?,"Soru-cevap çiftleri oluşturmanın temel amacı, verilen bir metinden çeşitli ve yüksek kaliteli sorular üretmek ve bunlara kapsamlı yanıtlar sağlamaktır.",Olgusal,100
Soru oluşturma sürecinde hangi soru türleri dikkate alınmalıdır?,"Oluşturma sürecinde olgusal, kavramsal, bağlamsal, nedensel, yöntemsel, analitik, varsayımsal, yansıtıcı, spekülatif, listeleme ve özetleme gibi farklı soru türleri dikkate alınmalıdır.",Listeleme,100
Neden sorular ve cevaplar metnin diliyle aynı olmalıdır?,"Sorular ve cevaplar metnin diliyle aynı olmalıdır çünkü dil tutarlılığı, içeriğin daha iyi anlaşılmasını ve bilginin daha etkili bir şekilde aktarılmasını sağlar.",Nedensel,100
Kavramsal soruların amacı nedir?,"Kavramsal soruların amacı, içeriğin ardındaki temel fikirleri ve kavramları derinlemesine araştırmaktır.",Kavramsal,100
Bağlamsal sorular neden önemlidir?,"Bağlamsal sorular, konunun daha geniş çerçevesini ve arka planını anlamamıza yardımcı oldukları için önemlidir.",Kavramsal,100
Soru-cevap çiftlerinde zorluk dengesi nasıl sağlanmalıdır?,"Soru-cevap çiftlerinde zorluk dengesi, basit, orta ve karmaşık soruları dahil ederek sağlanmalıdır.",Yöntemsel,100
Yanıtların çok kısa olmamasının nedeni nedir?,"Yanıtların çok kısa olmaması, bilginin ardındaki gerekçeyi anlamak için yeterli bağlamı sağlamak ve cevabı açıkça açıklamak amacıyla önemlidir.",Nedensel,100
"""Evet"" veya ""Hayır"" gibi kısa yanıtlardan neden kaçınılmalıdır?","""Evet"" veya ""Hayır"" gibi kısa yanıtlardan kaçınılmalıdır çünkü bu tür yanıtlar, bilginin ardındaki gerekçeyi anlamak için gerekli olan bağlamı sağlamaz.",Nedensel,100
"Metinde ""bağlam farkındalığı"" ne anlama gelir?","Metinde ""bağlam farkındalığı"", tüm soruların verilen metnin içeriğine derinlemesine kök saldığından ve materyalin amacını ve nüanslarını anladığından emin olmak anlamına gelir.",Olgusal,100
Tekrardan kaçınmanın önemi nedir?,"Tekrardan kaçınmanın önemi, tüm soruların belirgin ve benzersiz olmasını sağlayarak gereksiz tekrarı önlemek ve öğrenme deneyimini zenginleştirmektir.",Kavramsal,100
Varsayımsal sorular ne tür senaryolara dayanır?,"Varsayımsal sorular, hayal edilen senaryolara dayalıdır ve genellikle ""X olursa ne olur?"" gibi ifadeler içerir.",Olgusal,100
Analitik soruların amacı nedir?,"Analitik soruların amacı, farklı unsurları karşılaştırmak, karşıtlaştırmak veya değerlendirmek ve aralarındaki ilişkileri anlamaktır.",Kavramsal,100
Yansıtıcı sorular ne hakkında bilgi sağlar?,"Yansıtıcı sorular, bir konunun sonuçları veya etkileri hakkında bilgi sağlar.",Olgusal,100
Spekülatif soruların doğası nasıldır?,"Spekülatif sorular, uygun olduğunda fikir tabanlı veya keşifseldir ve genellikle kesin cevapları olmayan konuları ele alır.",Olgusal,100
Soru-cevap çiftlerinin kalitesini artırmak için nelere dikkat edilmelidir?,"Soru-cevap çiftlerinin kalitesini artırmak için dil tutarlılığına, soru çeşitliliğine, zorluk dengesine, yanıt hassasiyetine, bağlam farkındalığına ve tekrardan kaçınmaya dikkat edilmelidir.",Listeleme,100
Soru-cevap çifti oluşturmanın amacı nedir?,Verilen metinden insanların sorabileceği çeşitli türlerde sorular üretmek ve bunlara kapsamlı yanıtlar sağlamaktır.,Kavramsal,101
Oluşturulacak soru-cevap çiftlerinde dil tutarlılığı neden önemlidir?,"Soruların ve cevapların, verilen metnin diliyle aynı olması, anlaşılabilirliği ve tutarlılığı sağlar.",Nedensel,101
Hangi türde sorular oluşturulmalıdır?,"Olgusal, kavramsal, bağlamsal, nedensel, yöntemsel, analitik, varsayımsal, yansıtıcı, spekülatif, listeleme ve özetleme gibi farklı türlerde sorular oluşturulmalıdır.",Listeleme,101
Neden 'Evet' veya 'Hayır' gibi kısa cevaplardan kaçınılmalıdır?,"'Evet' veya 'Hayır' gibi kısa cevaplar, bilginin ardındaki gerekçeyi anlamak için gerekli bağlamı sağlamaz.",Nedensel,101
Bağlam farkındalığı ne anlama gelir ve neden önemlidir?,"Bağlam farkındalığı, tüm soruların verilen metnin içeriğine derinlemesine kök saldığından ve materyalin amacını ve nüanslarını anladığından emin olmayı ifade eder. Bu, soruların ve cevapların ilgili ve anlamlı olmasını sağlar.",Kavramsal,101
Soru-cevap çiftleri oluşturulurken nelere dikkat edilmelidir?,"Dil tutarlılığına, soru çeşitliliğine, zorluk dengesine, yanıt hassasiyetine, bağlam farkındalığına ve tekrardan kaçınmaya dikkat edilmelidir.",Listeleme,101
Olgusal sorulara bir örnek verin.,'X ne anlama gelir?' gibi belirli bilgileri soran doğrudan sorular olgusal sorulardır.,Olgusal,101
Kavramsal soruların amacı nedir?,"Kavramsal sorular, içeriğin ardındaki fikirleri ve prensipleri araştırmayı amaçlar.",Kavramsal,101
"'X, Y ile nasıl karşılaştırılır?' sorusu hangi soru türüne girer?","'X, Y ile nasıl karşılaştırılır?' sorusu analitik soru türüne girer.",Analitik,101
'X olursa ne olur?' gibi varsayımsal sorular neden önemlidir?,"'X olursa ne olur?' gibi varsayımsal sorular, farklı senaryoların olası sonuçlarını değerlendirmeye yardımcı olur.",Nedensel,101
Yansıtıcı sorular neyi hedefler?,"Yansıtıcı sorular, bir konunun sonuçları veya etkileri hakkında derinlemesine düşünmeyi hedefler.",Kavramsal,101
Neden tüm soruların benzersiz olması gerekir?,"Tüm soruların benzersiz olması, tekrardan kaçınmayı ve içeriğin farklı yönlerini ele almayı sağlar.",Nedensel,101
Zorluk dengesi neden önemlidir?,"Zorluk dengesi, farklı bilgi seviyelerine sahip kişilerin içeriği anlamasına yardımcı olur.",Nedensel,101
Yanıt hassasiyeti ne anlama gelir?,"Yanıt hassasiyeti, sağlanan içeriğe dayalı özlü ve doğru yanıtlar vermeyi ifade eder. Ancak yanıtlar, konuyu anlamak için yeterli bağlamı sağlamalıdır.",Kavramsal,101
Metnin amacını anlayan bir soru nasıl olmalıdır?,"Metnin amacını anlayan bir soru, metnin ana fikrini, argümanını veya hedefini yansıtan ve bu doğrultuda bilgi talep eden bir soru olmalıdır.",Bağlamsal,101
Bu metnin temel amacı nedir?,"Bu metnin temel amacı, verilen bir metinden yüksek kaliteli soru-cevap çiftleri oluşturmak için bir yapay zekaya talimatlar vermektir.",Olgusal,102
Soru-cevap çiftleri oluşturulurken hangi dilsel tutarlılık kuralına uyulmalıdır?,"Sorular ve cevaplar, verilen metnin diliyle aynı olmalıdır.",Olgusal,102
Neden farklı türde sorular oluşturmak önemlidir?,"Farklı türde sorular oluşturmak, metnin içeriğini çeşitli açılardan değerlendirmeyi ve anlamayı sağlar. Bu, içeriğin daha kapsamlı bir şekilde anlaşılmasına yardımcı olur.",Kavramsal,102
Metinde belirtilen soru türlerinden bazıları nelerdir?,"Metinde belirtilen soru türlerinden bazıları şunlardır: olgusal, kavramsal, bağlamsal, nedensel, yöntemsel, analitik, varsayımsal, yansıtıcı, spekülatif, listeleme ve özetleme.",Listeleme,102
Yanıtların 'Evet' veya 'Hayır' gibi aşırı kısa olmaması neden önemlidir?,"'Evet' veya 'Hayır' gibi aşırı kısa yanıtlar, bilginin ardındaki gerekçeyi anlamak için gerekli bağlamı sağlamaz. Bu nedenle, yanıtlar daha açıklayıcı olmalıdır.",Nedensel,102
