question,answer,question_type,page
Selim Bey'in muhtarla tartışmasının nedeni nedir?,"Selim Bey'in muhtarla tartışmasının nedeni, sabah muhtara giderek işini ihmal ettiğini söylemesidir.",Nedensel,48
İnsanların yaşamları boyunca üstlendikleri rollerde zaman içinde nasıl bir değişim gözlemlenir?,"İnsanlar yaşamları boyunca farklı roller üstlenirler ve bu roller zaman içinde değişebilir. Örneğin, çocuklukta öğrenci olan biri, büyüdüğünde iş insanı, eş, ebeveyn gibi farklı rollere sahip olabilir.",Yansıtıcı,48
Rollerin zaman içinde değişmesi ne anlama gelir?,"Rollerin zaman içinde değişmesi, bireylerin yaşları, yaşam koşulları ve sosyal çevrelerindeki değişikliklere bağlı olarak farklı sorumluluklar ve görevler üstlenmeleri anlamına gelir.",Kavramsal,48
Eğer Selim Bey dilekçeyi belediyeye vermeseydi ne olurdu?,Bu durumda sorunun çözümü için resmi bir başvuru yapılmamış olurdu ve sorunun çözümü gecikebilirdi veya hiç çözülmeyebilirdi.,Varsayımsal,48
Birey ve toplum arasındaki ilişkiyi anlamak neden önemlidir?,"Birey ve toplum arasındaki ilişkiyi anlamak, toplumsal uyumu sağlamak, bireylerin haklarını korumak ve toplumsal sorunlara çözüm bulmak için önemlidir.",Kavramsal,48
Türk milletinin cenazelerde ve düğünlerdeki davranışları hangi özelliği ile ilgili değildir?,"Türk milletinin cenazelerde taziyeye gitmesi, yemek yapıp götürmesi, düğünlerde mutluluklara ortak olması şahsi menfaatler ile ilgili değildir. Birlik ve beraberlik, sosyal ve kültürel bağ, toplumsal dayanışma ile ilgilidir.",Olgusal,49
Millî kültürü oluşturan unsurlar şemasında '?' olan yerlere yazılabileceklerden hangisi yanlıştır?,"Din, farklı inançtaki milletleri birbirine bağlayan manevi bir köprü değildir. Millî kültürü oluşturan unsurlar arasında dil, sanat ve gelenek yer alır.",Analitik,49
Ön yargı ve kalıp yargı ile ilgili olmayan ifade hangisidir?,"Ön yargı ve kalıp yargı sosyoekonomik yapıya güç kazandırmaz. Aksine toplumlar arası uyumsuzluklara neden olur, insanlar arası iletişimi olumsuz etkiler ve insanların birbirlerine karşı olumsuz düşünceler beslemesine yol açar.",Olgusal,49
"Hak, sorumluluk ve özgürlükler temeline uygun olmayan sorun çözümü örneği hangisidir?","Komşusu gürültü yapan bir kişinin televizyonun sesini sonuna kadar açması, hak, sorumluluk ve özgürlükler temeline uygun bir çözüm değildir. Diğer seçenekler (dilekçe yazma, müşteri haklarına başvurma, kitap toplama kampanyası) bu temele uygundur.",Analitik,49
Türkiye'nin Peru'ya ve Bulgaristan'a destek olması ile Japonya'nın Türkiye'ye prefabrik konut göndermesi ülkeler arası ilişkilerde neyin gelişmesine katkıda bulunmaz?,"Bu örnekler ülkeler arası rekabetin gelişmesine katkıda bulunmaz. Dayanışma, iş birliği ve yardımlaşmanın gelişmesine katkıda bulunur.",Analitik,49
Organ bağışı ile ilgili doğru bilgi hangisidir?,Organ bağışı toplumsal yardımlaşmayı ve dayanışmayı artırır.,Olgusal,49
Türk milletinin gelenek ve göreneklerinin önemi nedir?,"Türk milletinin gelenek ve görenekleri, sosyal ve kültürel bağları güçlendirerek toplumsal dayanışmayı artırır.",Kavramsal,49
Milli kültürü oluşturan unsurlardan dilin rolü nedir?,"Dil, sözlü kültürün yayılmasında önemli bir araçtır ve milli kültürün gelecek nesillere aktarılmasında kritik bir rol oynar.",Kavramsal,49
Ön yargı ve kalıp yargının toplumlar üzerindeki olumsuz etkileri nelerdir?,"Ön yargı ve kalıp yargı, toplumlar arası uyumsuzluklara neden olur ve insanlar arası iletişimi olumsuz yönde etkiler.",Yansıtıcı,49
"Hak, sorumluluk ve özgürlükler kavramları bir sorun çözümünde neden önemlidir?","Hak, sorumluluk ve özgürlükler kavramları, bir sorunun çözümünde adil ve sürdürülebilir sonuçlar elde etmek için önemlidir. Bu kavramlar, bireylerin haklarını korurken toplumun genel refahını da gözetmeyi sağlar.",Kavramsal,49
Ülkeler arası dayanışmanın önemi nedir?,"Ülkeler arası dayanışma, doğal afetler veya kriz zamanlarında ülkelerin birbirlerine destek olmasını sağlayarak uluslararası ilişkileri güçlendirir ve küresel istikrara katkıda bulunur.",Kavramsal,49
Organ bağışının toplumsal dayanışmaya katkısı nasıl açıklanır?,"Organ bağışı, insanların hayatlarını kurtararak ve yaşam kalitelerini artırarak toplumsal dayanışmayı artırır. Bu eylem, insanların birbirlerine karşı duyarlılıklarını ve yardımlaşma duygularını pekiştirir.",Nedensel,49
Cenaze ve düğünlerdeki geleneklerin Türk toplumu için anlamı nedir?,"Cenaze ve düğünlerdeki gelenekler, Türk toplumunda birlik, beraberlik ve dayanışma duygularını pekiştirerek sosyal bağları güçlendirir. Bu gelenekler, toplumun ortak değerlerini ve kültürel mirasını yansıtır.",Kavramsal,49
Milli kültürün gelecek nesillere aktarılmasında geleneklerin rolü nedir?,"Gelenekler, milli kültürün gelecek nesillere aktarılmasında önemli bir rol oynar. Toplumsal değerlerin, inançların ve yaşam biçimlerinin korunarak sonraki kuşaklara aktarılmasını sağlar.",Kavramsal,49
"Hak, sorumluluk ve özgürlüklerin dengeli bir şekilde gözetilmediği bir toplumda ne gibi sorunlar ortaya çıkabilir?","Hak, sorumluluk ve özgürlüklerin dengeli bir şekilde gözetilmediği bir toplumda adaletsizlik, eşitsizlik ve toplumsal huzursuzluk gibi sorunlar ortaya çıkabilir. Bu durum, bireylerin devlete olan güvenini azaltır ve toplumsal düzeni bozabilir.",Yansıtıcı,49
Jean Paul Roux'un Türkler hakkındaki metninde bahsedilen coğrafi koşullar nelerdir?,"Metinde, Türklerin yaşadığı bölgenin ortalama yükseltisi 1200 ile 1400 metre arasında değişen bir yayla olduğu, dağların yüksekliğinin 4000 metrenin üzerinde olduğu, bölgenin az yağış aldığı ve kışın sıcaklığın -50 dereceye kadar düştüğü belirtilmektedir.",Olgusal,50
Türklerin 'güçlüler' olarak adlandırılmasının nedeni metne göre nedir?,"Metne göre Türkler, ülke şartlarının acımasızlığına uyum sağlayabildikleri için 'güçlüler' olarak adlandırılmaktaydılar.",Nedensel,50
Konargöçer Türklerin giyim tarzları hakkında ne biliyoruz?,"Konargöçer Türkler deriden ve yünden yaptıkları pantolon, yelek, kemer, ceket ve gömlekleri giyerlerdi.",Olgusal,50
Konargöçer Türklerin İpek Yolu ticaretindeki rolü neydi?,"Konargöçer Türkler, İpek Yolu ticaretinde yün ve deriden yaptıkları giysileri satarken Çinlilerden ipek kumaşlar satın almışlardır.",Olgusal,50
Hz. Cafer'in Habeş Kralı Necaşi'ye İslamiyet öncesi Arap Yarımadası hakkında verdiği bilgilere göre Arapların durumu nasıldı?,"Hz. Cafer'in verdiği bilgilere göre, İslamiyet öncesi Arap Yarımadası'nda yaşayanlar cahiliye zihniyetine sahipti, putlara tapıyor, ölü hayvan eti yiyor, akrabalık bağlarına riayet etmiyor, komşularına kötülük ediyor ve güçlü olanlar zayıfları eziyordu.",Olgusal,50
İslamiyet öncesi Arap Yarımadası'ndaki yaşam koşulları nasıldı?,"İslamiyet öncesi Arap Yarımadası'nda cehalet hakimdi, insanlar putlara tapıyor ve ahlaki değerlere önem vermiyorlardı.",Kavramsal,50
Türklerin İslamiyet'i kabul etmeleriyle yaşamlarında ne gibi değişiklikler olmuştur?,"Türklerin İslamiyet'i kabul etmeleriyle yerleşik hayat yaygınlaşmış, mimari eserlerde artış yaşanmış ve İslam dinini yaymak için cihat edilmiştir.",Olgusal,50
Türklerin İslamiyet'i kabul etmeleriyle hangi gelenekleri devam ettirmesi beklenir?,"Metinde Türklerin İslamiyet'i kabul ettikten sonra bazı geleneklerini devam ettirdiği belirtilmektedir, ancak hangi geleneklerin devam ettirildiği açıkça belirtilmemiştir.",Çıkarımsal,50
Türklerin Anadolu'yu yurt edinme sürecinde hangi olaylar olumlu etki yaratmıştır?,"Tuğrul ve Çağrı Bey'in Anadolu'ya keşif seferleri yapmaları, Malazgirt Savaşı sonrası Anadolu Türk Beyliklerinin kurulması ve Selçuklu Devleti'nin Miryokefalon Savaşı'nı kazanması Anadolu'nun Türk yurdu olmasını olumlu yönde etkilemiştir.",Olgusal,50
Haçlı Seferleri'nin Anadolu'nun Türkleşme süreci üzerindeki etkisi ne olmuştur?,"Haçlı Seferleri, Anadolu'nun yağmalanmasına neden olarak Anadolu'nun Türkleşme sürecini olumsuz etkilemiştir.",Nedensel,50
Metinde bahsedilen 'cahiliye zihniyeti' ne anlama gelmektedir?,"'Cahiliye zihniyeti', İslamiyet öncesi Arap toplumunda görülen, bilgisizlik, hoşgörüsüzlük ve ahlaki değerlere önem vermeme durumunu ifade etmektedir.",Kavramsal,50
"Türklerin konargöçer yaşam tarzı, ekonomik faaliyetlerini nasıl etkilemiştir?","Türklerin konargöçer yaşam tarzı, hayvancılığa dayalı bir ekonomiye sahip olmalarına ve hayvanlardan elde ettikleri ürünleri ticaret yoluyla değerlendirmelerine olanak sağlamıştır.",Analitik,50
Türklerin İslamiyet'i kabul etmeleri mimariyi nasıl etkilemiştir?,"Türklerin İslamiyet'i kabul etmeleriyle cami, medrese, türbe gibi İslam mimarisine özgü eserlerin yapımı artmıştır.",Nedensel,50
"Eğer Haçlı Seferleri olmasaydı, Anadolu'nun Türkleşme süreci nasıl ilerlerdi?","Haçlı Seferleri'nin Anadolu'nun yağmalanmasına neden olduğu göz önüne alındığında, bu seferler olmasaydı Anadolu'nun Türkleşme sürecinin daha hızlı ve sorunsuz ilerleyeceği varsayılabilir.",Varsayımsal,50
"Metindeki bilgilere göre, Türklerin Anadolu'yu yurt edinme sürecinin temel aşamaları nelerdir?","Metindeki bilgilere göre, Türklerin Anadolu'yu yurt edinme sürecinin temel aşamaları şunlardır: Keşif seferleri, Malazgirt Savaşı'nın kazanılması, Anadolu Türk Beyliklerinin kurulması ve Miryokefalon Savaşı'nın kazanılması.",Listeleme,50
Türklerin Orta Asya'dan göç nedenleri ile ilgili yapılan eşleştirmelerden hangisi doğrudur?,Özgürce yaşayabilecekleri bir yer aramaları siyasi bir nedendir.,Olgusal,51
"İbn Batuta'nın sözleri, Türklerin Anadolu'yu yurt edinme sürecindeki hangi faktör ile ilgilidir?","İbn Batuta'nın sözleri, Türklerin Anadolu'yu yurt edinme sürecindeki sosyokültürel faktör ile ilgilidir. Cömertlik, yabancılara şefkat ve yardımseverlik gibi özellikler sosyokültürel değerlerdir.",Olgusal,51
İpek ve Baharat Yolları medeniyetler arasında ne tür etkileşimlere neden olmuştur?,"İpek ve Baharat Yolları, medeniyetler arasında kültürel, siyasi ve ekonomik etkileşimlere neden olmuştur. Ürün alışverişi, siyasi mücadeleler ve kültürel yayılım bu etkileşimlerin örneklerindendir.",Kavramsal,51
Aşağıdaki medeniyetler arası etkileşim eşleştirmelerinden hangisi yanlıştır? Neden?,"Medeniyetlerin ticaret yolları sayesinde birbirlerine ürünler satmaları askeri bir etkileşim değildir, ekonomik bir etkileşimdir. Bu nedenle bu eşleştirme yanlıştır.",Analitik,51
Haçlı Seferleri sonucunda Avrupalılar İslam dünyasından hangi buluşları öğrenmişlerdir?,"Haçlı Seferleri sonucunda Avrupalılar, İslam dünyasından kâğıt, matbaa, barut, pusula gibi buluşları öğrenmişlerdir.",Olgusal,51
"Haçlı Seferleri ile ilgili verilen bilgiler, aşağıdakilerden hangisi ile ilgili değildir?",Avrupa'daki bazı ülkelerin İslamiyet'i kabul etmeleri Haçlı Seferleri ile ilgili değildir.,Olgusal,51
Bilge Kağan'ın Budizm'i yayma isteğine Tonyukuk neden karşı çıkmıştır?,"Tonyukuk, milli kültürü korumak, oluşabilecek ekonomik zararları engellemek, yaşam tarzlarının değişmesini önlemek ve Türklerin savaşçı özelliklerini kaybetmesini önlemek gibi nedenlerle Bilge Kağan'ın Budizm'i yayma isteğine karşı çıkmıştır.",Nedensel,51
Tonyukuk'un Bilge Kağan'ın Budizm'i yayma isteğine karşı çıkma nedenleri arasında aşağıdakilerden hangisi yer almaz?,"Metinde Tonyukuk'un Bilge Kağan'ın Budizm'i yayma isteğine karşı çıkma nedenleri arasında yer almayan bir seçenek belirtilmemiştir. Verilen tüm seçenekler (A, B, C, D) Tonyukuk'un karşı çıkma nedenleri arasında yer alabilir.",Analitik,51
Türklerin İslamiyet'i kabul etmesi ile birlikte hangi alanlarda değişimler yaşanmıştır?,"Türklerin İslamiyet'i kabul etmesi ile birlikte siyasi, sosyal ve kültürel alanlarda değişimler yaşanmıştır.",Olgusal,51
Türklerin İslamiyet'i kabul etmeden önceki hayatlarına ait özellikler nelerdir?,"Türklerin İslamiyet'i kabul etmeden önceki hayatlarına ait özellikler arasında toplumsal hayatta sözlü hukuk kurallarına göre hareket edilmesi, ülkenin doğu ve batı olmak üzere ikiye ayrılarak yönetilmesi ve yarı göçebe bir yaşam sürülmesi yer almaktadır.",Listeleme,51
"Hükümdar adına cuma namazlarında hutbe okutulması, Türklerin hangi dönemine aittir?","Hükümdar adına cuma namazlarında hutbe okutulması, Türklerin İslamiyet'i kabul etmesinden sonraki döneme aittir.",Olgusal,51
Türklerin İslamiyet'i kabul ettikten sonraki değişimlere hangi örnek verilebilir?,Türklerin İslamiyet'i kabul ettikten sonraki değişimlere hükümdar adına hutbe okutulması örnek olarak verilebilir.,Olgusal,51
İslamiyet'in kabulü Türklerin hangi yaşam tarzlarını etkilemiştir?,"İslamiyet'in kabulü Türklerin siyasi, sosyal ve kültürel yaşam tarzlarını etkilemiştir.",Kavramsal,51
Türklerin İslamiyet öncesi ve sonrası yaşamlarındaki temel farklar nelerdir?,"Türklerin İslamiyet öncesi yaşamlarında sözlü hukuk kuralları, ikili yönetim ve göçebe yaşam tarzı varken, İslamiyet sonrası dönemde hutbe okutulması gibi İslami uygulamalar görülmektedir.",Analitik,51
Türklerin Anadolu'yu yurt edinme sürecinde sosyokültürel faktörlerin önemi nedir?,"Türklerin Anadolu'yu yurt edinme sürecinde sosyokültürel faktörler, yerli halkla etkileşim, kültürel uyum ve toplumsal kabul görme açısından önemlidir. İbn Batuta'nın belirttiği gibi cömertlik ve şefkat gibi değerler bu süreci kolaylaştırmıştır.",Kavramsal,51
Bu ünitenin temel konusu nedir?,Bu ünitenin temel konusu 'Etkin Vatandaşlık'tır.,Olgusal,52
Bu metin hangi yayın tarafından hazırlanmıştır?,Bu metin PRF Yayınları tarafından hazırlanmıştır.,Olgusal,52
Etkin vatandaşlık kavramı neden önemlidir?,"Etkin vatandaşlık, bireylerin toplumun işleyişine aktif olarak katılarak, haklarını ve sorumluluklarını bilerek daha iyi bir toplum oluşturmalarına katkıda bulunduğu için önemlidir.",Kavramsal,52
Bu ünitenin amacı nedir?,"Bu ünitenin amacı, öğrencilere etkin vatandaşlık kavramını öğretmek ve onları bu konuda bilinçlendirmektir.",Kavramsal,52
Etkin vatandaşlık hangi bağlamda belirtilmiştir?,"Metinde etkin vatandaşlık, 6. sınıf müfredatının bir parçası olarak belirtilmiştir.",Bağlamsal,52
Bir bireyi etkin vatandaş yapan unsurlar nelerdir?,"Bu metinde doğrudan belirtilmemiş olsa da, etkin vatandaşlık genellikle haklarını bilme, sorumluluklarını yerine getirme ve toplumsal konulara katılım gibi unsurları içerir.",Yöntemsel,52
Etkin vatandaşlık kavramı pasif vatandaşlık ile nasıl karşılaştırılır?,"Etkin vatandaşlık, bireylerin aktif olarak topluma katılımını ve sorunlara çözüm aramasını içerirken, pasif vatandaşlık sadece yasalara uymayı ve oy kullanmayı kapsar.",Analitik,52
Bireylerin etkin vatandaşlık becerilerini geliştirmeleri için neler yapılabilir?,"Bireylerin etkin vatandaşlık becerilerini geliştirmeleri için eğitimler verilebilir, sivil toplum kuruluşlarına katılım teşvik edilebilir ve toplumsal sorunlara çözüm odaklı yaklaşımlar desteklenebilir.",Yöntemsel,52
Eğer vatandaşlar etkin olmazsa ne gibi sonuçlar ortaya çıkabilir?,"Vatandaşlar etkin olmazsa, toplumda adaletsizlikler artabilir, kamu hizmetleri yetersiz kalabilir ve demokratik süreçler zayıflayabilir.",Varsayımsal,52
Etkin vatandaşlığın toplum üzerindeki etkileri nelerdir?,"Etkin vatandaşlık, daha adil, şeffaf ve katılımcı bir toplumun oluşmasına katkıda bulunur.",Yansıtıcı,52
Neden bazı insanlar etkin vatandaşlık konusunda isteksiz olabilir?,"Bazı insanlar, zaman eksikliği, bilgi yetersizliği, güvensizlik veya toplumsal değişimin mümkün olmadığına dair inanç gibi nedenlerle etkin vatandaşlık konusunda isteksiz olabilirler.",Spekülatif,52
Etkin vatandaşlığın temel unsurları nelerdir?,"Etkin vatandaşlığın temel unsurları arasında bilgi sahibi olma, eleştirel düşünme, iletişim kurma, işbirliği yapma ve sorun çözme becerileri yer alır.",Listeleme,52
Etkin vatandaşlık kavramından çıkarılacak ana ders nedir?,"Etkin vatandaşlık kavramından çıkarılacak ana ders, her bireyin toplumun iyiliği için aktif rol oynaması gerektiğidir.",Özetleme,52
Bu ünite hangi sınıf seviyesi için hazırlanmıştır?,Bu ünite 6. sınıf seviyesi için hazırlanmıştır.,Olgusal,52
Etkin vatandaşlık eğitiminin genç nesiller için önemi nedir?,"Etkin vatandaşlık eğitimi, genç nesillerin bilinçli, sorumluluk sahibi ve topluma katkıda bulunan bireyler olarak yetişmelerini sağlar.",Kavramsal,52
Demokrasi nedir?,"Demokrasi, halkın kendi kendini yönetmesidir. Vatandaşlar seçim yoluyla kendilerini yönetecek kişileri seçerler.",Olgusal,53
Demokrasinin temel ilkeleri nelerdir?,"Demokrasinin temel ilkeleri eşitlik, katılım, özgürlük, çoğunluk, çoğulculuk ve milli egemenliktir.",Listeleme,53
Eşitlik ilkesi demokraside ne anlama gelir?,"Eşitlik ilkesi, tüm yurttaşların kanun önünde eşit haklara sahip olması anlamına gelir.",Olgusal,53
Katılım ilkesi demokraside neden önemlidir?,"Katılım ilkesi, halkın yöneticilerin kararlarını etkilemesini ve gerektiğinde değiştirebilmesini sağlayarak yönetime dahil olmasını sağlar.",Kavramsal,53
Özgürlük ilkesi neyi ifade eder?,"Özgürlük ilkesi, insanların başkalarının özgürlüğünü engellemeden istediği gibi düşünüp inanabilmesini ifade eder.",Olgusal,53
Çoğunluk ilkesi demokraside nasıl işler?,"Çoğunluk ilkesi, seçimlerde en çok oyu alan parti veya kişinin ülkeyi idare etme hakkına sahip olmasını ifade eder.",Yöntemsel,53
Çoğulculuk ilkesinin önemi nedir?,"Çoğulculuk ilkesi, farklı fikirlere saygı gösterilmesi ve bu fikirlerin yönetime yansımasını sağlayarak demokrasinin daha kapsayıcı olmasını sağlar.",Kavramsal,53
Milli egemenlik ne anlama gelir ve nasıl kullanılır?,"Milli egemenlik, yönetme yetkisinin millete ait olması anlamına gelir. Millet bu hakkını seçtiği temsilciler aracılığıyla kullanır.",Olgusal,53
Temsili demokrasi nedir?,"Temsili demokrasi, milletin yönetme hakkını seçtiği temsilciler aracılığıyla kullandığı yönetim şeklidir.",Olgusal,53
Halkın seçtiği temsilciler nerede toplanır ve ne yaparlar?,Halkın seçtiği temsilciler meclis veya parlamento olarak adlandırılan yerde toplanır ve halk adına kararlar alırlar.,Olgusal,53
"Aşağıdakilerden hangisi demokrasinin temel ilkelerinden değildir: Baskı, Eşitlik, Ayrımcılık, Çoğunluk?",Baskı ve Ayrımcılık demokrasinin temel ilkelerinden değildir.,Analitik,53
"Bir ülkede insanlar anayasal sınırlar içinde kalarak istediklerini düşünebiliyor ve inanabiliyorlarsa, bu hangi demokrasi ilkesiyle ilgilidir?",Bu durum özgürlük ilkesiyle ilgilidir.,Bağlamsal,53
Demokraside her görüşe saygı gösterilmesi ve bu görüşlerin siyasi partilerle temsil edilmesine fırsat verilmesi hangi ilkeyle açıklanır?,Bu durum çoğulculuk ilkesiyle açıklanır.,Bağlamsal,53
Nüfusun kalabalık olduğu ülkelerde halkın egemenlik hakkını temsilciler aracılığıyla kullanması ne olarak adlandırılır?,Bu durum temsili demokrasi olarak adlandırılır.,Olgusal,53
"Çoğulculuk ilkesinin uygulandığı, hukukun üstünlüğünün olduğu ve vatandaşların seçme seçilme hakkını kullanarak ülke yönetimine katıldığı yönetim şekli hangisidir?",Bu özelliklere sahip yönetim şekli cumhuriyettir.,Analitik,53
Monarşi nedir?,"Monarşi, ülkeyi yönetme yetkisinin tek bir kişiye ait olduğu yönetim şeklidir.",Olgusal,54
Mutlak monarşi ile meşruti monarşi arasındaki temel fark nedir?,Mutlak monarşide ülkeyi yönetme yetkisi tamamen tek kişiye aittir; meşruti monarşide ise kralın yanında halkın seçtiği bir meclis de yönetimde söz sahibidir.,Analitik,54
Oligarşi ne anlama gelir?,"Oligarşi, ülkeyi yönetme yetkisinin bir gruba ya da azınlığa ait olduğu yönetim şeklidir.",Olgusal,54
Teokrasi hangi ilkelere göre yönetilir?,"Teokrasi, ülkenin dinî kurallara göre yönetildiği yönetim şeklidir.",Olgusal,54
Cumhuriyetin temel özelliği nedir?,"Cumhuriyetin temel özelliği, ülkeyi yönetme yetkisinin halka ait olmasıdır.",Olgusal,54
"Halk, cumhuriyette yönetme yetkisini nasıl kullanır?","Halk, cumhuriyette seçtiği milletvekilleri aracılığıyla yönetme yetkisini kullanır.",Yöntemsel,54
"Bir ülkede teokratik yönetim varsa, bu yönetimin özellikleri nelerdir?","Teokratik yönetimde devlet yönetiminde dinî kurallar etkilidir, yöneticiler tüm işlerini Tanrı adına yaparlar ve yönetimde din adamlarının görüşleri etkilidir.",Listeleme,54
Cumhuriyet yönetiminde halk yöneticilerinden memnun değilse ne olur?,"Cumhuriyet yönetiminde halk, yöneticilerinden memnun olmadığında onları değiştirme yetkisine sahiptir.",Varsayımsal,54
Arda'nın tanımı hangi yönetim şeklini ifade etmektedir?,"Arda'nın tanımı, egemenlik hakkının tek kişiye ait olduğu yönetim biçimi olan monarşiyi ifade etmektedir.",Bağlamsal,54
Müge'nin tanımı hangi yönetim şeklini ifade etmektedir?,"Müge'nin tanımı, devlet yönetiminde dinî kuralların etkili olduğu yönetim biçimi olan teokrasiyi ifade etmektedir.",Bağlamsal,54
Sefa'nın tanımı hangi yönetim şeklini ifade etmektedir?,"Sefa'nın tanımı, egemenliğin bir gruba ya da küçük bir azınlığa ait olduğu yönetim biçimi olan oligarşiyi ifade etmektedir.",Bağlamsal,54
Cumhuriyet yönetiminde ülke yönetiminde görev alan kişiler nasıl belirlenir?,Cumhuriyet yönetiminde ülke yönetiminde görev alan kişiler halk tarafından seçilir.,Yöntemsel,54
Melek Öğretmen'in tahtaya yazdığı açıklama hangi demokrasi ilkesini temsil etmektedir?,"Melek Öğretmen'in tahtaya yazdığı açıklama, yönetme yetkisinin millete verilmesi ve milletin bu hakkını milletvekilleri aracılığıyla kullanması sebebiyle milli egemenlik ilkesini temsil etmektedir.",Bağlamsal,54
Cumhuriyet yönetimini doğru tanımlayan ifadeler nelerdir?,"Cumhuriyet yönetimini doğru tanımlayan ifadeler: Halk yöneticilerini belli bir süreliğine seçer, demokrasi ile ilişkilendirilebilecek bir yönetim biçimidir ve yönetimde halk egemenliği vardır.",Listeleme,54
Teokratik bir yönetimde kuvvetler ayrılığı ilkesi uygulanır mı?,"Hayır, teokratik bir yönetimde kuvvetler ayrılığı ilkesi uygulanmaz. Yönetimde din adamlarının görüşleri etkilidir ve devlet yönetiminde dinî kurallar geçerlidir.",Analitik,54
Demokratik ülkelerde devlet işlerinin düzenli yürütülebilmesi için görev ve sorumluluklar kaç ana güce dağıtılmıştır?,"Demokratik ülkelerde devlet işlerinin düzenli yürütülebilmesi için görev ve sorumluluklar üç ana güce dağıtılmıştır: Yasama, Yürütme ve Yargı.",Olgusal,55
Yasama yetkisi nedir?,"Yasama yetkisi, devletin yasa (kanun) yapma, değiştirme ve yürürlükten kaldırma yetkisidir.",Olgusal,55
Türkiye'de yasama yetkisi hangi kuruma aittir?,Türkiye'de yasama yetkisi Türkiye Büyük Millet Meclisi'ne (TBMM) aittir.,Olgusal,55
TBMM milletvekilleri kimleri temsil eder?,"TBMM milletvekilleri sadece kendi seçildiği bölgeleri değil, tüm milleti temsil ederler.",Olgusal,55
TBMM'nin bazı görev ve yetkileri nelerdir?,"TBMM'nin bazı görev ve yetkileri şunlardır: Kanun yapmak, değiştirmek ve kaldırmak; genel ve özel af ilanına karar vermek; para basılmasına karar vermek; savaş ilanına karar vermek.",Listeleme,55
Anayasa'nın 7. maddesi neyi ifade eder?,"Anayasa'nın 7. maddesi, yasama yetkisinin Türk Milleti adına Türkiye Büyük Millet Meclisi'ne ait olduğunu ve bu yetkinin devredilemeyeceğini ifade eder.",Olgusal,55
Yürütme organı görevlerini yerine getirirken nelere uymak zorundadır?,Yürütme organı görevlerini yerine getirirken anayasaya ve yasalara uymak zorundadır.,Olgusal,55
Yürütme organının yaptığı işlerin hukuka uygunluğunu kim denetler?,Yürütme organının yaptığı işlerin hukuka uygunluğunu Danıştay ve İdare Mahkemeleri gibi yüksek mahkemeler denetler.,Olgusal,55
Güçler ayrılığı ilkesi ne anlama gelir?,"Güçler ayrılığı ilkesi, devletin gücünün ve görevlerinin yasama, yürütme ve yargı organları arasında dağılması anlamına gelir.",Kavramsal,55
Yasama yetkisinin devredilemez olmasının önemi nedir?,"Yasama yetkisinin devredilemez olması, demokrasinin temel prensiplerinden biridir ve gücün tek elde toplanmasını engelleyerek halkın temsilinin korunmasını sağlar.",Kavramsal,55
Yargı organının yürütme organını denetlemesi neden önemlidir?,"Yargı organının yürütme organını denetlemesi, hukukun üstünlüğünü sağlamak ve yönetenlerin keyfi uygulamalarını engelleyerek vatandaşların haklarını korumak için önemlidir.",Kavramsal,55
