question,answer,question_type,page
PRF Yayınları nedir?,Sağlanan metinde PRF Yayınları hakkında herhangi bir bilgi bulunmamaktadır. Bu nedenle PRF Yayınları'nın ne olduğu veya ne yaptığı hakkında bir cevap verilememektedir.,Olgusal,1
PRF Yayınları'nın amacı ne olabilir?,"Metin PRF Yayınları hakkında herhangi bir bilgi içermediğinden, amacının ne olabileceği hakkında spekülasyon yapmak mümkün değildir.",Spekülatif,1
PRF Yayınları ne tür yayınlar yapar?,Metinde PRF Yayınları'nın ne tür yayınlar yaptığına dair bir bilgi bulunmamaktadır.,Olgusal,1
PRF Yayınları'nın hedef kitlesi kimlerdir?,"Metin PRF Yayınları hakkında bilgi içermediğinden, hedef kitlesinin kimler olduğu bilinemez.",Olgusal,1
PRF Yayınları'na nasıl ulaşılabilir?,"Metin PRF Yayınları hakkında hiçbir bilgi içermediğinden, onlara nasıl ulaşılabileceğine dair bir bilgi de bulunmamaktadır.",Yöntemsel,1
PRF Yayınları'nın diğer yayın evlerinden farkı nedir?,"Metin PRF Yayınları hakkında yeterli bilgi sağlamadığı için, diğer yayın evleriyle karşılaştırma yapılamaz.",Analitik,1
PRF Yayınları'nın gelecekteki planları neler olabilir?,"Metin PRF Yayınları hakkında bilgi içermediğinden, gelecekteki planları hakkında varsayımlarda bulunmak mümkün değildir.",Varsayımsal,1
PRF Yayınları'nın yayıncılık sektöründeki önemi nedir?,"Metin PRF Yayınları hakkında herhangi bir bilgi içermediğinden, yayıncılık sektöründeki önemini değerlendirmek mümkün değildir.",Bağlamsal,1
PRF Yayınları hangi bağlamda belirtilmiştir?,Metin sadece 'PRF YAYINLARI' ifadesini içermektedir. Herhangi bir bağlam belirtilmemiştir.,Bağlamsal,1
PRF Yayınları hakkında daha fazla bilgi nerede bulunabilir?,Metinde PRF Yayınları hakkında daha fazla bilgiye nereden ulaşılabileceğine dair bir ipucu bulunmamaktadır.,Yöntemsel,1
PRF Yayınları'nın web sitesi var mı?,Metin PRF Yayınları hakkında hiçbir bilgi içermediği için web sitesi olup olmadığı bilinmemektedir.,Olgusal,1
PRF Yayınları'nın logosu nasıldır?,Metinde PRF Yayınları hakkında bilgi bulunmadığından logosu hakkında bir bilgi de bulunmamaktadır.,Olgusal,1
PRF Yayınları'nın bastığı kitapların konuları nelerdir?,"Metinde PRF Yayınları hakkında bilgi olmadığı için, bastığı kitapların konuları hakkında da bir bilgi bulunmamaktadır.",Olgusal,1
PRF Yayınları'nın misyonu nedir?,Metin PRF Yayınları ile ilgili herhangi bir misyon bilgisi içermemektedir.,Kavramsal,1
PRF Yayınları'nın okuyucular üzerindeki etkileri nelerdir?,Metin PRF Yayınları hakkında yeterli bilgi sağlamadığı için okuyucular üzerindeki etkilerini değerlendirmek mümkün değildir.,Yansıtıcı,1
Bu metnin temel amacı nedir?,"Bu metnin temel amacı, verilen bir metin için yüksek kaliteli soru-cevap çiftleri oluşturmaktır.",Olgusal,2
Soru-cevap çiftleri oluşturulurken hangi dilsel gerekliliğe dikkat edilmelidir?,"Soru-cevap çiftleri oluşturulurken, soruların ve cevapların verilen metnin diliyle aynı olması gerekmektedir.",Kavramsal,2
Metinde hangi soru türleri belirtilmiştir?,"Metinde belirtilen soru türleri şunlardır: olgusal, kavramsal, bağlamsal, nedensel, yöntemsel, analitik, varsayımsal, yansıtıcı, spekülatif, listeleme ve özetleme soruları.",Listeleme,2
Neden 'Evet' veya 'Hayır' gibi kısa cevaplardan kaçınılmalıdır?,"'Evet' veya 'Hayır' gibi kısa cevaplardan kaçınılmalıdır çünkü cevap, bilginin ardındaki gerekçeyi anlamak için gerekli bağlamı sağlamalıdır.",Nedensel,2
Oluşturulan soruların zorluk seviyesi nasıl olmalıdır?,"Oluşturulan soruların zorluk seviyesi dengeli olmalı, yani basit, orta ve karmaşık soruları içermelidir.",Yöntemsel,2
Bağlam farkındalığı neden önemlidir?,Bağlam farkındalığı önemlidir çünkü tüm soruların verilen metnin içeriğine derinlemesine kök saldığından ve materyalin amacını ve nüanslarını anladığından emin olunması gerekir.,Kavramsal,2
Soru-cevap çiftleri oluşturulurken tekrardan kaçınmanın önemi nedir?,Soru-cevap çiftleri oluşturulurken tekrardan kaçınmak önemlidir çünkü tüm soruların belirgin ve benzersiz olması gerekmektedir.,Kavramsal,2
Varsayımsal bir soru örneği verin.,Varsayımsal bir soru örneği: 'Metinde belirtilen talimatlar dikkate alınmasaydı ne olurdu?' olabilir.,Varsayımsal,2
Analitik bir soru oluşturun.,"Analitik bir soru: 'Metinde belirtilen soru türleri, diğer soru sınıflandırma yöntemleriyle nasıl karşılaştırılır?' olabilir.",Analitik,2
"Metne göre, iyi bir cevabın özellikleri nelerdir?","Metne göre, iyi bir cevap özlü, doğru, sağlanan içeriğe dayalı olmalı ve bilginin ardındaki gerekçeyi anlamak için yeterli bağlamı sağlamalıdır.",Olgusal,2
Bu görevin başarısı neye bağlıdır?,"Bu görevin başarısı, yüksek kaliteli, çeşitli ve metin içeriğine uygun soru-cevap çiftleri oluşturmaya bağlıdır.",Kavramsal,2
Spekülatif bir soru örneği verin.,Spekülatif bir soru örneği: 'Neden birisi bu tür soru-cevap çiftleri oluşturma görevini zorlayıcı bulabilir?' olabilir.,Spekülatif,2
Soru-cevap çiftlerinin JSON formatında verilmesinin nedeni nedir?,"Soru-cevap çiftlerinin JSON formatında verilmesinin nedeni, verinin yapılandırılmış ve kolayca işlenebilir olmasını sağlamaktır.",Nedensel,2
Metinde belirtilen soru türlerinden bağlamsal sorunun amacı nedir?,"Bağlamsal sorunun amacı, konunun daha geniş bağlamı veya arka planı hakkında bilgi edinmektir.",Kavramsal,2
Özetleme sorusu ne tür bir bilgi arar?,"Özetleme sorusu, bir konunun kısa bir özetini veya ana noktalarını arar.",Olgusal,2
1. Ünitenin başlığı nedir?,1. Ünitenin başlığı 'Birey ve Toplum'dur.,Olgusal,3
Bu kitabın içeriğinde 'Değişen Rollerim' konusu hangi ünite içinde yer almaktadır?,"'Değişen Rollerim' konusu, 'Birey ve Toplum' başlıklı 1. ünite içinde yer almaktadır.",Bağlamsal,3
'Ön Yargıları Kırıyorum' konusunun birey ve toplum ilişkisi açısından önemi nedir?,"'Ön Yargıları Kırıyorum' konusu, bireylerin toplum içindeki etkileşimlerini olumlu yönde etkileyerek daha sağlıklı ve kapsayıcı bir toplum oluşturulmasına katkıda bulunur.",Kavramsal,3
Kitapta 'Birlikte Daha Güçlüyüz' başlığı altında hangi konular ele alınmış olabilir?,"'Birlikte Daha Güçlüyüz' başlığı altında, işbirliği, dayanışma ve toplumsal uyum gibi konuların ele alınmış olması muhtemeldir.",Varsayımsal,3
'Sorunlarımın Çözümünü Biliyorum' başlığı altında hangi becerilerin geliştirilmesi hedeflenmektedir?,"'Sorunlarımın Çözümünü Biliyorum' başlığı altında, problem çözme, karar verme ve eleştirel düşünme gibi becerilerin geliştirilmesi hedeflenmektedir.",Yöntemsel,3
Kitapta yer alan 'Alıştırma - Uygulama' bölümünün amacı nedir?,"'Alıştırma - Uygulama' bölümünün amacı, öğrencilerin öğrendikleri bilgileri pekiştirmelerini ve uygulamaya dökmelerini sağlamaktır.",Kavramsal,3
EBA Pekiştirme Testi ve Ünite Geliştirme Testi ne işe yarar?,"EBA Pekiştirme Testi ve Ünite Geliştirme Testi, öğrencilerin konuları ne kadar anladıklarını ölçmelerine ve eksiklerini belirlemelerine yardımcı olur.",Analitik,3
Süper Test ve Süper Test Çözümleri neden önemlidir?,"Süper Test ve Süper Test Çözümleri, öğrencilerin sınavlara hazırlanmalarına ve farklı soru tiplerini görmelerine yardımcı olduğu için önemlidir.",Kavramsal,3
Yeni Nesil Sorular bölümünün amacı nedir?,"Yeni Nesil Sorular bölümünün amacı, öğrencilerin analitik düşünme ve problem çözme becerilerini geliştirmektir.",Kavramsal,3
2. Ünitenin başlığı nedir?,2. Ünitenin başlığı 'Kültür ve Miras'tır.,Olgusal,3
'Destan ve Yazıtlarda Türkler' konusu hangi dönemi kapsamaktadır?,"'Destan ve Yazıtlarda Türkler' konusu, Orta Asya Türk yaşamını kapsamaktadır.",Bağlamsal,3
'İslamiyet'in Doğuşu ve Değişim' konusunun tarihsel önemi nedir?,"'İslamiyet'in Doğuşu ve Değişim' konusu, dünya tarihini ve özellikle Orta Doğu coğrafyasını derinden etkilemiş bir dönemi anlamak için önemlidir.",Kavramsal,3
'İslamiyet ve Türkler' başlığı altında hangi konular ele alınmaktadır?,"'İslamiyet ve Türkler' başlığı altında, Türklerin İslamiyet'i kabulü ve ilk Türk-İslam devletleri gibi konular ele alınmaktadır.",Listeleme,3
'Yeni Yurt Anadolu' başlığı altında hangi tarihi olaylar işlenmektedir?,"'Yeni Yurt Anadolu' başlığı altında, Büyük Selçuklu Devleti, I. Beylikler Dönemi, Türkiye Selçuklu Devleti, Haçlı Seferleri ve Moğollar gibi tarihi olaylar işlenmektedir.",Listeleme,3
'Medeniyete Yön Veren Yollar' konusunun içeriği hakkında ne söylenebilir?,"'Medeniyete Yön Veren Yollar' konusu, farklı medeniyetlerin etkileşimini ve bu etkileşimin medeniyetlerin gelişimine olan katkısını ele almaktadır.",Özetleme,3
Bu metin ne hakkındadır?,"Bu metin, bir kitabın veya çalışma materyalinin içindekiler bölümüne benzemektedir ve çeşitli üniteler, testler ve alıştırmalar içermektedir.",Özetleme,4
EBA Pekiştirme Testi bu dokümanda kaç kez geçmektedir?,EBA Pekiştirme Testi bu dokümanda iki kez geçmektedir.,Olgusal,4
"""Baştan Sona Testleri"" neyi kapsamaktadır?","""Baştan Sona Testleri"", belirtilen ünitelerin tekrarını kapsamaktadır. İlk test 1 ve 2. üniteleri, ikincisi ise 1, 2 ve 3. üniteleri kapsamaktadır.",Olgusal,4
Bu dokümanda hangi yayınevinin adı geçmektedir?,Bu dokümanda PRF YAYINLARI'nın adı geçmektedir.,Olgusal,4
"""Yeni Nesil Sorular"" bölümünün amacı nedir?","""Yeni Nesil Sorular"" bölümünün amacı, öğrencilerin daha karmaşık ve düşündürücü sorularla karşılaşmasını sağlamaktır.",Kavramsal,4
3. Ünitenin başlığı nedir?,"3. Ünitenin başlığı ""İNSANLAR, YERLER VE ÇEVRELER""dir.",Olgusal,4
"""Ülkemin Güzellikleri Haritada"" başlığı altında hangi konular işlenmektedir?","""Ülkemin Güzellikleri Haritada"" başlığı altında yeryüzü şekilleri ve Türkiye'de görülen iklimler işlenmektedir.",Olgusal,4
"""Süper Test Çözümleri"" bölümü ne işe yarar?","""Süper Test Çözümleri"" bölümü, Süper Testlerdeki soruların doğru cevaplarını ve çözüm yöntemlerini sunarak öğrencilerin anlamadığı noktaları gidermesine yardımcı olur.",Kavramsal,4
Bu doküman en çok hangi konuları içermektedir?,"Bu doküman en çok testleri, alıştırmaları ve coğrafya konularını içermektedir.",Analitik,4
"""Dünya'nın Neresindeyim?"" başlığı altında hangi konulara değinilmektedir?","""Dünya'nın Neresindeyim?"" başlığı altında paralel ve meridyenler, Türkiye'nin coğrafi konumu, kıtalar ve okyanuslar konularına değinilmektedir.",Olgusal,4
Bu dokümanın hedef kitlesi kim olabilir?,"Bu dokümanın hedef kitlesi, coğrafya dersi alan öğrenciler olabilir.",Varsayımsal,4
"""Ülkemin Zenginlikleri Haritada"" bölümünde hangi tür bilgiler yer alması beklenir?","""Ülkemin Zenginlikleri Haritada"" bölümünde, Türkiye'nin doğal kaynakları, ekonomik faaliyetleri ve bu faaliyetlerin harita üzerindeki dağılımı gibi bilgilerin yer alması beklenir.",Spekülatif,4
Bu dokümanda kaç farklı test türü bulunmaktadır?,"Bu dokümanda EBA Pekiştirme Testi, Ünite Geliştirme Testi, Süper Test ve Baştan Sona Testleri olmak üzere dört farklı test türü bulunmaktadır.",Listeleme,4
"""Çevremizde Kimler Yaşıyor?"" bölümünde hangi konular ele alınabilir?","""Çevremizde Kimler Yaşıyor?"" bölümünde nüfus, yerleşim yerleri, demografik özellikler gibi konular ele alınabilir.",Spekülatif,4
Bu dokümanın amacı nedir?,"Bu dokümanın amacı, öğrencilere coğrafya konularını öğretmek, pekiştirmek ve değerlendirmek için çeşitli materyaller sunmaktır.",Kavramsal,4
4. Ünitenin başlığı nedir?,"4. Ünitenin başlığı Bilim, Teknoloji ve Toplum'dur.",Olgusal,5
4. Ünitede hangi konular işlenmektedir?,"4. Ünitede Sosyal Bilimler ve Toplum, Hayalimdeki Gelecek, Araştırma Yapıyorum, Emek Bir Hazinedir gibi konular işlenmektedir.",Listeleme,5
5. Ünitenin ana teması nedir?,"5. Ünitenin ana teması Üretim, Dağıtım ve Tüketim'dir.",Kavramsal,5
5. Ünitede yer alan 'Kaynaklarımız Kazanca Dönüşüyor' başlığı neyi ifade ediyor olabilir?,"'Kaynaklarımız Kazanca Dönüşüyor' başlığı, doğal veya insan kaynaklarının ekonomik değere dönüştürülmesini ifade ediyor olabilir.",Yorumlayıcı,5
Ünite geliştirme testleri hangi ünitelerde bulunmaktadır?,Ünite geliştirme testleri hem 4. hem de 5. ünitede bulunmaktadır.,Olgusal,5
Metinde 'Yeni Nesil Sorular' ifadesi ne anlama geliyor?,"'Yeni Nesil Sorular' ifadesi, klasik soru tiplerinden farklı, daha çok muhakeme ve problem çözme becerilerini ölçen soruları ifade ediyor olabilir.",Yorumlayıcı,5
Baştan Sona Testleri hangi üniteleri kapsamaktadır?,"Baştan Sona Testleri, 4. üniteye kadar olan konuları (1-4. Üniteler) ve 5. üniteye kadar olan konuları (1-5. Üniteler) kapsamaktadır.",Olgusal,5
Emek neden bir hazine olarak nitelendirilmektedir?,"Emek, bir toplumun gelişimi ve refahı için temel bir unsur olduğu için bir hazine olarak nitelendirilmektedir.",Nedensel,5
Metinde 'PRF Yayınları' ifadesi neyi belirtmektedir?,"'PRF Yayınları' ifadesi, bu metnin veya kitabın yayıncısını belirtmektedir.",Olgusal,5
Vergilerin 'Aydınlık Yarınlara' katkısı nasıl olabilir?,"Vergiler, devletin eğitim, sağlık, altyapı gibi alanlarda yatırım yapmasını sağlayarak toplumun geleceğine katkıda bulunur, bu nedenle 'Aydınlık Yarınlara' katkısı vardır.",Nedensel,5
Nitelikli insan neden güçlü bir Türkiye için önemlidir?,"Nitelikli insan, bilgi ve becerileriyle ülkenin ekonomik, sosyal ve teknolojik gelişimine katkıda bulunduğu için güçlü bir Türkiye için önemlidir.",Nedensel,5
Bu metnin amacı nedir?,"Bu metnin amacı, öğrencilere sosyal bilimler, teknoloji, toplum, üretim, dağıtım ve tüketim gibi konularda bilgi vermek ve bu konularda farkındalık yaratmaktır.",Kavramsal,5
Meslek seçimi neden önemlidir?,"Meslek seçimi, bireyin gelecekteki yaşamını, kariyerini ve mutluluğunu doğrudan etkilediği için önemlidir.",Nedensel,5
Alıştırma - Uygulama bölümlerinin amacı nedir?,"Alıştırma - Uygulama bölümlerinin amacı, öğrencilerin öğrendikleri bilgileri pekiştirmelerini ve uygulamalarını sağlamaktır.",Yöntemsel,5
EBA Pekiştirme Testleri ne işe yarar?,"EBA Pekiştirme Testleri, öğrencilerin Eğitim Bilişim Ağı (EBA) üzerinden öğrendikleri konuları tekrar etmelerini ve bilgilerini pekiştirmelerini sağlar.",Yöntemsel,5
6. Ünitenin başlığı nedir?,6. Ünitenin başlığı Etkin Vatandaşlıktır.,Olgusal,6
7. Ünitede hangi konular ele alınmaktadır?,"7. Ünitede Komşularımız ve Kardeşlerimiz, Ticari İlişkilerimiz, Lider Türkiye ve Kültürümüze Sahip Çıkalım konuları ele alınmaktadır.",Listeleme,6
"""Üç Kuvvet"" başlığı altında hangi konu işleniyor olabilir?","""Üç Kuvvet"" başlığı altında kuvvetler ayrılığı ilkesi veya devletin temel organları olan yasama, yürütme ve yargı kuvvetleri işleniyor olabilir.",Varsayımsal,6
Bu kitabın sonunda hangi ek materyaller bulunmaktadır?,"Bu kitabın sonunda Kavramlar Sözlüğü, Kronoloji ve Cevap Anahtarı bulunmaktadır.",Listeleme,6
Kitaptaki 'Baştan Sona Testleri' neyi amaçlamaktadır?,"'Baştan Sona Testleri', önceki ünitelerde öğrenilen bilgilerin tekrarını ve pekiştirilmesini amaçlamaktadır.",Kavramsal,6
Kitapta 'Yeni Nesil Sorular' neden bulunmaktadır?,"'Yeni Nesil Sorular', öğrencilerin farklı soru tiplerine alışmasını ve analitik düşünme becerilerini geliştirmesini sağlamak amacıyla bulunmaktadır.",Nedensel,6
6. ve 7. ünitelerde ortak olarak bulunan bölümler nelerdir?,"6. ve 7. ünitelerde ortak olarak Alıştırma - Uygulama, EBA Pekiştirme Testi, Ünite Geliştirme Testi, Süper Test, Süper Test Çözümleri ve Yeni Nesil Sorular bölümleri bulunmaktadır.",Analitik,6
Kitaptaki 'Kavramlar Sözlüğü' ne işe yarar?,"'Kavramlar Sözlüğü', kitapta geçen önemli kavramların tanımlarını içererek öğrencilerin anlamakta zorlandığı terimleri öğrenmesine yardımcı olur.",Kavramsal,6
'Lider Türkiye' başlığı altında hangi konular ele alınmış olabilir?,"'Lider Türkiye' başlığı altında Türkiye'nin bölgesel ve küresel önemi, dış politikası ve uluslararası ilişkileri gibi konular ele alınmış olabilir.",Varsayımsal,6
'Hayatın İçinde Demokrasi' bölümünde hangi konulara değinilir?,"'Hayatın İçinde Demokrasi' bölümünde demokrasinin günlük yaşamdaki önemi, katılım, seçimler ve vatandaşların sorumlulukları gibi konulara değinilir.",Varsayımsal,6
Bu kitap hangi yayın evine aittir?,Bu kitap PRF Yayınları'na aittir.,Olgusal,6
'Haklarımın Bilincindeyim' bölümü neden önemlidir?,"'Haklarımın Bilincindeyim' bölümü, vatandaşların haklarını öğrenmesi ve bu hakları savunabilmesi için önemlidir.",Kavramsal,6
'Kadın ve Toplum' bölümünde hangi konular ele alınmaktadır?,"'Kadın ve Toplum' bölümünde kadının toplumdaki yeri, hakları, karşılaştığı sorunlar ve toplumsal cinsiyet eşitliği gibi konular ele alınmaktadır.",Listeleme,6
Kronoloji bölümü neyi amaçlar?,"Kronoloji bölümü, kitapta bahsedilen olayların veya konuların zaman sırasını göstererek öğrencilerin tarihsel bağlamı anlamasına yardımcı olmayı amaçlar.",Kavramsal,6
Bu kitabın amacı nedir?,"Bu kitabın amacı, öğrencilere etkin vatandaşlık, küresel bağlantılar ve ilgili konular hakkında bilgi vermek ve onları bu konularda bilinçlendirmektir.",Kavramsal,6
Metnin başlığı nedir?,Metnin başlığı 'SINIF'tır.,Olgusal,7
Bu metin hangi üniteye aittir?,Bu metin 'BİREY VE TOPLUM' başlıklı 1. üniteye aittir.,Olgusal,7
Metin hangi yayın tarafından hazırlanmıştır?,"Metin, PRF YAYINLARI tarafından hazırlanmıştır.",Olgusal,7
'SINIF' kelimesi bu bağlamda ne anlama gelebilir?,'SINIF' kelimesi bu bağlamda büyük ihtimalle birey ve toplumun katmanlarını veya kategorilerini ifade etmektedir.,Kavramsal,7
Birey ve toplum ilişkisi neden önemlidir?,"Birey ve toplum ilişkisi, toplumsal düzenin sağlanması, bireylerin gelişimi ve toplumun ilerlemesi için önemlidir.",Kavramsal,7
Bu metnin amacı ne olabilir?,"Bu metnin amacı, birey ve toplum arasındaki ilişkiyi incelemek ve bu konudaki temel kavramları açıklamaktır.",Bağlamsal,7
Bireyin toplum üzerindeki etkileri nelerdir?,"Bireyin toplum üzerindeki etkileri, davranışları, düşünceleri ve eylemleri aracılığıyla toplumsal normları, değerleri ve kültürü etkileyebilmesidir.",Nedensel,7
Toplumsal sınıflandırmalar nasıl oluşur?,"Toplumsal sınıflandırmalar, genellikle ekonomik durum, eğitim seviyesi, meslek ve sosyal statü gibi faktörlere göre oluşur.",Yöntemsel,7
Bireycilik ve toplumculuk yaklaşımları arasındaki temel fark nedir?,"Bireycilik, bireyin hak ve özgürlüklerini ön planda tutarken, toplumculuk toplumun refahını ve ortak çıkarlarını ön planda tutar.",Analitik,7
Birey ve toplum arasındaki denge bozulursa ne gibi sorunlar ortaya çıkabilir?,"Birey ve toplum arasındaki denge bozulursa, toplumsal huzursuzluk, eşitsizlik, adaletsizlik ve bireysel memnuniyetsizlik gibi sorunlar ortaya çıkabilir.",Varsayımsal,7
Birey ve toplumun birbirini etkileme şekillerine örnekler nelerdir?,"Bireylerin tüketim alışkanlıkları toplumu etkilerken, toplumun değer yargıları da bireylerin davranışlarını şekillendirir.",Yansıtıcı,7
Neden bazı insanlar toplumun beklentilerine uymakta zorlanabilir?,"Bazı insanlar, farklı değerlere, inançlara veya yaşam tarzlarına sahip oldukları için toplumun beklentilerine uymakta zorlanabilirler.",Spekülatif,7
Birey ve toplum kavramlarını anlamak için hangi temel unsurlara dikkat etmek gerekir?,"Birey ve toplum kavramlarını anlamak için, bireysel haklar, toplumsal sorumluluklar, sosyal adalet ve kültürel farklılıklar gibi temel unsurlara dikkat etmek gerekir.",Listeleme,7
'BİREY VE TOPLUM' ünitesinden çıkarılacak ana fikir nedir?,"'BİREY VE TOPLUM' ünitesinden çıkarılacak ana fikir, bireyin ve toplumun birbirini sürekli olarak etkilediği ve bu ilişkinin sağlıklı bir şekilde sürdürülmesinin önemi olduğudur.",Özetleme,7
Bu ünitenin içeriği hangi disiplinlerle ilişkilendirilebilir?,"Bu ünitenin içeriği, sosyoloji, psikoloji, felsefe ve siyaset bilimi gibi disiplinlerle ilişkilendirilebilir.",Bağlamsal,7
Rol nedir?,"Rol, içinde bulunduğumuz duruma göre sergilediğimiz davranışlar bütününe denir.",Tanımlama,8
Görev nedir?,"Görev, bir grup içinde yer alan bireylerin rollerinin gereğini yerine getirme zorunluluğudur.",Tanımlama,8
İnsanlar neden gruplar oluşturur?,"İnsanlar temel ihtiyaçlarını gidermek, karşılaştığı problemleri çözmek ve ortak amaçlara ulaşmak için gruplar oluşturur.",Nedensel,8
Rollerin yerine getirilmemesi ne gibi sonuçlar doğurur?,Roller yerine getirilmediğinde huzursuzluk ve karmaşa yaşanır.,Sonuçsal,8
Doğuştan sahip olduğumuz rollere örnek veriniz.,"Evlat olmak, doğuştan sahip olduğumuz bir roldür.",Örnekleme,8
Yaşımız ilerledikçe rollerimiz ve sorumluluklarımız değişir mi?,"Evet, yaşımız ilerledikçe bazı rollerimiz ve sorumluluklarımız değişir.",Olgusal,8
Aile içindeki rollerimizi yerine getirirken hangi duygularla hareket etmeliyiz?,"Aile içindeki rollerimizi yerine getirirken sevgi, saygı, dayanışma ve yardımseverlik duygularıyla hareket etmeliyiz.",Yöntemsel,8
Ailenin önemi nedir?,"Aile, sevinçlerimizin ve üzüntülerimizin paylaşıldığı ilk yerdir ve hayatımız boyunca yer alacağımız gruplar içinde en önemlisidir.",Kavramsal,8
Ailenin devamlılığı için neler önemlidir?,"Aile hayatının devamlılığı için sevgi, saygı, dayanışma ve yardımseverlik gibi temel değerleri yerine getirmek önemlidir.",Yöntemsel,8
Neden insanlar sosyal varlıklardır?,İnsanlar sosyal varlıklardır çünkü temel ihtiyaçlarını gidermek ve problemleri çözmek için birbirlerine ihtiyaç duyarlar.,Nedensel,8
"Hangi rolü üstlenmek için daha fazla zaman geçmesi gerekir: Dede, Baba, Teyze, Amca?",Dede rolünü üstlenmek için daha fazla zaman geçmesi gerekir.,Olgusal,8
Aile içi rollerde bencillik ve ön yargılarla hareket etmek ne gibi sonuçlar doğurur?,"Aile içi rollerde bencillik ve ön yargılarla hareket etmek, dayanışma ve yardımlaşma duygularını zedeler ve aile içinde sorunlara yol açabilir.",Varsayımsal,8
Grupların devamlılığı için ne gereklidir?,Grupların devamlılığı için herkesin rollerini yerine getirmesi gereklidir.,Kavramsal,8
Aile hayatının her rol için uygun olmadığı yargısı doğru mudur?,"Hayır, aile hayatının her rol için uygun olmadığı yargısı doğru değildir. Aile, birçok farklı rolün üstlenilebileceği önemli bir ortamdır.",Analitik,8
Metinde bahsedilen roller hangi bağlamda ele alınmaktadır?,"Metinde bahsedilen roller, bireylerin sosyal yaşamdaki farklı durumlarına göre sergiledikleri davranışlar ve bu davranışların gereklilikleri bağlamında ele alınmaktadır.",Bağlamsal,8
Rol ne anlama gelir?,"Rol, görevlerimiz ya da toplumun bizden beklediği davranışlar olarak ifade edilebilir.",Olgusal,9
Mesleki roller ve sosyal roller arasındaki temel fark nedir?,"Mesleki rollere ilişkin beklentiler yazılıdır, sosyal rollere ilişkin beklentiler ise yazılı değildir.",Analitik,9
Farklı gruplarda yer almanın birey üzerindeki etkileri nelerdir?,"Farklı gruplarda yer alarak farklı görevler üstleniriz ve bu görevler grup içindeki rolümüzü belirler. Örneğin, okulda öğrenciyken evde ailemizin çocuğu olabiliriz.",Yansıtıcı,9
Toplumsal hayatta rollerimizi yerine getirmediğimizde ne gibi sorunlar ortaya çıkar?,Rollerimizi yerine getirmediğimizde toplumsal hayatta çeşitli sorunlar ortaya çıkar.,Nedensel,9
Gün içerisinde farklı rolleri nasıl deneyimleriz?,Gün içerisinde dahi rollerin çeşitliliğini yaşayabiliriz; farklı ortamlarda farklı beklentilere yanıt veririz.,Bağlamsal,9
Bir grup üyesi olarak hangi sorumluluklara sahibiz?,Grup üyesi olarak üzerimize düşenleri yapmalı ve rollerimizi yerine getirmeliyiz.,Yöntemsel,9
Sağlıklı ürünler yetiştirmesi beklenen meslek hangisidir?,Çiftçi,Olgusal,9
Hangi mesleğin rolüne ilişkin beklentiler yazılı değildir?,Anne,Olgusal,9
Sonradan sahip olduğumuz rollere örnek verilemeyen hangisidir?,Erkek olmak,Olgusal,9
Toplumsal yaşamda bireylerin ilişki geliştirme sırası nasıldır?,Aile - Akraba - Arkadaş Çevresi,Olgusal,9
Hangi rolü seçme imkanımız yoktur?,Abilik,Olgusal,9
Neden rollerimizi yerine getirmeliyiz?,Toplumsal düzenin sağlanması ve işleyişin devamlılığı için rollerimizi yerine getirmeliyiz.,Kavramsal,9
Sosyal rollerin yazılı olmaması ne anlama gelir?,"Sosyal rollerin yazılı olmaması, bu rollere ilişkin beklentilerin toplumun genel kabul görmüş normlarına ve değerlerine dayandığı anlamına gelir.",Kavramsal,9
Özgür irademizle katıldığımız grupların bize yüklediği rollere örnekler nelerdir?,"Sınıf başkanı olmak, takım kaptanı olmak, işçi olmak gibi roller özgür irademizle katıldığımız grupların bize yüklediği rollere örneklerdir.",Listeleme,9
