question,answer,question_type,page
Soru-cevap çifti oluşturmanın temel amacı nedir?,"Soru-cevap çifti oluşturmanın temel amacı, verilen metinden insanların sorabileceği çeşitli türlerde sorular üretmek ve bunlara kapsamlı yanıtlar sağlamaktır.",Kavramsal,181
Soru-cevap çiftleri oluşturulurken dil tutarlılığı neden önemlidir?,"Dil tutarlılığı, soruların ve cevapların verilen metnin diliyle aynı olmasını sağlayarak, içeriğin daha kolay anlaşılmasını ve bilginin doğru bir şekilde aktarılmasını sağlar.",Nedensel,181
Oluşturulacak soru türleri nelerdir?,"Oluşturulacak soru türleri şunlardır: Olgusal, Kavramsal, Bağlamsal, Nedensel, Yöntemsel, Analitik, Varsayımsal, Yansıtıcı, Spekülatif, Listeleme ve Özetleme.",Listeleme,181
Neden 'Evet' veya 'Hayır' gibi aşırı kısa yanıtlardan kaçınılmalıdır?,"'Evet' veya 'Hayır' gibi aşırı kısa yanıtlardan kaçınılmalıdır çünkü bu tür yanıtlar, bilginin ardındaki gerekçeyi anlamak için gerekli bağlamı sağlamaz ve cevabın yeterince açıklayıcı olmamasına neden olur.",Nedensel,181
"Bağlam farkındalığı, soru oluşturma sürecinde neden önemlidir?","Bağlam farkındalığı, tüm soruların verilen metnin içeriğine derinlemesine kök salmasını ve materyalin amacını ve nüanslarını anlamasını sağlayarak, soruların daha anlamlı ve ilgili olmasını sağlar.",Kavramsal,181
Soru-cevap çiftlerinde hangi zorluk seviyelerinde sorular bulunmalıdır?,"Soru-cevap çiftlerinde basit, orta ve karmaşık zorluk seviyelerinde sorular bulunmalıdır.",Olgusal,181
Yanıt hassasiyeti ne anlama gelir ve neden önemlidir?,"Yanıt hassasiyeti, sağlanan içeriğe dayalı özlü ve doğru yanıtlar vermek anlamına gelir. Bu önemlidir çünkü doğru ve anlaşılır bilgi sunarak kullanıcıların konuyu daha iyi anlamasını sağlar.",Kavramsal,181
Tekrardan kaçınma neden gereklidir?,"Tekrardan kaçınma, tüm soruların belirgin ve benzersiz olmasını sağlayarak, aynı bilginin farklı şekillerde tekrar tekrar sorulmasını önler ve soru-cevap çiftlerinin verimliliğini artırır.",Nedensel,181
Metinde belirtilen soru-cevap çifti sayısı kaçtır?,Metinde belirtilen soru-cevap çifti sayısı 15'tir.,Olgusal,181
Soru oluştururken hangi format kullanılmalıdır?,Soru oluştururken JSON formatı kullanılmalıdır. Markdown işaretlerinden kaçınılmalı ve sadece düz JSON verisi verilmelidir.,Yöntemsel,181
"Eğer metin İngilizce olsaydı, soru ve cevaplar nasıl olmalıydı?","Eğer metin İngilizce olsaydı, soru ve cevaplar da İngilizce olmalıydı. Dil tutarlılığı prensibi gereği, sorular ve cevaplar her zaman metnin diliyle aynı olmalıdır.",Varsayımsal,181
Neden her soru türünden örnekler bulunması önemlidir?,"Her soru türünden örnekler bulunması, içeriğin farklı açılardan incelenmesini sağlayarak, daha kapsamlı bir öğrenme deneyimi sunar.",Nedensel,181
Soru-cevap çiftleri oluşturmanın uzun vadeli etkileri neler olabilir?,"Soru-cevap çiftleri oluşturmanın uzun vadeli etkileri, bilgiye erişimi kolaylaştırmak, öğrenmeyi desteklemek ve karmaşık konuları daha anlaşılır hale getirmektir.",Yansıtıcı,181
Özetleme türünde bir soru nasıl olurdu?,"Özetleme türünde bir soru, örneğin, 'Bu metnin ana fikri nedir?' şeklinde olabilir.",Analitik,181
Soru-cevap çiftlerinin kalitesini artırmak için hangi ek faktörler dikkate alınabilir?,"Soru-cevap çiftlerinin kalitesini artırmak için, soruların hedef kitleye uygunluğu, cevapların güncelliği ve doğruluğu gibi ek faktörler dikkate alınabilir.",Spekülatif,181
Soru-cevap çifti oluşturma görevinde yapay zekanın rolü nedir?,"Yapay zeka, verilen metinden insanların sorabileceği çeşitli türlerde sorular üretmek ve bu sorulara kapsamlı yanıtlar sağlamakla görevlidir.",Olgusal,182
Soru-cevap çiftleri oluşturulurken dil tutarlılığı neden önemlidir?,"Dil tutarlılığı, soruların ve cevapların metnin diliyle aynı olmasını sağlayarak anlaşılabilirliği ve erişilebilirliği artırır.",Kavramsal,182
Soru çeşitliliği neden gereklidir ve hangi türde sorular dahil edilmelidir?,"Soru çeşitliliği, konunun farklı açılardan anlaşılmasını sağlar. Olgusal, kavramsal, bağlamsal, nedensel, yöntemsel, analitik, varsayımsal, yansıtıcı, spekülatif, listeleme ve özetleme gibi farklı soru türleri dahil edilmelidir.",Yöntemsel,182
Zorluk dengesi neden önemlidir ve soru zorluğu nasıl ayarlanmalıdır?,"Zorluk dengesi, farklı bilgi seviyelerine hitap etmeyi sağlar. Basit, orta ve karmaşık sorular dahil edilerek zorluk ayarlanabilir.",Kavramsal,182
Yanıt hassasiyeti ne anlama gelir ve neden önemlidir?,"Yanıt hassasiyeti, sağlanan içeriğe dayalı özlü ve doğru yanıtlar verilmesi anlamına gelir. Bilginin ardındaki gerekçeyi anlamak için yeterli bağlam sağlanmalıdır.",Kavramsal,182
Bağlam farkındalığı neden gereklidir ve soru oluşturma sürecini nasıl etkiler?,"Bağlam farkındalığı, soruların verilen metnin içeriğine derinlemesine kök salmasını ve materyalin amacını anlamasını sağlar.",Kavramsal,182
Tekrardan kaçınmanın önemi nedir ve bu nasıl sağlanır?,"Tekrardan kaçınma, soruların belirgin ve benzersiz olmasını sağlayarak gereksiz tekrarları önler ve bilgi verimliliğini artırır.",Kavramsal,182
"Eğer metin İngilizce olsaydı, soru ve cevaplar nasıl değişirdi?","Eğer metin İngilizce olsaydı, tüm sorular ve cevaplar da İngilizce olarak hazırlanmalıydı. Dil tutarlılığı ilkesi korunmalıydı.",Varsayımsal,182
"""Evet"" veya ""Hayır"" gibi kısa yanıtlardan neden kaçınılmalıdır?","""Evet"" veya ""Hayır"" gibi kısa yanıtlardan kaçınılmalıdır çünkü bu tür yanıtlar bilginin ardındaki gerekçeyi ve bağlamı yeterince açıklamaz.",Nedensel,182
Soru-cevap çiftleri oluşturulurken hangi format kullanılmalıdır?,"Soru-cevap çiftleri oluşturulurken JSON formatı kullanılmalıdır. Her çiftin soru, cevap ve soru_türü alanlarını içermesi gerekir.",Yöntemsel,182
Soru-cevap çifti sayısının belirtilmesinin amacı nedir?,"Soru-cevap çifti sayısının belirtilmesinin amacı, yapay zekanın ne kadar soru-cevap çifti üretmesi gerektiğini açıkça belirtmektir.",Olgusal,182
Markdown işaretlerinin kullanılmaması neden isteniyor?,"Markdown işaretlerinin kullanılmaması, yanıtın doğrudan ve kolayca işlenebilir bir JSON formatında olmasını sağlamak içindir.",Nedensel,182
"Soru-cevap çiftleri oluşturulurken yaratıcılık serbestisi var mıdır, yoksa sadece metne mi bağlı kalınmalıdır?","Soru-cevap çiftleri oluşturulurken yaratıcılık serbestisi vardır ancak bu, metnin içeriğine bağlı kalınarak ve metnin amacını aşmayacak şekilde kullanılmalıdır.",Analitik,182
İyi bir soru-cevap çifti oluşturma sürecinde en önemli faktör nedir?,"İyi bir soru-cevap çifti oluşturma sürecinde en önemli faktör, sorunun açık, anlaşılır ve metnin içeriğiyle ilgili olması ve cevabın doğru, özlü ve yeterli bağlamı sağlamasıdır.",Kavramsal,182
Bu görevde yapay zekanın karşılaştığı olası zorluklar nelerdir?,"Bu görevde yapay zekanın karşılaştığı olası zorluklar arasında metnin anlamını doğru yorumlamak, farklı soru türlerini belirlemek, uygun zorluk seviyesinde sorular oluşturmak ve doğru, özlü cevaplar sağlamak yer alabilir.",Yansıtıcı,182
