question,answer,question_type,page
Soru-cevap çiftleri oluşturmanın faydaları nelerdir?,"Soru-cevap çiftleri oluşturmak, metnin daha iyi anlaşılmasını ve bilginin daha etkili bir şekilde öğrenilmesini sağlar.",Yansıtıcı,132
Bu görevde kaç adet soru-cevap çifti oluşturulması isteniyor?,Bu görevde 15 adet soru-cevap çifti oluşturulması isteniyor.,Olgusal,132
Soru-cevap çiftlerinin formatı nasıl olmalıdır?,"Soru-cevap çiftlerinin formatı JSON formatında olmalı ve her çift 'soru', 'cevap' ve 'soru_türü' alanlarını içermelidir.",Yöntemsel,132
Soru-cevap çiftleri oluşturulurken metnin amacı ve nüansları neden dikkate alınmalıdır?,"Metnin amacı ve nüansları dikkate alınmalıdır çünkü bu, soruların ve cevapların metnin içeriğiyle uyumlu olmasını ve doğru bir şekilde anlaşılmasını sağlar.",Nedensel,132
Soru-cevap çifti oluşturma görevinin amacı nedir?,"Verilen metinden, farklı türlerde sorular üreterek ve bu sorulara kapsamlı yanıtlar sağlayarak yüksek kaliteli soru-cevap çiftleri oluşturmaktır.",Olgusal,133
Soru-cevap çiftlerinde dil tutarlılığı neden önemlidir?,"Soruların ve cevapların, verilen metnin diliyle aynı olması, anlaşılabilirliği ve tutarlılığı sağlamak açısından önemlidir.",Kavramsal,133
Hangi türde sorular oluşturulmalıdır?,"Olgusal, kavramsal, bağlamsal, nedensel, yöntemsel, analitik, varsayımsal, yansıtıcı, spekülatif, listeleme ve özetleme gibi farklı türlerde sorular oluşturulmalıdır.",Listeleme,133
Neden 'Evet' veya 'Hayır' gibi kısa yanıtlardan kaçınılmalıdır?,"'Evet' veya 'Hayır' gibi kısa yanıtlardan kaçınılmalıdır çünkü bu tür yanıtlar, bilginin ardındaki gerekçeyi anlamak için gerekli bağlamı sağlamaz.",Nedensel,133
Soru-cevap çiftlerinin zorluk seviyesi nasıl olmalıdır?,"Soru-cevap çiftleri basit, orta ve karmaşık zorluk seviyelerinde dengelenmelidir.",Yöntemsel,133
Bağlam farkındalığı neden gereklidir?,"Bağlam farkındalığı, tüm soruların verilen metnin içeriğine derinlemesine kök saldığından ve materyalin amacını ve nüanslarını anladığından emin olmak için gereklidir.",Kavramsal,133
Tekrardan kaçınmanın önemi nedir?,"Tekrardan kaçınmak, tüm soruların belirgin ve benzersiz olmasını sağlayarak gereksiz tekrarı önler ve çeşitliliği artırır.",Kavramsal,133
Varsayımsal soru türüne bir örnek verin.,"'X olursa ne olur?' sorusu, varsayımsal bir soru türüne örnektir.",Olgusal,133
Analitik sorular neyi amaçlar?,"Analitik sorular, konuları karşılaştırmayı, karşıtlaştırmayı veya değerlendirmeyi amaçlar.",Kavramsal,133
Neden yanıtların özlü olması gerekir?,"Yanıtların özlü olması gerekir çünkü cevabı açıkça açıklamak için yeterli bağlamı verirken, gereksiz ayrıntılardan kaçınılmalıdır.",Nedensel,133
Bu görevde kaç adet soru-cevap çifti oluşturulması istenmektedir?,Bu görevde 15 adet soru-cevap çifti oluşturulması istenmektedir.,Olgusal,133
Soru-cevap çiftleri hangi formatta sunulmalıdır?,"Soru-cevap çiftleri, JSON formatında sunulmalıdır.",Olgusal,133
Yansıtıcı soru türü neyi hedefler?,"Yansıtıcı soru türü, sonuçlar veya etkiler hakkında sorular sormayı hedefler.",Kavramsal,133
Bu görevde 'soru_türü' alanı neden önemlidir?,"'soru_türü' alanı, oluşturulan sorunun türünü belirterek soru çeşitliliğini ve kapsamını göstermek için önemlidir.",Kavramsal,133
"Eğer metin İngilizce olsaydı, soru ve cevaplar nasıl hazırlanmalıydı?","Eğer metin İngilizce olsaydı, soru ve cevaplar da İngilizce olarak hazırlanmalıydı.",Varsayımsal,133
Soru-cevap çifti oluşturma görevinin amacı nedir?,"Bu görevin amacı, verilen bir metinden farklı türlerde sorular oluşturmak ve bu sorulara kapsamlı cevaplar sağlamaktır.",Olgusal,134
Oluşturulacak soru-cevap çiftlerinde dil tutarlılığı neden önemlidir?,"Dil tutarlılığı, soruların ve cevapların metnin diliyle aynı olmasını sağlayarak içeriğin daha kolay anlaşılmasına ve erişilebilirliğine katkıda bulunur.",Kavramsal,134
Hangi farklı soru türleri oluşturulmalıdır?,"Oluşturulacak soru türleri şunlardır: olgusal, kavramsal, bağlamsal, nedensel, yöntemsel, analitik, varsayımsal, yansıtıcı, spekülatif, listeleme ve özetleme.",Listeleme,134
Neden 'Evet' veya 'Hayır' gibi kısa cevaplardan kaçınılmalıdır?,"'Evet' veya 'Hayır' gibi kısa cevaplardan kaçınılmalıdır çünkü bu tür cevaplar, bilginin ardındaki gerekçeyi anlamak için gerekli bağlamı sağlamaz ve eksik bilgi sunar.",Nedensel,134
Bağlam farkındalığı soru oluşturma sürecinde neden önemlidir?,"Bağlam farkındalığı, soruların verilen metnin içeriğine derinlemesine kök salmasını ve materyalin amacını ve nüanslarını anlamasını sağlayarak daha anlamlı ve alakalı sorular oluşturulmasına yardımcı olur.",Kavramsal,134
Soru-cevap çiftlerinin zorluk seviyesi nasıl olmalıdır?,"Soru-cevap çiftlerinin zorluk seviyesi basit, orta ve karmaşık soruları içerecek şekilde dengeli olmalıdır.",Yöntemsel,134
Yanıt hassasiyeti ne anlama gelir ve neden önemlidir?,"Yanıt hassasiyeti, sağlanan içeriğe dayalı özlü ve doğru yanıtlar vermek anlamına gelir. Bu önemlidir çünkü doğru ve net bilgi sağlayarak okuyucunun konuyu daha iyi anlamasına yardımcı olur.",Kavramsal,134
Tekrardan kaçınmanın soru oluşturma sürecindeki önemi nedir?,"Tekrardan kaçınmak, her sorunun belirgin ve benzersiz olmasını sağlayarak gereksiz tekrarı önler ve okuyucunun farklı açılardan bilgi edinmesine olanak tanır.",Kavramsal,134
"Eğer metin İngilizce olsaydı, soru ve cevaplar nasıl olurdu?","Eğer metin İngilizce olsaydı, sorular ve cevaplar da İngilizce olarak oluşturulurdu, dil tutarlılığı prensibine uyularak.",Varsayımsal,134
Bu görevde oluşturulacak soru-cevap çifti sayısı kaçtır?,Bu görevde oluşturulacak soru-cevap çifti sayısı 15'tir.,Olgusal,134
Soru-cevap çiftleri hangi formatta sunulmalıdır?,Soru-cevap çiftleri doğrudan JSON formatında sunulmalıdır. Markdown işaretleri kullanılmamalı ve sadece düz JSON verisi verilmelidir.,Olgusal,134
Neden yanıtların çok kısa olmaması gerekiyor?,Yanıtların çok kısa olmaması gerekiyor çünkü cevabı açıkça açıklamak ve bilginin ardındaki gerekçeyi anlamak için yeterli bağlamın sağlanması önemlidir.,Nedensel,134
Bu görevde oluşturulan soru türlerinin çeşitliliğinin sonuçları nelerdir?,"Bu görevde oluşturulan soru türlerinin çeşitliliği, konunun farklı açılardan ele alınmasını sağlayarak daha kapsamlı bir öğrenme deneyimi sunar ve farklı düşünme becerilerini teşvik eder.",Yansıtıcı,134
Soru-cevap çifti oluşturma sürecinde 'özlü' olmanın anlamı nedir?,"'Özlü' olmak, gereksiz ayrıntılardan kaçınarak, bilgiyi en kısa ve etkili şekilde sunmak anlamına gelir. Bu, okuyucunun dikkatinin dağılmasını önler ve ana noktaları daha kolay kavramasını sağlar.",Kavramsal,134
"Bu görevin amacı dışında, soru-cevap çiftleri oluşturmanın başka hangi potansiyel kullanım alanları vardır?","Soru-cevap çiftleri oluşturmanın başka potansiyel kullanım alanları arasında eğitim materyalleri hazırlama, sınav soruları oluşturma, müşteri hizmetleri için bilgi tabanı oluşturma ve yapay zeka sistemlerini eğitme sayılabilir.",Spekülatif,134
Soru-cevap çifti oluşturma görevinin amacı nedir?,Verilen metinden insanların sorabileceği çeşitli türlerde sorular üretmek ve bunlara kapsamlı yanıtlar sağlamaktır.,Olgusal,135
Soru-cevap çiftlerinde dil tutarlılığı neden önemlidir?,"Soruların ve cevapların, metnin diliyle aynı olması, anlaşılabilirliği ve erişilebilirliği artırır.",Kavramsal,135
Hangi tür soru çeşitleri soru-cevap çiftlerinde yer almalıdır?,"Olgusal, kavramsal, bağlamsal, nedensel, yöntemsel, analitik, varsayımsal, yansıtıcı, spekülatif, listeleme ve özetleme gibi farklı türlerde sorular yer almalıdır.",Listeleme,135
Neden 'Evet' veya 'Hayır' gibi kısa yanıtlardan kaçınılmalıdır?,"Bu tür kısa yanıtlar, bilginin ardındaki gerekçeyi anlamak için gerekli bağlamı sağlamaz ve eksik bilgiye yol açabilir.",Nedensel,135
Bağlam farkındalığı soru-cevap oluşturma sürecinde neden önemlidir?,"Soruların verilen metnin içeriğine derinlemesine kök saldığından ve materyalin amacını, nüanslarını anladığından emin olmak için önemlidir.",Kavramsal,135
Soru-cevap çiftlerinde zorluk dengesi nasıl sağlanmalıdır?,"Basit, orta ve karmaşık sorular dahil edilerek sağlanmalıdır.",Yöntemsel,135
Yanıt hassasiyeti ne anlama gelir ve neden önemlidir?,Sağlanan içeriğe dayalı özlü ve doğru yanıtlar vermek anlamına gelir. Doğru bilgi sağlamak ve okuyucuyu yanıltmamak için önemlidir.,Kavramsal,135
Soru-cevap çiftleri oluştururken tekrardan kaçınmak neden önemlidir?,"Her sorunun belirgin ve benzersiz olmasını sağlamak, gereksiz tekrarları önler ve okuyucunun zamanını korur.",Nedensel,135
"Metinde 'X' geçseydi ve 'X'in etkileri nelerdir?' şeklinde bir soru sorsaydık, bu hangi tür soru olurdu?","Bu, yansıtıcı bir soru olurdu.",Analitik,135
"Metinde 'X' geçseydi ve 'X'e ne sebep olur?' şeklinde bir soru sorsaydık, bu hangi tür soru olurdu?","Bu, nedensel bir soru olurdu.",Analitik,135
"Eğer metinde 'X' anlatılsaydı ve 'X'in temel unsurları nelerdir?' diye sorsaydık, bu hangi tür soru olurdu?","Bu, listeleme türünde bir soru olurdu.",Analitik,135
"Metinde 'X' anlatılsaydı ve 'X'ten çıkarılacak ana ders nedir?' diye sorsaydık, bu hangi tür soru olurdu?","Bu, özetleme türünde bir soru olurdu.",Analitik,135
Bu görevde JSON formatının kullanılmasının amacı nedir?,Verinin yapılandırılmış ve makine tarafından okunabilir bir şekilde sunulmasını sağlamaktır.,Kavramsal,135
Soru-cevap çifti oluşturma sürecinde 'spekülatif' sorular ne anlama gelir?,"Uygun olduğunda fikir tabanlı veya keşifsel sorular sormak anlamına gelir. Bu tür sorular, konu hakkında farklı bakış açıları geliştirmeye yardımcı olabilir.",Kavramsal,135
Soru-cevap çiftlerinde 'analitik' soruların amacı nedir?,"Karşılaştırma, karşıtlık veya değerlendirme yaparak konuyu daha derinlemesine anlamayı sağlamaktır.",Kavramsal,135
Bu görevin amacı nedir?,"Bu görevin amacı, verilen metinden yola çıkarak yüksek kaliteli soru-cevap çiftleri oluşturmaktır.",Olgusal,136
Soru-cevap çiftleri oluşturulurken hangi hususlara dikkat edilmelidir?,"Soru-cevap çiftleri oluşturulurken dil tutarlılığı, soru çeşitliliği, zorluk dengesi, yanıt hassasiyeti, bağlam farkındalığı ve tekrardan kaçınma gibi hususlara dikkat edilmelidir.",Yöntemsel,136
Neden farklı türde sorular oluşturulması önemlidir?,"Farklı türde sorular oluşturmak, metnin farklı yönlerini (olgusal, kavramsal, bağlamsal, vb.) keşfetmeyi ve daha kapsamlı bir anlayış sağlamayı amaçlar.",Kavramsal,136
Yanıt hassasiyeti neden önemlidir ve nasıl sağlanmalıdır?,"Yanıt hassasiyeti, sağlanan içeriğe dayalı özlü ve doğru yanıtlar vermeyi ifade eder. Çok kısa yanıtlardan kaçınarak, bilgiyi açıklamak için yeterli bağlam sağlanmalıdır.",Kavramsal,136
Bağlam farkındalığı neden gereklidir?,"Bağlam farkındalığı, soruların verilen metnin içeriğine derinlemesine kök salmasını ve materyalin amacını anlamasını sağlar.",Kavramsal,136
Soru çeşitliliği hangi soru türlerini içermelidir?,"Soru çeşitliliği olgusal, kavramsal, bağlamsal, nedensel, yöntemsel, analitik, varsayımsal, yansıtıcı ve spekülatif gibi farklı soru türlerini içermelidir.",Listeleme,136
Tekrardan kaçınmanın önemi nedir?,"Tekrardan kaçınmak, oluşturulan tüm soruların belirgin ve benzersiz olmasını sağlamak için önemlidir. Bu, gereksiz tekrarları önler ve bilginin daha etkili bir şekilde sunulmasına yardımcı olur.",Kavramsal,136
"Eğer metin İngilizce olsaydı, soru ve cevaplar nasıl hazırlanmalıydı?","Eğer metin İngilizce olsaydı, tüm sorular ve cevaplar da İngilizce olarak hazırlanmalıydı; dil tutarlılığı sağlanmalıydı.",Varsayımsal,136
Neden 'Evet' veya 'Hayır' gibi kısa cevaplardan kaçınılmalıdır?,'Evet' veya 'Hayır' gibi kısa cevaplardan kaçınılmalıdır çünkü bu tür cevaplar bilginin ardındaki gerekçeyi anlamak için gerekli bağlamı sağlamaz.,Nedensel,136
Bu görevde zorluk dengesi nasıl sağlanmalıdır?,"Bu görevde zorluk dengesi, basit, orta ve karmaşık soruları dahil ederek sağlanmalıdır. Bu, farklı seviyelerdeki okuyucuların içeriği anlamasına yardımcı olur.",Yöntemsel,136
Soru-cevap çiftleri oluşturma sürecinde ne gibi zorluklarla karşılaşılabilir?,"Soru-cevap çiftleri oluşturma sürecinde, metnin içeriğini tam olarak anlamak, farklı soru türlerini etkili bir şekilde formüle etmek ve özlü ama kapsamlı cevaplar yazmak gibi zorluklarla karşılaşılabilir.",Yansıtıcı,136
İyi bir soru-cevap çifti oluşturmanın temel unsurları nelerdir?,"İyi bir soru-cevap çifti oluşturmanın temel unsurları, sorunun net ve anlaşılır olması, cevabın doğru ve kapsamlı olması, dilin tutarlı olması ve sorunun metinle ilgili olmasıdır.",Listeleme,136
Bu görevdeki başarıyı nasıl ölçebiliriz?,"Bu görevdeki başarı, oluşturulan soru-cevap çiftlerinin kalitesi, çeşitliliği ve metnin içeriğini ne kadar iyi kapsadığı ile ölçülebilir.",Analitik,136
"Bu görev, yapay zekanın hangi yeteneklerini sergiliyor?","Bu görev, yapay zekanın doğal dil işleme, metin anlama, soru oluşturma ve cevap üretme gibi yeteneklerini sergiliyor.",Analitik,136
Bu görevden çıkarılacak ana ders nedir?,"Bu görevden çıkarılacak ana ders, yüksek kaliteli soru-cevap çiftleri oluşturmanın, metin anlama, sentezleme ve bilgiyi etkili bir şekilde sunma becerilerini gerektirdiğidir.",Özetleme,136
Bu metnin temel amacı nedir?,"Bu metnin temel amacı, belirli bir metinden yüksek kaliteli soru-cevap çiftleri oluşturmaktır.",Olgusal,137
Neden farklı türde sorular oluşturmak önemlidir?,"Farklı türde sorular oluşturmak, metnin çeşitli yönlerini kapsayarak daha kapsamlı bir anlayış sağlamak ve farklı düşünme becerilerini teşvik etmek için önemlidir.",Kavramsal,137
Soru ve cevapların dil tutarlılığı neden sağlanmalıdır?,"Dil tutarlılığı, okuyucunun metni ve soru-cevapları daha kolay anlamasını sağlamak, karmaşıklığı azaltmak ve tutarlılığı korumak için sağlanmalıdır.",Nedensel,137
Hangi soru türleri örnek olarak verilmiştir?,"Olgusal, kavramsal, bağlamsal, nedensel, yöntemsel, analitik, varsayımsal, yansıtıcı, spekülatif, listeleme ve özetleme gibi soru türleri örnek olarak verilmiştir.",Listeleme,137
Neden cevapların 'Evet' veya 'Hayır' gibi kısa olmaması gerektiği belirtilmiştir?,"'Evet' veya 'Hayır' gibi kısa cevaplardan kaçınılması, cevabın arkasındaki mantığı ve ilgili bağlamı açıklamak, böylece daha anlamlı ve bilgilendirici bir yanıt sunmak için belirtilmiştir.",Nedensel,137
Bağlam farkındalığı neden önemlidir?,"Bağlam farkındalığı, soruların ve cevapların metnin amacına ve içeriğine uygun olmasını, böylece bilginin doğru ve anlamlı bir şekilde aktarılmasını sağlar.",Kavramsal,137
Tekrardan kaçınmanın önemi nedir?,"Tekrardan kaçınmak, her sorunun benzersiz ve farklı bir konuya odaklanmasını sağlayarak okuyucuya daha geniş bir bilgi yelpazesi sunar ve sıkılmayı önler.",Nedensel,137
Metinde belirtilen zorluk dengesi ne anlama gelir?,"Zorluk dengesi, basit, orta ve karmaşık soruların karışımını içerir. Bu, farklı bilgi seviyelerine sahip kişilerin metinden faydalanabilmesini sağlar.",Kavramsal,137
"Eğer metinde 'X' terimi geçiyorsa, 'X'in etkileri nelerdir?' şeklinde bir soru hangi soru türüne girer?","Bu tür bir soru, 'Yansıtıcı' soru türüne girer çünkü 'X'in sonuçları veya etkileri hakkında bilgi istemektedir.",Analitik,137
Varsayımsal bir soru örneği verin.,Varsayımsal bir soru örneği: 'Eğer metinde belirtilen süreç uygulanmazsa ne olur?' olabilir.,Varsayımsal,137
Metinde belirtilen 'özlü yanıt' ifadesi ne anlama gelir?,"'Özlü yanıt' ifadesi, cevabın gereksiz ayrıntılardan kaçınarak konuyu net ve kısa bir şekilde açıklamasını ifade eder. Ancak, yeterli bağlamın sağlanması da önemlidir.",Olgusal,137
"Bu metne göre, iyi bir soru-cevap çiftinin temel özellikleri nelerdir?","Bu metne göre, iyi bir soru-cevap çiftinin temel özellikleri dil tutarlılığı, çeşitli soru türleri, zorluk dengesi, yanıt hassasiyeti, bağlam farkındalığı ve tekrardan kaçınmadır.",Özetleme,137
Neden yanıtların sağlanan içeriğe dayalı olması gerektiği vurgulanmıştır?,"Yanıtların sağlanan içeriğe dayalı olması, cevapların doğru ve ilgili olmasını, ayrıca metnin kapsamı dışında spekülasyon veya yanlış bilgi içermemesini sağlamak için vurgulanmıştır.",Nedensel,137
"Metinde 'X, Y ile nasıl karşılaştırılır?' şeklinde bir soru hangi soru türüne örnek olabilir?","Bu soru, 'Analitik' soru türüne örnek olabilir çünkü iki farklı öğeyi karşılaştırmayı ve aralarındaki benzerlik veya farklılıkları değerlendirmeyi amaçlamaktadır.",Analitik,137
Metnin amacı doğrultusunda kaç adet soru-cevap çifti oluşturulmalıdır?,Metnin amacı doğrultusunda 15 adet soru-cevap çifti oluşturulmalıdır.,Olgusal,137
Soru-cevap çifti oluşturmanın temel amacı nedir?,"Soru-cevap çifti oluşturmanın temel amacı, verilen metinden insanların sorabileceği farklı türlerde sorular üreterek bunlara kapsamlı yanıtlar sağlamaktır.",Kavramsal,138
Oluşturulacak soru-cevap çiftlerinde dil tutarlılığı neden önemlidir?,"Dil tutarlılığı, soruların ve cevapların verilen metnin diliyle aynı olmasını sağlayarak, içeriğin daha iyi anlaşılmasını ve erişilebilirliğini artırır.",Nedensel,138
Hangi farklı soru türleri dahil edilmelidir?,"Olgusal, kavramsal, bağlamsal, nedensel, yöntemsel, analitik, varsayımsal, yansıtıcı, spekülatif, listeleme ve özetleme gibi farklı soru türleri dahil edilmelidir.",Listeleme,138
Neden 'Evet' veya 'Hayır' gibi kısa yanıtlardan kaçınılmalıdır?,"'Evet' veya 'Hayır' gibi kısa yanıtlardan kaçınılmalıdır çünkü bu tür yanıtlar, bilginin ardındaki gerekçeyi anlamak için gerekli bağlamı sağlamaz ve cevabı yeterince açıklamaz.",Nedensel,138
Yanıtların doğruluğu nasıl sağlanmalıdır?,"Yanıtların doğruluğu, sağlanan içeriğe dayalı özlü ve doğru bilgiler vererek sağlanmalıdır.",Yöntemsel,138
Bağlam farkındalığı neden önemlidir?,"Bağlam farkındalığı, tüm soruların verilen metnin içeriğine derinlemesine kök salmasını ve materyalin amacını ve nüanslarını anlamasını sağlayarak soruların daha anlamlı ve alakalı olmasını sağlar.",Kavramsal,138
Soru-cevap çiftlerinde tekrardan kaçınmanın önemi nedir?,"Soru-cevap çiftlerinde tekrardan kaçınmanın önemi, her sorunun belirgin ve benzersiz olmasını sağlayarak, gereksiz tekrarları önler ve okuyucunun farklı açılardan bilgi edinmesini sağlar.",Nedensel,138
Olgusal sorulara bir örnek verin.,Olgusal sorulara bir örnek 'X ne anlama gelir?' olabilir.,Olgusal,138
Kavramsal sorular neyi hedefler?,"Kavramsal sorular, içeriğin ardındaki fikirleri ve kavramları derinlemesine araştırmayı hedefler.",Kavramsal,138
"Metinde belirtilen talimatlara göre, cevaplar ne kadar uzun olmalıdır?","Cevaplar, bilginin ardındaki gerekçeyi anlamak için gerekli bağlamı verirken, özlü olmalıdır; çok kısa olmamalı, ancak gereksiz ayrıntılardan da kaçınılmalıdır.",Yöntemsel,138
"Eğer bir soru 'X olursa ne olur?' şeklinde ise, bu hangi soru türüne girer?","Eğer bir soru 'X olursa ne olur?' şeklinde ise, bu varsayımsal soru türüne girer.",Olgusal,138
Yansıtıcı soruların amacı nedir?,"Yansıtıcı soruların amacı, bir konunun sonuçları veya etkileri hakkında derinlemesine düşünmeyi teşvik etmektir.",Kavramsal,138
Neden soru-cevap çiftlerinde zorluk dengesi önemlidir?,"Soru-cevap çiftlerinde zorluk dengesi, farklı bilgi seviyelerine sahip okuyuculara hitap etmeyi ve içeriğin daha geniş bir kitle tarafından anlaşılmasını sağlamayı amaçlar.",Nedensel,138
"Bu metne göre, spekülatif sorular ne zaman uygun olabilir?","Bu metne göre, spekülatif sorular, bir konu hakkında fikir tabanlı veya keşifsel tartışmaların yapılması uygun olduğunda kullanılabilir.",Bağlamsal,138
Analitik soruların temel özelliği nedir?,"Analitik soruların temel özelliği, farklı unsurları karşılaştırmak, karşıtlaştırmak veya değerlendirmektir.",Kavramsal,138
Soru-cevap çiftleri oluşturmanın temel amacı nedir?,"Soru-cevap çiftleri oluşturmanın temel amacı, verilen metinden çeşitli soru türleri üreterek, bu sorulara kapsamlı yanıtlar sağlamaktır.",Olgusal,139
Soru-cevap çiftleri oluşturulurken dil tutarlılığı neden önemlidir?,"Dil tutarlılığı, soruların ve cevapların metnin diliyle aynı olmasını sağlayarak, içeriğin daha kolay anlaşılmasını ve bilginin doğru aktarılmasını sağlar.",Kavramsal,139
Hangi türde sorular soru-cevap çiftlerine dahil edilmelidir?,"Olgusal, kavramsal, bağlamsal, nedensel, yöntemsel, analitik, varsayımsal, yansıtıcı, spekülatif, listeleme ve özetleme gibi farklı türde sorular soru-cevap çiftlerine dahil edilmelidir.",Listeleme,139
Neden 'Evet' veya 'Hayır' gibi kısa yanıtlardan kaçınılmalıdır?,'Evet' veya 'Hayır' gibi kısa yanıtlardan kaçınılmalıdır çünkü bu tür yanıtlar bilginin ardındaki gerekçeyi anlamak için gerekli bağlamı sağlamaz.,Nedensel,139
Soru-cevap çiftlerinde zorluk dengesi nasıl sağlanmalıdır?,"Soru-cevap çiftlerinde basit, orta ve karmaşık soruları dahil ederek zorluk dengesi sağlanmalıdır. Bu, farklı seviyelerdeki kullanıcıların içeriği anlamasına yardımcı olur.",Yöntemsel,139
Bağlam farkındalığı soru-cevap çiftleri oluşturmada neden önemlidir?,"Bağlam farkındalığı, tüm soruların verilen metnin içeriğine derinlemesine kök salmasını ve materyalin amacını ve nüanslarını anlamasını sağlar.",Kavramsal,139
Soru-cevap çiftleri oluştururken tekrardan kaçınmanın önemi nedir?,"Tekrardan kaçınmak, her sorunun belirgin ve benzersiz olmasını sağlayarak, içeriğin daha verimli ve ilgi çekici olmasını sağlar.",Kavramsal,139
"Eğer metin İngilizce olsaydı, soru ve cevaplar nasıl oluşturulmalıydı?","Eğer metin İngilizce olsaydı, sorular ve cevaplar da İngilizce olarak oluşturulmalıydı, dil tutarlılığını korumak amacıyla.",Varsayımsal,139
Soru-cevap çiftleri oluşturmanın potansiyel etkileri nelerdir?,"Soru-cevap çiftleri, öğrenmeyi kolaylaştırır, bilgiyi pekiştirir, farklı bakış açıları sunar ve içeriğin daha iyi anlaşılmasını sağlar.",Yansıtıcı,139
Neden bazı kişiler soru-cevap çiftlerinin etkili bir öğrenme aracı olmadığına inanabilir?,"Bazı kişiler, soru-cevap çiftlerinin ezberlemeye teşvik ettiğini, eleştirel düşünmeyi engellediğini veya gerçek dünya problemlerini çözmek için yeterli derinliği sağlamadığını düşünebilir.",Spekülatif,139
İyi bir soru-cevap çifti oluşturmak için gereken temel adımlar nelerdir?,"İyi bir soru-cevap çifti oluşturmak için temel adımlar şunlardır: metni dikkatlice okumak, farklı soru türleri belirlemek, özlü ve doğru cevaplar yazmak, dil tutarlılığını sağlamak ve tekrardan kaçınmaktır.",Listeleme,139
Verilen metnin ana fikri nedir?,"Verilen metnin ana fikri, yüksek kaliteli soru-cevap çiftleri oluşturma sürecini ve bu sürecin önemini açıklamaktır.",Özetleme,139
Olgusal bir soru örneği verin.,Olgusal bir soru örneği: 'Dil tutarlılığı neden önemlidir?' olabilir.,Olgusal,139
Soru-cevap çiftleri oluşturma sürecinde 'cevap hassasiyeti' ne anlama gelir?,"Cevap hassasiyeti, sağlanan içeriğe dayalı özlü ve doğru yanıtlar vermeyi ifade eder. Cevaplar çok kısa olmamalı, ancak konuyu açıkça açıklamak için yeterli bağlam sağlamalıdır.",Kavramsal,139
Soru-cevap çiftleri oluştururken hangi JSON formatı kullanılmalıdır?,"Soru-cevap çiftleri oluşturulurken aşağıdaki JSON formatı kullanılmalıdır: `[{""soru"": ""..."", ""cevap"": ""..."", ""soru_türü"": ""...""}, {""soru"": ""..."", ""cevap"": ""..."", ""soru_türü"": ""...""}]`",Olgusal,139
Soru-cevap çiftleri oluştururken hangi temel hususlara dikkat edilmelidir?,"Soru-cevap çiftleri oluştururken dil tutarlılığı, soru çeşitliliği, zorluk dengesi, yanıt hassasiyeti, bağlam farkındalığı ve tekrardan kaçınma gibi temel hususlara dikkat edilmelidir.",Olgusal,140
"Neden farklı türde sorular (olgusal, kavramsal, bağlamsal vb.) dahil etmek önemlidir?","Farklı türde sorular dahil etmek, metnin farklı yönlerini keşfetmeyi ve daha kapsamlı bir anlayış sağlamayı mümkün kılar.",Kavramsal,140
Yanıt hassasiyeti ne anlama gelir ve neden önemlidir?,"Yanıt hassasiyeti, sağlanan içeriğe dayalı özlü ve doğru yanıtlar vermeyi ifade eder. Bu önemlidir çünkü doğru ve güvenilir bilgi sunar.",Kavramsal,140
