question,answer,question_type,page
Bu materyalin hangi sınıf seviyesi için hazırlandığı belirtilmiştir?,Bu öğretim materyali 6. sınıf seviyesi için hazırlanmıştır.,Olgusal,1
Bu materyalin telif hakları kime aittir?,Bu materyalin tüm hakları saklıdır ve Millî Eğitim Bakanlığı’na aittir.,Olgusal,1
Bu materyalin içeriğinin kısmen veya tamamen yayımlanması konusunda ne gibi bir kısıtlama bulunmaktadır?,"Bu öğretim materyalinin metni, soruları ve şekilleri kısmen de olsa hiçbir suretle alınıp yayımlanamaz.",Olgusal,1
Bu materyalin 'Sosyal Bilgiler' dersi için hazırlanmış olması ne anlama gelir?,"Bu, materyalin içeriğinin sosyal bilimler alanına ait konuları kapsadığı anlamına gelir. Öğrencilere toplum, tarih, coğrafya gibi konularda bilgi vermeyi amaçlar.",Kavramsal,1
"Bu materyalin Millî Eğitim Bakanlığı'na ait olması, içeriğin güvenilirliği açısından ne ifade eder?","Millî Eğitim Bakanlığı'na ait olması, içeriğin müfredata uygun, pedagojik açıdan doğru ve öğrencilerin seviyesine uygun olarak hazırlandığını gösterir. Bu da materyalin güvenilirliğini artırır.",Analitik,1
Bu materyalden bir bölümü kendi çalışmamda kullanmak istersem ne yapmalıyım?,"Materyalin telif hakları Millî Eğitim Bakanlığı'na ait olduğundan, herhangi bir bölümünü yayımlamak veya kullanmak için izin almanız gerekmektedir.",Yöntemsel,1
Bu materyalin hazırlanmasındaki temel amaç nedir?,"Temel amaç, 6. sınıf öğrencilerine sosyal bilgiler dersi kapsamında bilgi ve beceriler kazandırmaktır.",Kavramsal,1
"Eğer bu materyal serbestçe yayımlanabilseydi, eğitim açısından ne gibi sonuçları olurdu?","Eğer serbestçe yayımlanabilseydi, farklı kaynaklardan gelen doğruluğu teyit edilmemiş bilgilerle karşılaşma riski artabilirdi. Bu da öğrencilerin yanlış bilgilere maruz kalmasına neden olabilirdi.",Varsayımsal,1
Bu materyalde hangi tür içerikler bulunmaktadır?,"Bu materyalde metinler, sorular ve şekiller bulunmaktadır.",Listeleme,1
Bu materyalin telif haklarının korunmasının önemi nedir?,"Telif haklarının korunması, materyalin izinsiz kopyalanmasını ve dağıtılmasını engelleyerek, Millî Eğitim Bakanlığı'nın emeğinin ve kaynaklarının korunmasını sağlar.",Nedensel,1
Bu materyalin içeriği başka bir sınıf seviyesi için uyarlanabilir mi?,"Materyal 6. sınıf seviyesine uygun olarak hazırlandığından, başka bir sınıf seviyesi için doğrudan uyarlanması uygun olmayabilir. İçeriğin ilgili sınıf seviyesinin müfredatına ve öğrenci gelişim düzeyine göre yeniden düzenlenmesi gerekebilir.",Analitik,1
Bu materyalin kısmen dahi olsa yayımlanamamasının nedeni nedir?,"Materyalin kısmen dahi olsa yayımlanamamasının nedeni, telif haklarının Millî Eğitim Bakanlığı'na ait olması ve izinsiz kullanımın önüne geçilmek istenmesidir.",Nedensel,1
Bu materyalin içeriği hangi konuları kapsar?,"Metinde içeriğin hangi konuları kapsadığı belirtilmemiştir, ancak sosyal bilgiler dersi olması nedeniyle tarih, coğrafya, vatandaşlık gibi konuları içermesi beklenir.",Spekülatif,1
Bu metinden çıkarılacak ana ders nedir?,"Bu metinden çıkarılacak ana ders, eğitim materyallerinin telif haklarının önemi ve bu haklara saygı duyulması gerektiğidir.",Özetleme,1
Bu materyalin hazırlanmasında hangi süreçler izlenmiştir?,"Metinde materyalin hazırlanma süreci hakkında bilgi bulunmamaktadır. Ancak, müfredata uygunluk, pedagojik doğruluk ve öğrenci seviyesine uygunluk gibi kriterlerin göz önünde bulundurulduğu varsayılabilir.",Yöntemsel,1
Soru-cevap çiftleri oluşturulurken hangi hususlara dikkat edilmelidir?,"Soru-cevap çiftleri oluşturulurken dil tutarlılığı sağlanmalı, farklı soru türleri (olgusal, kavramsal, bağlamsal vb.) dahil edilmeli, zorluk dengesi gözetilmeli, yanıtlar hassas ve öz olmalı, bağlam farkındalığı korunmalı ve tekrardan kaçınılmalıdır.",Özetleme,2
Olgusal soruların amacı nedir?,"Olgusal soruların amacı, belirli bilgileri doğrudan sormaktır. Örneğin, 'X ne anlama gelir?' gibi.",Olgusal,2
"Kavramsal sorular, olgusal sorulardan nasıl farklıdır?","Kavramsal sorular, içeriğin ardındaki fikirleri araştırırken, olgusal sorular belirli bilgileri doğrudan sorar. Kavramsal sorular 'X neden önemlidir?' gibi daha derinlemesine analiz gerektirir.",Analitik,2
Bağlamsal soruların önemi nedir?,"Bağlamsal sorular, konunun daha geniş bağlamını veya arka planını anlamamıza yardımcı olur. Bu, konunun neden önemli olduğunu ve nasıl ortaya çıktığını anlamamızı sağlar.",Kavramsal,2
Neden nedensel sorular sormalıyız?,"Nedensel sorular, bir olayın veya durumun sebeplerini veya nedenlerini anlamak için önemlidir. 'X'e ne sebep olur?' gibi sorular, bir durumun kökenini anlamamıza yardımcı olur.",Nedensel,2
Yöntemsel sorular neye odaklanır?,"Yöntemsel sorular, süreçlere veya adımlara odaklanır. 'X nasıl başarılır?' gibi sorular, bir hedefe ulaşmak için izlenmesi gereken adımları anlamamızı sağlar.",Yöntemsel,2
Analitik soruların temel amacı nedir?,"Analitik soruların temel amacı, farklı unsurları karşılaştırmak, karşıtlaştırmak veya değerlendirmektir. 'X, Y ile nasıl karşılaştırılır?' gibi sorular, farklı kavramlar arasındaki benzerlikleri ve farklılıkları anlamamıza yardımcı olur.",Analitik,2
Varsayımsal sorular ne tür senaryolara dayanır?,"Varsayımsal sorular, hayal edilen senaryolara dayanır. 'X olursa ne olur?' gibi sorular, olası sonuçları ve etkileri değerlendirmemize olanak tanır.",Varsayımsal,2
Yansıtıcı soruların odak noktası nedir?,"Yansıtıcı sorular, bir eylemin veya durumun sonuçları veya etkileri hakkında sorular sorar. Bu tür sorular, bir kararın veya olayın uzun vadeli etkilerini anlamamıza yardımcı olur.",Yansıtıcı,2
Spekülatif sorular ne tür sorulardır?,"Spekülatif sorular, fikir tabanlı veya keşifsel sorulardır. 'Neden birisi X'e katılmayabilir?' gibi sorular, farklı bakış açılarını ve olası itirazları anlamamıza yardımcı olur.",Spekülatif,2
Listeleme sorularının amacı nedir?,"Listeleme sorularının amacı, bir konuyla ilgili öğelerin, adımların veya unsurların bir listesini istemektir. 'X'in temel unsurları nelerdir?' gibi sorular, bir konunun bileşenlerini anlamamıza yardımcı olur.",Listeleme,2
Neden yanıtlarda 'Evet' veya 'Hayır' gibi kısa cevaplardan kaçınılmalıdır?,"'Evet' veya 'Hayır' gibi kısa cevaplardan kaçınılmalıdır çünkü bu tür cevaplar, bilginin ardındaki gerekçeyi anlamak için gerekli bağlamı sağlamaz.",Kavramsal,2
Soru-cevap çiftlerinde 'zorluk dengesi' ne anlama gelir?,"Zorluk dengesi, basit, orta ve karmaşık soruların dengeli bir şekilde dağıtılması anlamına gelir. Bu, farklı bilgi seviyelerine hitap etmeyi ve konuyu kapsamlı bir şekilde ele almayı sağlar.",Kavramsal,2
Yanıt hassasiyeti neden önemlidir?,"Yanıt hassasiyeti, sağlanan içeriğe dayalı özlü ve doğru yanıtlar vermeyi ifade eder. Bu, yanıltıcı veya yanlış bilgilerden kaçınmayı ve okuyucunun doğru bilgiye ulaşmasını sağlamayı amaçlar.",Kavramsal,2
Soru-cevap çiftleri oluşturulurken tekrardan kaçınmanın önemi nedir?,"Tekrardan kaçınmak, her sorunun belirgin ve benzersiz olmasını sağlamak için önemlidir. Bu, aynı bilgiyi farklı şekillerde tekrar tekrar sormaktan kaçınarak, içeriğin verimliliğini artırır.",Kavramsal,2
Bu metnin ana konusu nedir?,"Metnin ana konusu bilim, teknoloji ve toplum arasındaki ilişkidir.",Olgusal,3
"""Araştırıyorum"" ifadesi bu bağlamda ne anlama geliyor olabilir?","""Araştırıyorum"" ifadesi, bilim ve teknolojinin toplum üzerindeki etkilerini veya toplumun bilim ve teknolojiye olan yaklaşımını derinlemesine inceleme sürecini ifade ediyor olabilir.",Kavramsal,3
"""Gerçek ürün"" neyi ifade ediyor?","""Gerçek ürün"", bilimsel ve teknolojik gelişmelerin somut sonuçlarını veya toplumun faydasına sunulan elle tutulur çıktılarını ifade ediyor olabilir.",Olgusal,3
"Bilim, teknoloji ve toplum arasındaki ilişki neden önemlidir?","Bu ilişki, teknolojik gelişmelerin toplumsal etkilerini anlamak, etik sorunları ele almak ve sürdürülebilir bir gelecek inşa etmek için önemlidir.",Kavramsal,3
Bu metin hangi bağlamda kullanılıyor olabilir?,"Bu metin, bir dersin başlığı, bir araştırma projesinin konusu veya bir tartışma platformunun teması olarak kullanılıyor olabilir.",Bağlamsal,3
Bilim ve teknolojideki gelişmelerin toplumsal sonuçları neler olabilir?,"Bilim ve teknolojideki gelişmelerin toplumsal sonuçları olumlu (yaşam kalitesinin artması, yeni iş imkanları) veya olumsuz (işsizlik, eşitsizlik) olabilir.",Yansıtıcı,3
"""Araştırıyorum"" ifadesi hangi yöntemlerle gerçekleştirilebilir?","""Araştırıyorum"" ifadesi, literatür taraması, anketler, mülakatlar, deneyler ve modelleme gibi çeşitli yöntemlerle gerçekleştirilebilir.",Yöntemsel,3
"""Gerçek ürün"" kavramı, bilimsel bir keşif ile ticari bir ürün arasındaki farkı nasıl yansıtır?","""Gerçek ürün"" kavramı, bilimsel bir keşfin ticarileştirilerek topluma fayda sağlayan somut bir sonuca dönüştürülmesini vurgular. Bilimsel keşif teorik bir bulgu iken, ""gerçek ürün"" bu bulgunun pratik uygulamasıdır.",Analitik,3
Eğer bilim ve teknoloji etik sınırlar olmadan gelişirse ne olur?,"Eğer bilim ve teknoloji etik sınırlar olmadan gelişirse, toplumsal eşitsizlikler artabilir, çevre kirliliği artabilir ve insan hakları ihlalleri yaşanabilir.",Varsayımsal,3
"Bilim, teknoloji ve toplum etkileşiminin temel unsurları nelerdir?","Bilim, teknoloji ve toplum etkileşiminin temel unsurları arasında bilimsel bilgi, teknolojik yenilikler, toplumsal değerler, politikalar ve ekonomik faktörler yer alır.",Listeleme,3
Bu metinden çıkarılacak ana ders nedir?,"Bu metinden çıkarılacak ana ders, bilim ve teknolojinin toplum üzerindeki etkilerini anlamanın ve bu etkileri yönetmenin önemidir.",Özetleme,3
Neden bazı insanlar teknolojik gelişmelere karşı olabilir?,"Bazı insanlar teknolojik gelişmelere, iş kaybı korkusu, gizlilik endişeleri, etik kaygılar veya geleneksel yaşam tarzlarına yönelik tehdit olarak algılamaları nedeniyle karşı olabilirler.",Spekülatif,3
"""Araştırıyorum"" ifadesi, bir öğrencinin bilimsel bir projeye yaklaşımını nasıl etkiler?","""Araştırıyorum"" ifadesi, bir öğrencinin bilimsel bir projeye daha meraklı, sorgulayıcı ve derinlemesine bir yaklaşımla başlamasına teşvik eder.",Bağlamsal,3
"""Gerçek ürün""ün toplumsal faydası nasıl ölçülür?","""Gerçek ürün""ün toplumsal faydası, yaşam kalitesindeki artış, ekonomik büyüme, sağlık hizmetlerindeki iyileşme ve çevresel sürdürülebilirlik gibi faktörler aracılığıyla ölçülebilir.",Yöntemsel,3
Bilim ve teknolojinin toplum üzerindeki etkilerini anlamak için hangi disiplinlerden yararlanılabilir?,"Bilim ve teknolojinin toplum üzerindeki etkilerini anlamak için sosyoloji, felsefe, tarih, ekonomi ve siyaset bilimi gibi çeşitli disiplinlerden yararlanılabilir.",Olgusal,3
Bu ders hangi sınıf seviyesi için hazırlanmıştır?,Bu ders 6. sınıf seviyesi için hazırlanmıştır.,Olgusal,4
Bu derste hangi öğrenme alanı üzerinde durulmaktadır?,"Bu derste Bilim, Teknoloji ve Toplum öğrenme alanı üzerinde durulmaktadır.",Olgusal,4
SB.6.4.3 kazanımı neyi ifade etmektedir?,"SB.6.4.3 kazanımı, öğrencilerin bilimsel araştırma basamaklarını kullanarak araştırma yapabilmelerini ifade etmektedir.",Kavramsal,4
Telif ve patent hakları saklı ürünlerin yasal yollardan temin edilmesinin gerekliliği neden savunulmalıdır?,"Telif ve patent hakları saklı ürünlerin yasal yollardan temin edilmesi, fikri mülkiyet haklarına saygı göstermek, yaratıcıları ve mucitleri desteklemek ve yasalara uymak için gereklidir.",Nedensel,4
Dersin işlenişinde EBA TV'nin rolü nedir?,"Dersin işlenişinde EBA TV, konuların öğrencilere görsel olarak sunulması için kullanılmaktadır.",Yöntemsel,4
"""DÜŞÜNELİM – CEVAPLAYALIM"" sorusunun amacı nedir?","""DÜŞÜNELİM – CEVAPLAYALIM"" sorusunun amacı, öğrencilerin konuyla ilgili ön bilgilerini ve düşüncelerini ortaya çıkarmaktır.",Kavramsal,4
Çalışma kağıtlarındaki etkinlikler ne zaman dağıtılmalıdır?,"Çalışma kağıtlarındaki etkinlikler, konu özetinin açıklanmasından sonra, konu sırasına göre dağıtılmalıdır.",Yöntemsel,4
Öğrencilerden gelecek derse kadar ne araştırması yapmaları istenmektedir?,"Ek-3'te verilen araştırma konusu öğrencilere yazdırılarak, bu konuda gelecek derse kadar araştırma yapmaları istenmektedir.",Olgusal,4
Bu derste bilimsel araştırma basamaklarının kullanılması neden önemlidir?,"Bilimsel araştırma basamaklarının kullanılması, öğrencilerin sistematik ve doğru bilgiye ulaşmalarını, kanıta dayalı düşünmelerini ve problem çözme becerilerini geliştirmelerini sağlar.",Kavramsal,4
Telif hakları ihlal edilirse ne gibi sonuçlar ortaya çıkabilir?,"Telif hakları ihlal edilirse, yasal süreçler başlatılabilir, maddi tazminat ödeme yükümlülüğü doğabilir ve itibar kaybı yaşanabilir.",Yansıtıcı,4
Patent hakkı almak bir mucit için neden önemlidir?,"Patent hakkı almak, mucidin buluşunu belirli bir süre boyunca başkalarının izinsiz kullanmasını engeller, ticari kazanç elde etme fırsatı sunar ve buluşunun tanınmasını sağlar.",Nedensel,4
Öğrencilerin telif ve patent hakları konusunda bilinçlenmesi toplum için ne gibi faydalar sağlar?,"Öğrencilerin telif ve patent hakları konusunda bilinçlenmesi, yaratıcılığı teşvik eder, yenilikçiliği destekler, haksız rekabeti önler ve ekonomik büyümeye katkıda bulunur.",Yansıtıcı,4
Dersin süresi neden 40+40 dakika olarak belirtilmiştir?,"Dersin süresinin 40+40 dakika olarak belirtilmesi, dersin iki ayrı oturum halinde işleneceğini veya farklı etkinliklere ayrılacağını gösterir.",Bağlamsal,4
Ek-1 ve Ek-2'deki çalışma kağıtlarının içeriği ne ile ilgilidir?,"Ek-1 ve Ek-2'deki çalışma kağıtlarının içeriği, derste işlenen ""Araştırıyorum"" ve ""Gerçek Ürün"" konuları ile ilgilidir.",Bağlamsal,4
Öğrencilere verilen araştırma konusunun amacı nedir?,"Öğrencilere verilen araştırma konusunun amacı, öğrencilerin bilimsel araştırma becerilerini geliştirmek, bilgiye ulaşma yöntemlerini öğrenmek ve öğrendiklerini gerçek hayata uygulamalarını sağlamaktır.",Kavramsal,4
Bilimsel araştırma nedir?,"Bir konu ve sorun ile ilgili belirli yöntemlerle, güvenilir kaynaklarda yapılan araştırma ve inceleme çalışmalarına bilimsel araştırma denir.",Olgusal,5
Bilimsel araştırma basamakları nelerdir?,"Bilimsel araştırma basamakları şunlardır: Konu belirleme, hipotez oluşturma, bilgi toplama, bilgileri hipotezlerle karşılaştırma, açıklama ve sonuç yazma, kaynakları gösterme.",Listeleme,5
Bilimsel araştırmada hipotez ne anlama gelir?,"Hipotez, bilimsel araştırma yapılacak konu veya sorun ile ilgili oluşturulan varsayımlardır.",Olgusal,5
Taklit ürünlerin en çok görüldüğü alanlar nelerdir?,"Taklit, sahte ve korsan ürünler en çok kitap, gıda, ilaç, bilişim gibi alanlarda görülmektedir.",Listeleme,5
Telif hakkı nedir?,"Herhangi bir bilgi, buluş ve düşüncenin kullanılması hakkının yasalarla bir kişiye verilerek güvence altına alınmasına “telif hakkı” denir.",Olgusal,5
Patent ne işe yarar?,"Patent, yeni üretim ve buluş yapmış kişilerin haklarını koruyan bir belgedir.",Kavramsal,5
Türkiye'de yeni üretim ve buluş yapan kişilerin haklarını hangi kurumlar korur?,Yeni üretim ve buluş yapmış kişilerin hakları “Fikir ve Sanat Eserleri Kanunu” ve “Türk Patent ve Marka Kurumu” ile korunmaktadır.,Olgusal,5
Neden emek harcanarak üretilen ürünleri kullanmalıyız?,"Emek harcanarak yasalarla korunan, telif ve patent hakkı belli olan ürünleri kullanmalıyız çünkü emeğe saygı duymalıyız.",Nedensel,5
Sahte ürünlerin satılmasının önlenmesi neden önemlidir?,"Sahte ürünlerin satılmasının önlenmesi, haksız kazancı engellemek, kalitesiz ve sağlığa zararlı ürünlerin satışını önlemek ve devletin vergi kaybını önlemek için önemlidir.",Kavramsal,5
Bilimsel araştırma yaparken genel ağdaki bilgilerin güvenilirliği nasıl teyit edilir?,"Bilimsel araştırma yaparken genel ağdaki bilgilerin güvenilirliğini teyit etmek için, bilgilerin farklı güvenilir kaynaklarla karşılaştırılması ve akademik çalışmalarla desteklenmesi gerekir.",Yöntemsel,5
Eğer bir buluşunuzun patentini almazsanız ne olur?,"Eğer bir buluşunuzun patentini almazsanız, başka kişiler buluşunuzu taklit edebilir ve ticari olarak kullanabilir, bu da sizin buluşunuzdan elde edeceğiniz potansiyel geliri azaltır.",Varsayımsal,5
Bilimsel araştırma yapmanın toplum için önemi nedir?,"Bilimsel araştırma yapmanın toplum için önemi, insanların hayatını kolaylaştıran ve ihtiyaçlarını karşılayan yeni buluşlara ve fikirlere ulaşılmasını sağlamasıdır.",Kavramsal,5
Telif hakkı ve patent arasındaki fark nedir?,"Telif hakkı, bir bilgi, buluş veya düşüncenin kullanım hakkını güvence altına alırken, patent yeni bir buluşun sahibine verilen bir haktır. Telif hakkı genellikle sanatsal ve edebi eserleri korurken, patent teknik icatları korur.",Analitik,5
Sahte ürünlerin kullanımının bireysel ve toplumsal etkileri nelerdir?,"Sahte ürünlerin kullanımı bireysel olarak sağlığa zararlı olabilir ve maddi kayıplara yol açabilirken, toplumsal olarak vergi kayıplarına, yasal üreticilerin zarar görmesine ve güvenilirlik sorunlarına neden olabilir.",Yansıtıcı,5
Bilimsel araştırma sürecinde kaynakça neden önemlidir?,"Bilimsel araştırma sürecinde kaynakça, kullanılan bilgilerin nereden alındığını göstererek araştırmanın güvenilirliğini artırır, başkalarının çalışmalarına saygı duyar ve okuyucuların daha fazla bilgi edinmesine olanak tanır.",Nedensel,5
İnsanlar neden bilimsel araştırma yaparlar?,"İnsanlar, meraklarını gidermek, sorunlara çözüm bulmak, yeni bilgiler keşfetmek ve topluma faydalı olmak için bilimsel araştırma yaparlar.",Olgusal,6
Bilimsel araştırma yaparken nelere dikkat edilmelidir?,"Bilimsel araştırma yaparken objektif olunmalı, güvenilir kaynaklar kullanılmalı, veriler doğru şekilde analiz edilmeli, etik kurallara uyulmalı ve sonuçlar şeffaf bir şekilde paylaşılmalıdır. Tarafsızlık, doğruluk ve dürüstlük çok önemlidir.",Yöntemsel,6
Ceyda'nın bilimsel araştırma basamaklarını kullanırken yaptığı hatalı davranış hangisidir?,"Ceyda'nın hatalı davranışı, genel ağdaki tüm bilgileri değiştirmeden kullanmasıdır. Bilgiler kaynak gösterilerek kullanılmalıdır.",Analitik,6
Bilimsel çalışmaların gelişmesinde en önemli etken nedir?,Bilimsel çalışmaların gelişmesinde en önemli etken insanların merak duygusudur.,Nedensel,6
Kaynak taramasında nelere dikkat edilmelidir?,Kaynak taramasında tek bir tür kaynak yerine çeşitli ve güvenilir kaynaklar tercih edilmelidir. Farklı bakış açılarını değerlendirmek önemlidir.,Yöntemsel,6
Bilimsel araştırmalarda yararlanılan kaynaklar nerede belirtilmelidir?,Bilimsel araştırmalarda yararlanılan kaynaklar çalışmanın kaynakça bölümünde belirtilmelidir.,Olgusal,6
Araştırma konusu ile ilgili belirlediğimiz fikir ve düşüncelere ne ad verilir?,Araştırma konusu ile ilgili belirlediğimiz fikir ve düşüncelere hipotez (varsayım) denir.,Olgusal,6
İnsanların aklını kullanarak sorunlara çözümler bulmasına ne denir?,İnsanların aklını kullanarak sorunlara çözümler bulmasına bilimsel araştırma denir.,Olgusal,6
Bir konu veya sorunla ilgili yapacağımız bilimsel çalışmada izleyeceğimiz yönteme ne denir?,Bir konu veya sorunla ilgili yapacağımız bilimsel çalışmada izleyeceğimiz yönteme araştırma basamakları denir.,Olgusal,6
Hipotez nedir ve bilimsel araştırmadaki rolü nedir?,"Hipotez, bir araştırma sorusuna yönelik geçici bir cevaptır veya bir tahmindir. Bilimsel araştırmada, hipotez test edilerek doğruluğu veya yanlışlığı değerlendirilir.",Kavramsal,6
Bilimsel araştırmalarda etik kurallara uymanın önemi nedir?,"Bilimsel araştırmalarda etik kurallara uymak, araştırmanın güvenilirliğini ve doğruluğunu sağlar. Aynı zamanda, katılımcıların haklarını korur ve bilimsel bilginin kötüye kullanılmasını engeller.",Kavramsal,6
Bilimsel araştırma basamakları nelerdir ve bu basamakların sırası neden önemlidir?,"Bilimsel araştırma basamakları genellikle şunlardır: Sorunun belirlenmesi, hipotezin oluşturulması, veri toplanması, verilerin analizi, sonuçların yorumlanması ve raporlanması. Bu basamakların sırası, araştırmanın sistematik ve düzenli bir şekilde yürütülmesini sağlar.",Yöntemsel,6
Eğer bir bilimsel araştırmada sonuçlar hipotezi desteklemezse ne yapılmalıdır?,"Eğer bir bilimsel araştırmada sonuçlar hipotezi desteklemezse, hipotez yeniden gözden geçirilebilir veya yeni bir hipotez oluşturulabilir. Ayrıca, araştırma yöntemi ve verilerin analizi de tekrar değerlendirilebilir.",Varsayımsal,6
Bilimsel araştırma sonuçlarının toplum üzerindeki etkileri neler olabilir?,"Bilimsel araştırma sonuçları, teknolojik gelişmeler, sağlık hizmetlerinin iyileştirilmesi, eğitim yöntemlerinin geliştirilmesi ve sosyal politikaların oluşturulması gibi birçok alanda toplum üzerinde önemli etkilere sahip olabilir.",Yansıtıcı,6
Bilimsel araştırmalarda kaynak göstermenin amacı nedir?,"Bilimsel araştırmalarda kaynak göstermenin amacı, başkalarının fikirlerine ve çalışmalarına saygı duymak, intihalden kaçınmak ve araştırmanın güvenilirliğini artırmaktır. Ayrıca, okuyucuların kaynaklara ulaşarak daha fazla bilgi edinmesini sağlar.",Nedensel,6
Telif Hakkı ve Patent belgesi alabilmek için neler yapmalıyız?,"Metinde Telif Hakkı ve Patent belgesi alabilmek için yapılması gerekenler doğrudan belirtilmemiştir. Ancak, yeni bir ürün veya fikir geliştirmek ve ilgili kurumlara başvurmak gerektiği anlaşılmaktadır.",Yöntemsel,7
Telif ve patent hakkının kime ait olduğu belli olan ürünlere nasıl ulaşmalıyız? Neden?,"Telif ve patent hakkı belli olan ürünlere yasal yollarla, yani satın alarak veya kiralayarak ulaşmalıyız. Çünkü Fikir ve Sanat Eserleri Kanunu eser sahibinin haklarını korur ve izinsiz kullanım yasal değildir.",Yöntemsel,7
"Fikir ve Sanat Eserleri Kanunu’nun 23. Maddesine göre, eser sahibine verilen belge nedir?",Fikir ve Sanat Eserleri Kanunu’nun 23. Maddesinde belirtilen haklara sahip olan eser sahibine verilen belge Telif hakkıdır.,Olgusal,7
Patentli ürünleri tercih etmenin önemi nedir?,"Patentli ürünleri tercih etmek, özgün ve yenilikçi çalışmaları desteklemek anlamına gelir. Ayrıca, patentli ürünler genellikle belirli kalite standartlarına uygun olarak üretilir.",Kavramsal,7
Korsan ürünler ülkemize vergi geliri sağlar mı?,"Hayır, korsan ürünler ülkemize vergi geliri sağlamaz. Aksine, vergi kaybına neden olurlar ve yasal ekonomiye zarar verirler.",Olgusal,7
Türk Patent ve Marka Kurumu korsan yayınlara patent belgesi verir mi?,"Hayır, Türk Patent ve Marka Kurumu korsan yayınlara patent belgesi vermez. Patent belgesi, özgün ve yasal ürünlere verilir.",Olgusal,7
Orijinal olmayan ürünlerin satışını engellemek için çalışan görevlilere ne denir?,Orijinal olmayan ürünlerin satışını engellemek için çalışan görevlilere zabıta denir.,Olgusal,7
Yeni üretim ve buluş yapmış kişinin hakkı ne ile koruma altındadır?,Yeni üretim ve buluş yapmış kişinin hakkı patent ile koruma altındadır.,Olgusal,7
Herhangi bir bilgi ve buluşun kimin olduğunun yasalarla belirlenmesine ne denir?,Herhangi bir bilgi ve buluşun kimin olduğunun yasalarla belirlenmesine telif hakkı denir.,Olgusal,7
Telif hakkı ve patent arasındaki temel fark nedir?,"Telif hakkı, daha çok sanatsal ve edebi eserleri korurken, patent ise yeni buluşları ve teknik çözümleri korur.",Analitik,7
Korsan ürünlerin toplum üzerindeki olumsuz etkileri nelerdir?,"Korsan ürünler, yasal üreticilere zarar vererek ekonomik kayıplara neden olur, vergi gelirlerini azaltır, kalitesiz ve güvensiz olabilir, ve en önemlisi fikri mülkiyet haklarını ihlal eder.",Yansıtıcı,7
Fikir ve Sanat Eserleri Kanunu neden önemlidir?,"Fikir ve Sanat Eserleri Kanunu, eser sahiplerinin haklarını koruyarak yaratıcılığı teşvik eder, kültürel üretimi destekler ve korsanlığın önüne geçerek ekonomik kayıpları engeller.",Kavramsal,7
Patent almanın bir mucit için potansiyel faydaları nelerdir?,"Patent almak, mucidin buluşunu belirli bir süre boyunca tekel olarak kullanma hakkını elde etmesini sağlar, rekabet avantajı yaratır, yatırım çekme potansiyelini artırır ve lisanslama yoluyla gelir elde etme imkanı sunar.",Yansıtıcı,7
Bir ürünün patentli olup olmadığını nasıl anlarız?,Bir ürünün patentli olup olmadığını anlamak için ürün üzerindeki patent numarasını kontrol edebilir veya ilgili patent veri tabanlarında arama yapabilirsiniz.,Yöntemsel,7
