question,answer,question_type,page
Türkiye'de ekonomik faaliyetlerin gelişmesinde hangi faktörler önemlidir?,"Verimli topraklar, sanayi için ham madde, ormanlar, turizm için tarihi varlıklar ve doğal güzellikler, madencilik için yer altı kaynakları ekonomik faaliyetlerin gelişmesinde önemlidir.",Olgusal,11
Türkiye'nin ekonomik kaynakları nelerdir?,"Türkiye'nin ekonomik kaynakları topraklar, hayvancılık faaliyetleri, su kaynakları, turizm varlıkları, ormanlar, madenler ve insan kaynaklarıdır.",Listeleme,11
İç bölgelerimizde yetiştirilen başlıca ürünler nelerdir ve bu durumun nedeni nedir?,"İç bölgelerimizde buğday, arpa ve şeker pancarı gibi ürünler yetiştirilir. Bu durum, bölgedeki sıcaklık ve yağış özelliklerine bağlı olarak verimli toprakların bulunmasından kaynaklanır.",Nedensel,11
Karadeniz Bölgesi'nde hangi ürünlerin yetiştirilmesi yaygındır ve bunun sebebi nedir?,Karadeniz Bölgesi'nde fındık (Ordu ve Giresun) ve çay (Rize) yetiştirilmesi yaygındır. Bunun sebebi bölgedeki yağışların bol ve düzenli olmasıdır.,Nedensel,11
Akdeniz ve Ege kıyılarında hangi tarım ürünleri daha çok gelişmiştir ve bu durumun iklimle ilişkisi nedir?,"Akdeniz ve Ege kıyılarında pamuk, zeytin ve meyve yetiştiriciliği gelişmiştir. Bu durum, bölgedeki ılıman iklimle ilişkilidir.",Bağlamsal,11
Büyükbaş hayvancılık en çok hangi bölgemizde yapılmaktadır ve bu bölgenin özellikleri nelerdir?,Büyükbaş hayvancılık en çok Erzurum ve Kars çevresinde yapılmaktadır. Bu bölgede yaz yağışları ile yeşeren gür çayırlar ve otlaklar bulunmaktadır.,Olgusal,11
Küçükbaş hayvancılık neden ülkenin iç kısımlarında daha yaygındır?,"Küçükbaş hayvancılık, bozkır bitki örtüsünün olduğu ve engebenin fazla olmadığı ülkemizin iç kısımlarında daha yaygındır. Bozkır bitki örtüsü küçükbaş hayvanların beslenmesi için uygun ortam sağlar.",Nedensel,11
Su kaynaklarımızdan hangi alanlarda yararlanırız?,"Su kaynaklarımızdan turizm, ulaşım, balıkçılık ve hidroelektrik enerjisi elde edilmesinde yararlanırız.",Listeleme,11
Türkiye'de turizm çeşitliliği hangi bölgelerde yoğunlaşmıştır?,"Türkiye'de yaz turizmi Şanlıurfa, Ankara, Akdeniz ve Ege kıyılarında; kış turizmi Erzurum ve Bolu'da; doğa turizmi ise Nevşehir, Trabzon, Gaziantep, Karabük gibi yerlerde yoğunlaşmıştır.",Olgusal,11
Ormanların ekonomiye katkıları nelerdir?,"Ormanlar mobilya ve kağıt sanayisinin gelişmesine katkı sağlamıştır. Ayrıca çeşitli ürünlerle gıda, kozmetik ve ilaç sanayisinin hammaddeleri de ormanlarımızdan sağlanmaktadır.",Olgusal,11
Türkiye'deki önemli maden kaynakları nelerdir?,"Türkiye'deki önemli maden kaynakları taş kömürü, linyit, demir, bakır, krom ve bor'dur.",Listeleme,11
Nitelikli iş gücünün ekonomik faaliyetlerdeki rolü nedir?,Nitelikli iş gücü sayesinde üretim yapılabilmektedir. İnsanlar hizmet sektöründe görev yaparak ekonomiye katkı yapmaktadır.,Kavramsal,11
Türkiye'nin genç ve çalışkan nüfusu ekonomik açıdan ne gibi avantajlar sağlamaktadır?,"Türkiye'nin genç ve çalışkan nüfusu, insan kaynakları açısından önemli bir potansiyel oluşturarak ekonomik gelişime katkı sağlamaktadır.",Yansıtıcı,11
Gıda sanayisinin gelişimi hangi faktörlere bağlıdır?,"Gıda sanayisinin gelişimi, yetiştirilen gıda ürünlerinin işlenerek yeni ürünlerin elde edildiği yerlerde yoğunlaşmasına bağlıdır.",Nedensel,11
"Arıcılık faaliyetleri neden Muğla, Rize ve Hakkari gibi yerlerde yoğunlaşmıştır?","Arıcılık faaliyetleri Muğla, Rize ve Hakkari gibi yerlerde bitki çeşitliliğinin fazla olmasından dolayı yoğunlaşmıştır. Farklı bitki türleri arıların daha fazla bal üretmesini sağlar.",Nedensel,11
Doğal kaynakların bilinçsizce kullanılması nelere yol açabilir?,"Doğal kaynakların bilinçsizce kullanılması, bu kaynakların zarar görmesine hatta tükenmesine neden olabilir.",Nedensel,12
Su kirliliğinin nedenleri nelerdir?,"Akarsuların, göllerin ve denizlerin atıklarla ve çöplerle kirletilmesi su kirliliğine neden olur.",Nedensel,12
Taş kömürü hangi bölgemizden çıkarılır ve hangi sanayide kullanılır?,Taş kömürü Zonguldak ve çevresinden çıkarılır. Yüksek ısı elde edilen demir-çelik sanayisinde ve termik santrallerde elektrik üretiminde kullanılır.,Olgusal,12
Linyit madeni hangi amaçlarla kullanılır ve nerelerde bulunur?,"Linyit, ısı ve elektrik elde etmede kullanılır. Türkiye'de birçok yerde bulunur. Özellikle Manisa, Kütahya ve Kahramanmaraş çevresi önemli linyit madeni çıkarılan yerlerdir.",Olgusal,12
Türkiye'de petrol çıkarılan bölgeler nerelerdir ve nerelerde işlenir?,"Petrol Batman, Siirt, Adıyaman ve Diyarbakır'da çıkarılmaktadır. Ham petrol Batman, Orta Anadolu (Kırıkkale), Aliağa (İzmir), İpraş (İzmit), Ataş (Mersin) rafinerilerinde işlenmektedir.",Olgusal,12
Doğal gazın kullanım alanları nelerdir?,"Doğal gaz, bina ısınması ve elektrik üretimi gibi değişik sektörlerde kullanılmaktadır.",Olgusal,12
Yenilenebilir enerji kaynakları nelerdir?,"Yenilenebilir enerji kaynakları güneş enerjisi, rüzgâr enerjisi, hidroelektrik enerji ve jeotermal enerjidir.",Listeleme,12
Güneş enerjisinden nasıl yararlanılır ve hangi şehirlerde güneş enerjisi santralleri bulunmaktadır?,"Güneş panelleri sayesinde güneş enerjisinden elektrik üretimi ve sıcak su ihtiyacı elde edilir. Kayseri, Ankara, Balıkesir, Konya, Nevşehir, Van ve Sivas gibi şehirlerde güneş enerjisi panelleri tesisleri bulunmaktadır.",Yöntemsel,12
Rüzgâr enerjisi nasıl elde edilir ve hangi şehirlerde rüzgâr santralleri vardır?,"Rüzgârların sürekli ve etkili olduğu alanlarda kurulan rüzgâr santralleri sayesinde elde edilir. İzmir, İstanbul, Afyon, Balıkesir ve Çanakkale rüzgâr santrallerinin olduğu şehirlerdendir.",Yöntemsel,12
Hidroelektrik enerji nasıl üretilir ve Türkiye'deki önemli hidroelektrik santralleri hangileridir?,"Akarsular üzerinde yapılan barajlar sayesinde su gücünden elektrik elde edilmesidir. Atatürk Barajı, Keban Barajı, Karakaya Barajı, Hirfanlı Barajı, Altınkaya Barajı ve Seyhan Barajı elektrik üretimi yapılan önemli barajlarımızdandır.",Yöntemsel,12
Jeotermal enerji nedir ve nerelerde kullanılır?,Yer altındaki sıcak suyun yeryüzüne çıktığı yerlerde sıcak su ve su buharı gücünden elektrik enerjisi elde edilmesi amacıyla kurulan santrallerdir. Denizli ve Aydın’da jeotermal enerji santralleri vardır.,Olgusal,12
Bilinçli bir tüketici olarak kaynakları korumak neden önemlidir?,"Bilinçli bir tüketici olarak kaynakları korumak, kaynakların doğru şekilde kullanılmasını ve sonraki nesillere ulaştırılmasını sağlamak için önemlidir.",Kavramsal,12
Yenilenemeyen enerji kaynaklarının kullanımının sınırlandırılması neden gereklidir?,"Yenilenemeyen enerji kaynakları tükenebilen kaynaklar olduğu için, kullanımının sınırlandırılması bu kaynakların daha uzun süre kullanılabilmesini sağlamak ve çevreye olan olumsuz etkilerini azaltmak için gereklidir.",Nedensel,12
Türkiye'nin enerji ihtiyacını karşılama durumunu özetleyiniz.,"Türkiye, taş kömürü ve petrol gibi bazı enerji kaynaklarında dışa bağımlıdır. Doğal gaz ihtiyacının da büyük bir kısmını ithalat yoluyla karşılamaktadır. Yenilenebilir enerji kaynaklarının kullanımı artırılarak dışa bağımlılık azaltılmaya çalışılmaktadır.",Özetleme,12
"Eğer su kaynakları kirlenmeye devam ederse, gelecekte ne gibi sorunlarla karşılaşabiliriz?","Su kaynaklarının kirlenmeye devam etmesi durumunda, içme suyu kaynakları azalabilir, sulama suyu yetersiz kalabilir, suda yaşayan canlılar zarar görebilir ve genel olarak çevre sağlığı olumsuz etkilenebilir.",Varsayımsal,12
Bilinçli yatırım nedir?,"Bilinçli yatırım, bir bölgenin coğrafi özelliklerini dikkate alarak, o bölgeye uygun ekonomik faaliyetlerin ve yatırımların yapılmasıdır.",Kavramsal,13
Bir yerde ekonomik faaliyetlerin yapılabilmesi nelere bağlıdır?,"Bir yerde ekonomik faaliyetlerin ve yatırımların yapılabilmesi, o yerin iklimi, yeryüzü şekilleri, ulaşım imkânları, turizm, maden ve orman varlıkları gibi coğrafi özelliklerine bağlıdır.",Olgusal,13
Rize'de neden çay yetiştirilebilirken Konya'da buğday yetiştirilmektedir?,"Rize, yağış ve sıcaklık bakımından çay yetiştiriciliğine uygun şartlara sahipken, Konya buğday yetiştiriciliği için daha uygun iklim koşullarına sahiptir.",Nedensel,13
Erzurum ve Kars çevresinde hangi tür yatırımlar gelişmiştir ve bunun nedeni nedir?,"Erzurum ve Kars çevresinde hayvancılık ve hayvancılık ürünlerine ait yatırımlar gelişmiştir. Bunun nedeni, yeryüzü şekillerinin yükselti ve engebe bakımından hayvancılığa uygun olmasıdır.",Nedensel,13
Ülkemizin iç kesimlerinde hangi gıda ürünleri yatırımları yapılmıştır ve bu yatırımların sebebi nedir?,"Ülkemizin iç kesimlerinde un, şeker, makarna gibi gıda ürünleri yatırımları yapılmıştır. Bunun sebebi, yazların kurak kışların soğuk olması ve ovalar ile engebeli alanların buğday ve şeker pancarı üretimine uygun olmasıdır.",Nedensel,13
Turizme bağlı olarak hangi tür yatırımlar gelişmiştir?,Tarihi ve doğal güzelliklerin olduğu şehirlerde turizme bağlı olarak konaklama hizmetlerine yönelik yatırımlar gelişmiştir.,Olgusal,13
Maden işletmelerine yönelik yatırımlar hangi şehirlerde gelişmiştir?,"Zonguldak, Kütahya, Sivas, Manisa ve Afyon gibi şehirlerdeki madenlerden dolayı maden işletmelerine yönelik yatırımlar gelişmiştir.",Olgusal,13
Ormanların yoğun olduğu yerlerde hangi yatırımlar için uygun ortam vardır?,Ormanların yoğun olduğu yerlerde mobilya ve kâğıt üretimi için gerekli yatırımlara uygun ortam vardır.,Olgusal,13
Ham madde nedir?,"Ham madde, işlenmemiş veya yarı işlenmiş ürünlere denir.",Olgusal,13
Bir yerde yatırım yapılabilmesi için hammaddenin önemi nedir?,"Bir yerde yatırım yapılabilmesi için o yerdeki hammaddenin özelliklerine uygun yatırımlar yapılabilir. Örneğin, buğdaydan un, sütten peynir, linyit madeninden elektrik, şeker pancarından şeker üretilebilmesi hammaddelerin varlığına bağlıdır.",Kavramsal,13
Sermaye bir yatırım için neden önemlidir?,"Sermaye, yatırım faaliyetinin yapılması, ham maddelerin sağlanması, işlenebilmesi ve dağıtım aşamaları amacıyla kurulacak tesisler ile iş gücü giderlerinin karşılanması için gerekli olan paradır.",Kavramsal,13
Ulaşım imkanlarının gelişmiş olması yatırımlar için neden gereklidir?,"Ulaşım imkânlarının gelişmiş ve hızlı olması, ham maddeye ulaşmayı ve üretilen ürünlerin tüketicilere ulaşmasını kolaylaştıracağından yatırımlar için gereklidir.",Nedensel,13
Nitelikli iş gücü bir yatırım için neden önemlidir?,"Nitelikli iş gücü, üretimde ihtiyaç olan ve en fazla verimi elde edecek olan insan gücünü sağlar.",Kavramsal,13
Teknoloji ve makineler yatırımda ne işe yarar?,"Teknoloji ve makineler, üretim için gerekli araç gereçler ve makinelerdir. Örneğin, petrolü yer altından çıkarmak için gerekli tesisi kurabilecek teknoloji, orman ürünlerini işleyerek mobilya üretecek makineler, şeker pancarını işleyerek şekeri üretecek teknoloji ve makinelerdir.",Olgusal,13
Pazarın bir yatırım için önemi nedir?,"Pazar, yatırımı yapılan ve üretilen ürünlerin veya hizmetin belli bir yerdeki insanların ihtiyacı ve talebi olduğu yerlerdir. Ürünlerin ve hizmetin bu alanlara pazarlanması ve satılması gerekmektedir.",Kavramsal,13
Ekonomik kaynak nedir?,"Topraklar, sular ve madenler gibi doğal varlıklar ekonomik kaynak olarak adlandırılır.",Olgusal,14
1927'deki nüfusun ekonomik faaliyet kollarına dağılımı nasıldı?,"1927'de nüfusun %89,6'sı tarım, %4,8'i sanayi ve %5,6'sı hizmet sektöründe çalışıyordu.",Olgusal,14
2018'deki nüfusun ekonomik faaliyet kollarına dağılımı nasıldı?,"2018'de nüfusun %25,2'si tarım, %26,2'si sanayi ve %48,6'sı hizmet sektöründe çalışıyordu.",Olgusal,14
"1927-2018 yılları arasındaki ekonomik faaliyetlerdeki değişim, Türkiye'nin gelişmişlik düzeyini nasıl etkilemiştir?","Tarımın payının azalması, sanayi ve hizmet sektörlerinin payının artması, ülkenin ekonomik olarak geliştiğini göstermektedir.",Analitik,14
"Yusuf'un anlattığına göre, yaşadığı yerin ekonomik faaliyetlerindeki çeşitliliğin nedenleri nelerdir?","Yağışın bol ve her mevsime yayılması, fındık ve çay yetiştiriciliğine olanak sağlaması, gür ormanların bulunması, taş kömürü madeninin çıkarılması ve doğal güzelliklere sahip olmasıdır.",Nedensel,14
Yusuf'un anlatımında hangi ekonomik kaynaklara değinilmemiştir?,"Yusuf, toprak kaynakları, su kaynakları, turizm kaynakları ve maden kaynaklarına değinmiştir. Soruda değinilmeyeni sorulduğu için cevap su kaynaklarıdır.",Çözümleme,14
"Eğitim, sağlık ve güvenlik ekonomik kaynak mıdır?","Hayır, eğitim, sağlık ve güvenlik hizmet sektörüne girer ve temel ihtiyaçlardır, doğrudan ekonomik kaynak olarak sınıflandırılmaz.",Olgusal,14
Tarım ve hayvancılık kaynakları sanayinin gelişmesi için neden gereklidir?,"Tarım ve hayvancılık, sanayi için ham madde sağlar. Örneğin, tekstil sanayisi için pamuk, gıda sanayisi için çeşitli tarım ürünleri gereklidir.",Nedensel,14
Ülkenin kaynaklarının çeşitli ve fazla miktarda olması tüketimi nasıl etkiler?,"Ülkenin kaynaklarının çeşitli ve fazla olması, daha fazla ürün üretilmesine ve dolayısıyla tüketimin artmasına olanak sağlar.",Nedensel,14
Ekonomik kaynaklara örnekler nelerdir?,"Topraklar, sular, madenler, ormanlar ve diğer doğal kaynaklar ekonomik kaynaklara örnektir.",Listeleme,14
Ham madde nedir?,"Ülkemizin gıda, giyim ve mobilya sanayisi gibi çeşitli sanayiler için gerekli olan işlenmemiş ürünlere ham madde denir.",Olgusal,14
Sanayi nedir?,Ekonomik kaynaklar sayesinde elde edilen ürünlerin işlenmesi ve yeni ürünler üretilmesi sürecine sanayi denir.,Olgusal,14
"Üretim, dağıtım ve tüketim arasındaki ilişkiyi açıklayın.","Üretim, kaynakların kullanılarak mal ve hizmet yaratılmasıdır. Dağıtım, bu mal ve hizmetlerin tüketicilere ulaştırılmasıdır. Tüketim ise, mal ve hizmetlerin kullanılmasıdır. Bu üçü bir döngü oluşturur.",Kavramsal,14
Yaşadığınız yerdeki ekonomik faaliyetler nelerdir?,"Bu sorunun cevabı, öğrencinin yaşadığı yere göre değişir. Örneğin, İstanbul'da hizmet sektörü ve ticaret gelişmişken, Rize'de çay tarımı önemlidir.",Bağlamsal,14
Türkiye ekonomisi için en önemli üç sektör hangileridir?,"Hizmet, sanayi ve tarım sektörleri Türkiye ekonomisi için önemlidir. Hizmet sektörü son yıllarda en büyük paya sahipken, sanayi ve tarım da önemli katkılar sağlamaktadır.",Analitik,14
Günlük hayatta kullandığımız kaynakların yanlış ve bilinçsizce tüketilmesinin olumsuz sonuçları nelerdir?,"Kaynakların yanlış ve bilinçsizce tüketilmesi, kıtlığa, çevresel sorunlara, ekonomik dengesizliklere ve gelecek nesillerin ihtiyaçlarının karşılanamamasına yol açabilir.",Olgusal,15
Enerji kaynaklarımızın özellikleri ve bunları kullanırken dikkat etmemiz gerekenler nelerdir?,"Enerji kaynakları farklı özelliklere sahiptir. Bazıları yenilenebilir (güneş, rüzgar, su) iken bazıları tükenir (petrol, kömür, doğal gaz). Kullanırken, yenilenebilir kaynakları tercih etmeli, enerjiyi verimli kullanmalı ve çevresel etkileri en aza indirmeliyiz.",Olgusal,15
"Aşağıdakilerden hangisi yenilenebilir enerji kaynağıdır: Hidroelektrik, LPG, Linyit, Doğal gaz?","Hidroelektrik, yenilenebilir enerji kaynağıdır.",Olgusal,15
İnsanların ihtiyacı olan yeryüzündeki tüm doğal kaynaklar tükenmez ve bitmez midir?,"Hayır, insanların ihtiyacı olan yeryüzündeki tüm doğal kaynaklar tükenmez ve bitmez değildir. Aksine, bilinçsiz tüketim sonucu birçok kaynak tükenme tehlikesiyle karşı karşıyadır.",Olgusal,15
"Güneş, rüzgâr ve akarsulardan elde edilen enerji zamanla tükenir mi?","Hayır, güneş, rüzgâr ve akarsulardan elde edilen enerji zamanla tükenmez. Bunlar yenilenebilir enerji kaynaklarıdır.",Olgusal,15
Yenilenebilir enerji kaynakları çevreye ve doğaya zararlı mıdır?,"Hayır, yenilenebilir enerji kaynakları çevreye ve doğaya zararlı değildir. Aksine, fosil yakıtlara göre çok daha az çevresel etkiye sahiptirler.",Olgusal,15
"Linyit, petrol, doğal gaz gibi enerji kaynaklarına ne ad verilir?","Linyit, petrol, doğal gaz gibi enerji kaynaklarına tükenebilir enerji kaynakları denir.",Olgusal,15
"Isınma, elektrik elde etme ve araçları hareket ettirme amacıyla kullandığımız ürünlere ne ad verilir?","Isınma, elektrik elde etme ve araçları hareket ettirme amacıyla kullandığımız ürünlere enerji kaynakları denir.",Olgusal,15
"Çevreye zarar vermeyen, kaynağı güneş, su ve rüzgâr olan, kullanımının tercih edilmesi gereken enerjiye ne ad verilir?","Çevreye zarar vermeyen, kaynağı güneş, su ve rüzgâr olan, kullanımının tercih edilmesi gereken enerjiye tükenmeyen enerji veya yenilenebilir enerji denir.",Olgusal,15
Neden yenilenebilir enerji kaynaklarını kullanmalıyız?,"Yenilenebilir enerji kaynakları, çevreye daha az zarar verir, sınırsızdır ve sürdürülebilir bir enerji geleceği için önemlidir.",Nedensel,15
Tükenebilir enerji kaynaklarının kullanımının çevresel etkileri nelerdir?,"Tükenebilir enerji kaynaklarının kullanımı, hava kirliliğine, sera gazı emisyonlarına, iklim değişikliğine ve doğal kaynakların tahribatına yol açabilir.",Yansıtıcı,15
Enerji tasarrufu yapmak neden önemlidir?,"Enerji tasarrufu yapmak, doğal kaynakları korumak, enerji maliyetlerini düşürmek ve çevreyi korumak için önemlidir.",Kavramsal,15
Yenilenebilir enerji kaynaklarının yaygınlaşması için neler yapılabilir?,"Yenilenebilir enerji kaynaklarının yaygınlaşması için devlet teşvikleri artırılabilir, teknolojik gelişmeler desteklenebilir, bilinçlendirme çalışmaları yapılabilir ve altyapı yatırımları yapılabilir.",Yöntemsel,15
Hidroelektrik enerjinin avantajları ve dezavantajları nelerdir?,"Hidroelektrik enerjinin avantajları, temiz ve yenilenebilir bir kaynak olmasıdır. Dezavantajları ise barajların inşasının çevresel etkileri ve su kaynaklarının kullanımında değişikliklere yol açabilmesidir.",Analitik,15
Fosil yakıtların kullanımını azaltmak için bireysel olarak neler yapabiliriz?,"Fosil yakıtların kullanımını azaltmak için toplu taşıma veya bisikleti tercih edebilir, enerji tasarruflu cihazlar kullanabilir, yalıtımı iyileştirebilir ve yenilenebilir enerji kaynaklarına yatırım yapabiliriz.",Yöntemsel,15
