question,answer,question_type,page
Demokrasiyi diğer yönetim biçimlerinden ayıran temel özellikler nelerdir?,"Demokrasiyi diğer yönetim biçimlerinden ayıran temel özellikler; egemenliğin millete ait olması, eşitlik, özgürlük, insan haklarına saygı ve seçimle belirlenen yöneticilerin varlığıdır.",Analitik,27
Hangi yönetim biçimlerinde yöneticiler eleştirilemez veya yargılanamaz?,"Monarşi yönetim şeklinde yöneticiler verdikleri kararlardan dolayı eleştirilemez, suçlanamaz ve yargılanamazlar.",Olgusal,27
Ülkemizin yönetim şekli nedir ve bu yönetim şekli hangi anlayışa bağlıdır?,Ülkemizin yönetim şekli cumhuriyettir ve demokrasi anlayışına bağlıdır.,Olgusal,28
Kuvvetler ayrılığı ilkesi ne anlama gelir ve hangi güçleri içerir?,"Kuvvetler ayrılığı, yasama, yürütme ve yargı güçlerinin birbirinden ayrılarak devlet yönetiminin düzenlenmesidir.",Kavramsal,28
TBMM'nin yasama görevi kapsamında hangi yetkileri bulunmaktadır?,"TBMM'nin yasama görevi kapsamında yasaların çıkarılması, kanun yapmak veya değiştirmek, savaş ve af ilanlarına karar vermek, para basılmasına karar vermek gibi yetkileri bulunmaktadır.",Olgusal,28
Cumhurbaşkanı'nın yürütme görevi çerçevesindeki temel sorumlulukları nelerdir?,"Cumhurbaşkanı kanunları uygular, devletin ve hükümetin başıdır, yurt içinde ve yurt dışında devleti temsil eder, uluslararası anlaşmaları onaylar ve yayınlar, bakanları atar ve ülkenin yasalara uygun yönetilmesini sağlar.",Olgusal,28
Yargı gücünün bağımsız mahkemeler aracılığıyla gerçekleştirdiği temel işlev nedir?,"Yargı gücü, bağımsız mahkemeler sayesinde vatandaşlarla vatandaşlar arasındaki ve vatandaşlarla devlet arasındaki hukuki anlaşmazlıkları çözer.",Olgusal,28
Ülke yönetimine katılma ve karar alma süreçlerinde söz sahibi olma hakkımız nasıl güvence altına alınmıştır?,Ülke yönetimine katılma ve karar alma süreçlerinde söz sahibi olma hakkımız anayasa ile güvence altına alınmış yasal bir haktır.,Olgusal,28
Halkın yönetime katılımı ve yönetimde etkili olması hangi yollarla sağlanır?,"Halkın yönetime katılımı ve yönetimde etkili olması siyasi partiler, sivil toplum kuruluşları kurarak, medya aracılığıyla ve bireysel olarak kamuoyu oluşturması ile sağlanır.",Yöntemsel,28
Siyasi partilerin kurulma şartları ve vatandaşların siyasi partilere katılımı nasıl düzenlenmiştir?,Siyasi partiler kanunlara uygun şekilde vatandaşlarca kurulabilir ve vatandaşlar siyasi partilere üye olup çalışmalarına katılabilirler. Vatandaşlar seçimlerde seçme hakkını kullanarak oy kullanıp siyasi partileri destekleyebilirler.,Olgusal,28
Sivil toplum kuruluşlarının (STK) temel amacı ve işlevi nedir?,"Sivil toplum kuruluşları çeşitli konularda insanları bilgilendirmek, bilinçlendirmek ve kamuoyu oluşturmak amacıyla gönüllülük esasına dayalı olarak görev yapan vatandaşlar tarafından kurulmuş kuruluşlardır.",Kavramsal,28
Metinde örnek olarak verilen sivil toplum kuruluşları hangileridir ve hangi alanlarda faaliyet gösterirler?,"Metinde örnek olarak verilen sivil toplum kuruluşları AÇEV (Anne Çocuk Eğitim Vakfı) ve Darüşşafaka Cemiyeti (eğitim), TEMA Vakfı (Türkiye Erozyonla Mücadele ve Eğitim Vakfı) (sağlıklı bir çevre) olarak belirtilmiştir.",Olgusal,28
Medyanın toplum üzerindeki etkisi ve kamuoyu oluşturma sürecindeki rolü nedir?,Medya sayesinde toplumun bilgilendirilmesi ve yönlendirilmesi sağlanarak kamuoyu oluşturulur.,Kavramsal,28
Kamuoyu ne anlama gelir ve vatandaşlar kamuoyu oluşturarak yönetim kararlarını nasıl etkileyebilirler?,"Kamuoyu, bir sorun, konu veya taleple ilgili vatandaşlarda oluşan ortak düşünceye denir. Vatandaşlar kamuoyu oluşturarak birlikte hareket ederler ve kanunlara uygun şekilde yönetimin kararlarında etkili olurlar.",Kavramsal,28
Vatandaşların yaşadıkları yerdeki bir sorunla ilgili yetkililere taleplerini iletme süreci nasıl işler?,Vatandaşlar yaşadıkları yerdeki bir sorunla ilgili kamuoyu oluşturarak yetkililere taleplerini iletebilir ve çözümünü isteyebilirler.,Yöntemsel,28
"Yasama, yürütme ve yargı erklerinin ayrılmasının önemi nedir?","Yasama, yürütme ve yargı erklerinin ayrılması, devlet gücünün tek elde toplanmasını engelleyerek, yetkilerin dağıtılması ve denetlenmesi yoluyla demokrasinin korunmasına hizmet eder.",Kavramsal,28
Demokratik bir ülkede vatandaşların ülke yönetimine katılmasının önemi nedir?,"Demokratik bir ülkede vatandaşların ülke yönetimine katılması, yönetimin halkın iradesini yansıtmasını sağlayarak, daha adil ve kapsayıcı kararlar alınmasına katkıda bulunur.",Yansıtıcı,28
Demokrasinin temel ilkeleri nasıl bir yönetim şeklinin yaşanmasını sağlar?,"Demokrasinin temel ilkeleri, halkın yönetime katıldığı, özgürlüklerin ve eşitliğin ön planda olduğu bir yönetim şeklinin yaşanmasını sağlar.",Olgusal,29
Demokrasi yönetimini diğer yönetimlerden ayıran temel özellikler nelerdir?,"Demokrasi yönetimi, halkın egemenliğine dayanması, seçme ve seçilme hakkının bulunması, farklı düşüncelerin serbestçe ifade edilebilmesi ve hukukun üstünlüğü gibi özellikleriyle diğer yönetimlerden ayrılır.",Kavramsal,29
"Yönetimde söz sahibi olan kişilerin soylular, din adamları veya padişahın olduğu yönetim şekillerinde, alınan kararların tartışılamamasının ve eleştirilememesinin nedeni nedir?",Bu tür yönetimlerde yönetici veya yönetici sınıfının otoritesi sorgulanamaz kabul edildiği için kararlar tartışılamaz veya eleştirilemez. Yönetim hakkının ilahi veya geleneksel bir hak olduğuna inanılır.,Nedensel,29
Yukarıdaki paragrafta özellikleri anlatılan yönetim şekillerinden hangisine değinilmemiştir? A) Teokrasi B) Monarşi C) Oligarşi D) Cumhuriyet,Cevap: D) Cumhuriyet,Olgusal,29
Demokrasi cumhuriyet yönetime ait ilkeler içeren yönetim anlayışıdır. Bu ifade doğru mu yanlış mı? Yanlış ise doğrusu nedir?,Doğru,Analitik,29
Demokrasi ile yönetilen ülkelerde egemenlik belirli bir zümreye mi aittir? Yanlış ise doğrusu nedir?,Yanlış. Doğrusu: Demokrasi ile yönetilen ülkelerde egemenlik halka aittir.,Analitik,29
"Teokrasi yöneticilerinin din adamlarının olduğu, yönetimin dini kurallara bağlı olduğu yönetim şeklidir. Bu ifade doğru mu yanlış mı?",Doğru,Olgusal,29
"Egemenliğin halka ait olduğu, seçme ve seçilme hakkı ile halkın yönetimde yer aldığı yönetim anlayışına ne denir?",Demokrasi,Olgusal,29
"İnsanların din, dil, ırk gibi ayrımı yapılmadan tüm haklara sahip olmasına ne denir?",Eşitlik,Olgusal,29
"Egemenliğin padişah, sultan, kral, şah, gibi adlandırılan kişilerde olan yönetim şekline ne denir?",Monarşi,Olgusal,29
Demokrasinin temel ilkelerinden eşitlik ilkesi olmasaydı ne gibi sorunlar yaşanabilirdi?,"Eşitlik ilkesi olmasaydı, bazı gruplar veya bireyler diğerlerinden daha fazla hak ve imkana sahip olabilir, bu da toplumsal huzursuzluğa, adaletsizliğe ve ayrımcılığa yol açabilirdi.",Varsayımsal,29
"Monarşi yönetiminde yasama, yürütme ve yargı yetkileri kimdedir?","Monarşi yönetiminde yasama, yürütme ve yargı yetkileri genellikle hükümdarın (padişah, kral vb.) elindedir.",Olgusal,29
Teokrasi yönetiminin temel özelliği nedir?,"Teokrasi yönetiminin temel özelliği, devletin dini kurallara göre yönetilmesi ve yöneticilerin din adamları olmasıdır.",Kavramsal,29
Demokrasinin başarılı bir şekilde uygulanabilmesi için hangi unsurlara ihtiyaç vardır?,"Demokrasinin başarılı bir şekilde uygulanabilmesi için hukukun üstünlüğü, ifade özgürlüğü, örgütlenme özgürlüğü, serbest seçimler, aktif bir sivil toplum ve eğitimli bir toplum gibi unsurlara ihtiyaç vardır.",Listeleme,29
"Metinde bahsedilen üç yönetim şeklinin (demokrasi, monarşi, teokrasi) temel farklarını özetleyiniz.","Demokraside egemenlik halka aittir ve halk seçme-seçilme hakkıyla yönetime katılır. Monarşide egemenlik tek bir kişiye (kral, padişah vb.) aittir ve genellikle babadan oğula geçer. Teokraside ise devlet dini kurallara göre yönetilir ve yöneticiler din adamlarıdır.",Özetleme,29
"Ülkemizin yönetim anlayışını oluşturan, anayasa ile belirlenmiş güçler nelerdir?","Ülkemizin yönetim anlayışını oluşturan anayasal güçler yasama, yürütme ve yargıdır.",Olgusal,30
"Yasama, yürütme ve yargı güçlerinin görevlerinin ayrı olmasının nedenleri nelerdir?","Yasama, yürütme ve yargı güçlerinin ayrılığı, kuvvetler ayrılığı ilkesini oluşturur ve bu ilke, yetkilerin tek elde toplanmasını engelleyerek demokratik devlet ilkelerini korur.",Kavramsal,30
Kuvvetler ayrılığı ilkesi nedir?,"Kuvvetler ayrılığı ilkesi, cumhuriyet yönetiminde yasama yetkisinin TBMM'de, yürütme yetkisinin Cumhurbaşkanında, yargı yetkisinin ise bağımsız mahkemelerde olmasına dayanır.",Olgusal,30
"Yönetim anlayışında yasama, yürütme ve yargı organlarının birleştirilmesi hangi sonuca neden olur?","Yönetim anlayışında yasama, yürütme ve yargı organlarının birleştirilmesi demokratik devlet ilkelerinden uzaklaşılmasına neden olur.",Nedensel,30
Yasama yetkisi hangi organdadır?,Yasama yetkisi Türkiye Büyük Millet Meclisi'ndedir (TBMM).,Olgusal,30
Yürütme yetkisi hangi organdadır?,Yürütme yetkisi Cumhurbaşkanındadır.,Olgusal,30
Yargı yetkisi hangi organdadır?,Yargı yetkisi bağımsız mahkemelerdedir.,Olgusal,30
Türkiye'deki yönetim anlayışında yasama ve yürütme yetkisi tek elden mi yapılmaktadır?,"Hayır, Türkiye'deki yönetim anlayışında yasama ve yürütme yetkisi tek elden yapılmamaktadır. Yasama TBMM'ye, yürütme ise Cumhurbaşkanına aittir.",Olgusal,30
Kanun yapmak ve kanunları değiştirmek hangi organın görevidir?,"Kanun yapmak ve kanunları değiştirmek TBMM'nin görevidir, bağımsız mahkemelerin değil.",Olgusal,30
Yasama görevi bakanlar tarafından mı yürütülür?,"Hayır, yasama görevi bakanlar tarafından değil, TBMM tarafından yürütülür.",Olgusal,30
Yürütme görevi TBMM ve Bağımsız Mahkemelerde Cumhurbaşkanı tarafından mı yürütülür?,"Hayır, yürütme görevi TBMM ve bağımsız mahkemelerde değil, Cumhurbaşkanı tarafından yürütülür.",Olgusal,30
Meclis tarafından kanunların değiştirilmesi veya yeni kanunların çıkarılmasına ne denir?,"Meclis tarafından kanunların değiştirilmesi, kaldırılması veya yeni kanunların çıkarılmasına yasama denir.",Olgusal,30
"Yasama, yürütme ve yargı güçlerinin ayrı olmasına ne ad verilir?","Yasama, yürütme ve yargı güçlerinin ayrı olmasına kuvvetler ayrılığı denir.",Olgusal,30
Demokratik devletlerde hukuki konulara bakan ve hiçbir baskı altında kalmadan karar veren birimlere ne denir?,Demokratik devletlerde hukuki konulara bakan ve hiçbir baskı altında kalmadan karar veren birimlere bağımsız mahkemeler denir.,Olgusal,30
Kuvvetler ayrılığının önemi nedir?,"Kuvvetler ayrılığı, devlet gücünün tek bir organda toplanmasını engelleyerek, keyfi uygulamaların önüne geçer ve vatandaşların hak ve özgürlüklerini korur. Aynı zamanda, farklı görüşlerin temsil edilmesini ve daha dengeli kararlar alınmasını sağlar.",Kavramsal,30
Yönetimlerin karar alma sürecinde etkili olmak için neler yapılabilir?,"Yönetimlerin karar alma sürecinde etkili olmak için dilekçe yazılabilir, temsilciler seçilerek yetkililerle görüşülebilir, kamuoyu oluşturulabilir ve sivil toplum kuruluşları aracılığıyla çalışmalar yapılabilir.",Yöntemsel,31
Yönetimin karar alma sürecini etkileyen unsurların özellikleri nelerdir?,"Yönetimin karar alma sürecini etkileyen unsurlar arasında kamuoyu, medya, sivil toplum kuruluşları ve yasalar bulunur. Bu unsurların her biri farklı yollarla yönetimin kararlarını etkileyebilir.",Kavramsal,31
Hakanların Köyü'ndeki sorunla ilgili çözümde etkili olan ve yönetimin karar alma sürecini etkileyen unsur nedir?,"Hakanların Köyü'ndeki sorunla ilgili çözümde etkili olan ve yönetimin karar alma sürecini etkileyen unsur kamuoyudur. Köy halkının ortak düşüncesi ve talepleri, yerel yönetimin karar alma sürecini etkilemiştir.",Olgusal,31
Sivil toplum kuruluşları ne tür faaliyetlerde bulunur?,"Sivil toplum kuruluşları, devlet kurumlarından bağımsız ve özgür olarak çeşitli faaliyetlerde bulunur. Bu faaliyetler arasında yardım kampanyaları düzenlemek, eğitimler vermek, çevre sorunlarına dikkat çekmek ve insan haklarını savunmak yer alabilir.",Olgusal,31
Vatandaşların bir araya gelerek ortak düşüncede birleşmeleri ve birlikte hareket etmeleri yasal bir hak mıdır?,"Evet, vatandaşların bir araya gelerek ortak düşüncede birleşmeleri ve birlikte hareket etmeleri yasalarla verilmiş bir haktır. Bu hak, ifade özgürlüğü ve örgütlenme özgürlüğü kapsamında değerlendirilir.",Olgusal,31
Siyasi partilerin temel amacı nedir?,"Siyasi partilerin temel amacı, ülke yönetimini etkilemek veya yönetimde görev almaktır. Maddi durumu yetersiz kişilere yardım etmek öncelikli amaçları değildir.",Olgusal,31
Ülke yönetimini etkilemek için kurulan kuruluşlara ne ad verilir?,Ülke yönetimini etkilemek veya yönetimde görev almak için vatandaşlarca kurulmuş olan kuruluşlara siyasi partiler denir.,Olgusal,31
Bireylerin bir konudaki ortak fikir ve düşüncesine ne denir?,Bireylerin bir konudaki ortak fikir ve düşüncesine kamuoyu denir.,Olgusal,31
Yönetimlerin karar alma sürecini yazılı ve görsel yollarla etkileyen unsur hangisidir?,Yönetimlerin karar alma sürecini yazılı ve görsel yollarla etkileyen unsura medya denir.,Olgusal,31
Kamuoyunun bir sorunun çözümündeki rolü nedir?,"Kamuoyu, bir sorunun çözümünde farkındalık yaratarak, baskı oluşturarak ve karar alıcıları etkileyerek önemli bir rol oynar. Halkın desteği, çözümün bulunmasını kolaylaştırabilir.",Kavramsal,31
Sivil toplum kuruluşlarının devletten bağımsız olması neden önemlidir?,"Sivil toplum kuruluşlarının devletten bağımsız olması, farklı görüşlerin özgürce ifade edilebilmesini ve toplumun çeşitli ihtiyaçlarının karşılanabilmesini sağlar. Bağımsızlık, eleştirel bir bakış açısının korunmasına da yardımcı olur.",Kavramsal,31
Medyanın yönetimin karar alma sürecindeki etkisini açıklayınız.,"Medya, haberler, yorumlar ve yayınlar aracılığıyla kamuoyunu bilgilendirerek ve yönlendirerek yönetimin karar alma sürecini etkileyebilir. Yanlış veya eksik bilgilendirme ise süreci olumsuz etkileyebilir.",Analitik,31
Yasaların yönetimin karar alma sürecindeki önemi nedir?,"Yasalar, yönetimin karar alma sürecini çerçeveleyen ve sınırlandıran temel kurallardır. Yasalar, adil ve şeffaf bir yönetim için önemlidir ve keyfi uygulamaların önüne geçer.",Kavramsal,31
Siyasi partiler ve sivil toplum kuruluşları arasındaki temel farklar nelerdir?,"Siyasi partiler ülke yönetimini etkilemek veya yönetime gelmek amacıyla kurulurken, sivil toplum kuruluşları belirli bir konuda toplumsal fayda sağlamak için kurulur. Siyasi partiler siyasi ideolojilere sahipken, sivil toplum kuruluşları genellikle belirli bir amaca odaklanır.",Analitik,31
"Eğer köy halkı ortaokul yapılması için bir araya gelmeseydi, ne olurdu?","Eğer köy halkı ortaokul yapılması için bir araya gelmeseydi, köydeki ortaokul öğrencilerinin ilçe merkezine gitme zorluğu devam ederdi ve bu durum eğitimde fırsat eşitsizliğine yol açabilirdi.",Varsayımsal,31
Sivil Toplum Kuruluşları (STK) yönetimlerin karar alma süreçlerini nasıl etkiler?,"STK'lar, lobi faaliyetleri, kamuoyu oluşturma, araştırma sonuçlarını sunma ve ilgili paydaşlarla işbirliği yaparak yönetimlerin karar alma süreçlerini etkileyebilirler.",Kavramsal,32
Sivil Toplum Kuruluşları'nın çalışmalarına örnekler nelerdir?,"STK'ların çalışmalarına örnek olarak çevre koruma projeleri, insan hakları savunuculuğu, eğitim programları, sağlık hizmetleri sunumu ve afet yardımı faaliyetleri verilebilir.",Listeleme,32
Yönetimlerin karar alma süreçlerini etkileyen unsurlara STK'lar dışında başka hangi örnekler verilebilir?,"Yönetimlerin karar alma süreçlerini etkileyen unsurlara STK'lar dışında siyasi partiler, medya, kamuoyu, ekonomik faktörler ve uluslararası kuruluşlar örnek verilebilir.",Bağlamsal,32
Bir STK'nın başarılı bir şekilde karar alma süreçlerini etkilemesi için hangi özelliklere sahip olması gerekir?,"Bir STK'nın başarılı bir şekilde karar alma süreçlerini etkilemesi için güçlü bir organizasyona, finansal kaynaklara, uzman kadroya, etkili iletişim stratejilerine ve kamuoyunda güvenilir bir imaja sahip olması gerekir.",Analitik,32
STK'ların yönetimlerin karar alma süreçlerindeki rolü neden önemlidir?,"STK'ların rolü, toplumun farklı kesimlerinin sesini duyurarak, şeffaflığı artırarak ve daha katılımcı bir yönetim anlayışını teşvik ederek önemlidir.",Kavramsal,32
Türkiye'de faaliyet gösteren ve yönetimlerin karar alma süreçlerini etkileyen bir STK örneği verebilir misiniz?,"Türkiye'de faaliyet gösteren ve yönetimlerin karar alma süreçlerini etkileyen bir STK örneği olarak Türkiye Çevre Eğitim Vakfı (TÜRÇEV) verilebilir. TÜRÇEV, çevre bilincini artırma ve sürdürülebilir kalkınma konularında çalışmalar yürütmektedir.",Olgusal,32
STK'lar karar alma süreçlerini etkilerken hangi etik kurallara uymalıdır?,"STK'lar karar alma süreçlerini etkilerken şeffaflık, hesap verebilirlik, dürüstlük, tarafsızlık ve kamu yararını gözetme gibi etik kurallara uymalıdır.",Kavramsal,32
STK'ların karar alma süreçlerini etkileme yöntemleri nelerdir?,"STK'lar karar alma süreçlerini etkilemek için kamuoyu oluşturma, lobi faaliyetleri yürütme, araştırmalar yapıp raporlar yayınlama, kampanyalar düzenleme ve yetkililerle doğrudan iletişim kurma gibi yöntemler kullanırlar.",Yöntemsel,32
"Eğer bir STK, yönetimlerin karar alma sürecini olumsuz yönde etkilemeye çalışırsa ne gibi sonuçlar ortaya çıkabilir?","Eğer bir STK, yönetimlerin karar alma sürecini olumsuz yönde etkilemeye çalışırsa, kamuoyunda itibar kaybı yaşayabilir, finansal desteklerini kaybedebilir ve yasal yaptırımlarla karşılaşabilir.",Varsayımsal,32
STK'ların karar alma süreçlerini etkileme gücü hangi faktörlere bağlıdır?,"STK'ların karar alma süreçlerini etkileme gücü, üye sayısı, finansal kaynakları, uzmanlık alanı, kamuoyu desteği ve siyasi bağlantıları gibi faktörlere bağlıdır.",Analitik,32
Sivil Toplum Kuruluşları'nın (STK) temel amacı nedir?,"Sivil Toplum Kuruluşları'nın temel amacı, belirli bir toplumsal soruna çözüm bulmak, bir ihtiyacı karşılamak veya bir kamu yararı sağlamaktır.",Kavramsal,32
"STK'ların karar alma süreçlerindeki rolü, demokratik bir toplum için neden önemlidir?","STK'ların rolü, vatandaşların yönetime katılımını sağlayarak, farklı görüşlerin temsil edilmesine olanak tanıyarak ve yönetimlerin hesap verebilirliğini artırarak demokratik bir toplum için önemlidir.",Yansıtıcı,32
STK'ların çalışmalarını desteklemek için neler yapılabilir?,"STK'ların çalışmalarını desteklemek için gönüllü olunabilir, bağış yapılabilir, kampanyalarına destek verilebilir ve farkındalık yaratma çalışmalarına katkıda bulunulabilir.",Yöntemsel,32
STK'lar hangi durumlarda yönetimlerin karar alma süreçlerini etkilemede başarısız olabilir?,"STK'lar yetersiz kaynaklara sahip olduklarında, kamuoyu desteği eksik olduğunda, siyasi baskılara maruz kaldıklarında veya içsel sorunlar yaşadıklarında yönetimlerin karar alma süreçlerini etkilemede başarısız olabilirler.",Analitik,32
Karar alma süreçlerini etkileyen STK'ların faaliyetleri hakkında kısa bir özet verebilir misiniz?,"STK'lar, yönetimlerin karar alma süreçlerini etkilemek için çeşitli yöntemler kullanır; bunlar arasında kamuoyu oluşturma, lobi faaliyetleri yürütme, araştırma raporları yayınlama ve doğrudan iletişim kurma yer alır. Başarılı STK'lar, güçlü organizasyon yapılarına, finansal kaynaklara ve kamuoyunda güvenilir bir imaja sahiptir.",Özetleme,32
Etkin vatandaşlık kavramı bu metinde neyi ifade ediyor olabilir?,"Bu metinde etkin vatandaşlık, demokrasi, anayasal güvenceler ve kadınların başarısı gibi unsurların bir araya gelmesiyle oluşan, katılımcı ve bilinçli bir vatandaşlık anlayışını ifade ediyor olabilir.",Kavramsal,33
Metinde 'Demokrasi bizim için' ifadesi ne anlama geliyor?,"'Demokrasi bizim için' ifadesi, demokrasinin toplumun tüm kesimleri için önemli ve değerli olduğunu vurguluyor. Demokrasinin, vatandaşların hak ve özgürlüklerini koruyan, katılımlarını sağlayan bir yönetim biçimi olduğu anlamına geliyor.",Yorumlayıcı,33
'Anayasal güvencedeyiz' ifadesi neyi belirtiyor?,"'Anayasal güvencedeyiz' ifadesi, vatandaşların haklarının ve özgürlüklerinin anayasa tarafından korunduğunu, devletin keyfi uygulamalarına karşı güvence altında olduğunu belirtiyor.",Olgusal,33
Metinde 'Kadınlarımızın başarısı' ifadesinin vurgulanmasının sebebi nedir?,"'Kadınlarımızın başarısı' ifadesinin vurgulanması, kadınların toplumdaki rollerinin ve başarılarının önemine dikkat çekmek, kadınların güçlenmesinin etkin vatandaşlık ve toplumsal gelişme için kritik olduğunu vurgulamak amacıyla yapılmıştır.",Nedensel,33
Bu metnin amacı nedir?,"Bu metnin amacı, etkin vatandaşlık kavramını demokrasi, anayasal güvenceler ve kadınların başarıları gibi temel unsurlarla ilişkilendirerek, vatandaşlık bilincini artırmak ve toplumsal farkındalık yaratmaktır.",Analitik,33
Etkin vatandaşlığın temel unsurları nelerdir?,"Bu metne göre etkin vatandaşlığın temel unsurları demokrasiye sahip çıkmak, anayasal hakların bilincinde olmak ve kadınların başarılarını desteklemektir.",Listeleme,33
Anayasal güvencelerin vatandaşlar için önemi nedir?,"Anayasal güvenceler, vatandaşların hak ve özgürlüklerinin devlet tarafından korunmasını sağlar, keyfi uygulamaları engeller ve hukuk devletinin işlemesine katkıda bulunur.",Kavramsal,33
Kadınların başarısının etkin vatandaşlıkla nasıl bir ilişkisi vardır?,"Kadınların başarısı, toplumun genel refahını artırır, farklı bakış açılarının temsilini sağlar ve daha kapsayıcı bir toplumun oluşmasına katkıda bulunur. Bu nedenle, kadınların başarısı etkin vatandaşlığın önemli bir parçasıdır.",Nedensel,33
"Demokrasi, anayasal güvenceler ve kadınların başarısı arasındaki ilişkiyi açıklayın.","Demokrasi, anayasal güvencelerle desteklenerek vatandaşların haklarını korur ve kadınların toplumsal hayata eşit katılımını teşvik eder. Kadınların başarısı ise demokratik değerlerin güçlenmesine ve toplumun ilerlemesine katkıda bulunur.",Analitik,33
Bu metinde etkin vatandaşlık kavramı hangi bağlamda ele alınmıştır?,"Bu metinde etkin vatandaşlık kavramı, demokratik değerlere bağlılık, anayasal hakların korunması ve kadınların toplumsal hayattaki rollerinin güçlendirilmesi bağlamında ele alınmıştır.",Bağlamsal,33
Bu metinden çıkarılacak ana ders nedir?,"Bu metinden çıkarılacak ana ders, etkin vatandaşlığın, demokrasinin korunması, anayasal hakların bilinmesi ve kadınların desteklenmesi ile mümkün olduğudur.",Özetleme,33
"Demokrasi olmasaydı, anayasal güvencelerin durumu ne olurdu?","Demokrasi olmasaydı, anayasal güvencelerin etkinliği azalır, keyfi yönetimlerin ortaya çıkma olasılığı artar ve vatandaşların hakları yeterince korunamayabilirdi.",Varsayımsal,33
Etkin vatandaşlık bilincini artırmak için neler yapılabilir?,"Etkin vatandaşlık bilincini artırmak için eğitimler düzenlenebilir, sivil toplum kuruluşları desteklenebilir, medya aracılığıyla farkındalık kampanyaları yürütülebilir ve vatandaşların karar alma süreçlerine katılımı teşvik edilebilir.",Yöntemsel,33
Neden birisi etkin vatandaşlık kavramına katılmayabilir?,"Birisi, etkin vatandaşlık kavramına, bireysel özgürlüklerin kısıtlanabileceği, devletin müdahalesinin artabileceği veya farklı siyasi görüşlerin çatışabileceği endişesiyle katılmayabilir.",Spekülatif,33
"Bu metinde bahsedilen unsurların (demokrasi, anayasal güvence, kadınların başarısı) toplum üzerindeki etkileri nelerdir?","Bu unsurların toplum üzerindeki etkileri, daha adil, eşitlikçi, özgür ve refah seviyesi yüksek bir toplumun oluşmasıdır. Demokrasi katılımcılığı artırır, anayasal güvence adaleti sağlar ve kadınların başarısı toplumsal kalkınmaya katkıda bulunur.",Yansıtıcı,33
Bu ders hangi sınıf seviyesi için hazırlanmıştır?,Bu ders 6. sınıf seviyesi için hazırlanmıştır.,Olgusal,34
Dersin temel öğrenme alanı nedir?,Dersin temel öğrenme alanı Etkin Vatandaşlıktır.,Olgusal,34
Bu derste hangi konular işlenmektedir?,"Bu derste Demokrasi Bizim İçin, Anayasal Güvencedeyiz ve Kadınlarımızın Başarısı konuları işlenmektedir.",Olgusal,34
SB.6.6.4 kazanımı neyi ifade etmektedir?,"SB.6.6.4 kazanımı, öğrencilerin toplumsal hayatta demokrasinin önemini açıklamasını ifade etmektedir.",Olgusal,34
