question,answer,question_type,page
15 Temmuz Demokrasi ve Milli Birlik Günü bu ders kapsamında neden ele alınır?,"15 Temmuz Demokrasi ve Milli Birlik Günü, SB.6.6.4 kazanımının işlenmesi sırasında demokrasinin önemini vurgulamak amacıyla ele alınır.",Nedensel,34
SB.6.6.5 kazanımı öğrencilere neyi öğretmeyi amaçlar?,"SB.6.6.5 kazanımı, öğrencilere Türkiye Cumhuriyeti’nin etkin bir vatandaşı olarak hak ve sorumluluklarının anayasal güvence altında olduğunu öğretmeyi amaçlar.",Kavramsal,34
SB.6.6.6 kazanımı hangi temele dayanmaktadır?,"SB.6.6.6 kazanımı, Türk tarihinden ve güncel örneklerden yola çıkarak toplumsal hayatta kadına verilen değeri fark etme temeline dayanmaktadır.",Bağlamsal,34
Pozitif ayrımcılık kavramı bu derste nasıl ele alınır?,"Pozitif ayrımcılık, ekonomik, siyasal ve toplumsal temsil gibi olumlu yönleriyle ele alınırken, kadına şiddet ve cinsiyet ayrımcılığı gibi olumsuz konular üzerinde de durulur.",Analitik,34
Öğrencilerin derse hazırlık aşamasında Eba TV'nin rolü nedir?,Öğrenciler konuları Eba TV üzerinden izleyerek derse hazırlanabilirler.,Yöntemsel,34
Dersin başında yer alan 'DÜŞÜNELİM–CEVAPLAYALIM' sorusunun amacı nedir?,"Dersin başında yer alan 'DÜŞÜNELİM–CEVAPLAYALIM' sorusunun amacı, öğrencilerin konu ile ilgili düşüncelerini almak ve ardından konu özetini kısaca açıklamaktır.",Kavramsal,34
"Ek-1, Ek-2 ve Ek-3'te verilen çalışma kağıtları derste nasıl kullanılır?","Ek-1, Ek-2 ve Ek-3'te verilen çalışma kağıtlarındaki etkinlikler çoğaltılarak öğrencilere dağıtılır ve öğrencilerin soruları cevaplamaları istenir. Öğrencilerin cevapları sınıfça değerlendirilir.",Yöntemsel,34
Ek-4'te verilen araştırma konusunun amacı nedir?,"Ek-4'te verilen araştırma konusunun amacı, öğrencilerin gelecek derse kadar araştırma yapmalarını sağlamaktır.",Kavramsal,34
Toplumsal hayatta kadına verilen değerin fark edilmesi neden önemlidir?,"Toplumsal hayatta kadına verilen değerin fark edilmesi, eşitlik ilkesinin güçlenmesine, toplumsal refahın artmasına ve daha adil bir toplumun oluşmasına katkı sağlar.",Yansıtıcı,34
Anayasal güvencelerin vatandaşlar için önemi nedir?,"Anayasal güvenceler, vatandaşların hak ve özgürlüklerinin devlet tarafından korunmasını sağlayarak, hukuk devletinin temelini oluşturur ve keyfi uygulamaların önüne geçer.",Kavramsal,34
Demokrasinin toplumsal hayattaki önemini açıklayınız.,"Demokrasi, bireylerin yönetime katılmasını, farklı görüşlerin ifade edilmesini ve çoğulculuğun sağlanmasını mümkün kılarak toplumsal barış ve istikrarın korunmasına katkıda bulunur.",Kavramsal,34
Demokrasi hangi ilkelerle hareket eder?,"Demokrasi, eşitlik, düşünce özgürlüğü, çoğulculuk ve katılımcılık ilkeleriyle hareket eder.",Olgusal,35
Demokrasinin toplum için önemi nedir?,"Demokrasi, toplumun huzurlu, mutlu ve güven içerisinde yaşamasının teminatıdır.",Kavramsal,35
Günlük hayatta karşılaştığımız demokratik davranışlara örnekler nelerdir?,"Ailede alınacak bir kararda fikrimizin sorulması, okuldaki sınıf başkanı seçimi, çalışma hayatında fikirlerimizin önemsenmesi ve bir sivil toplum kuruluşunda görev almamız demokratik davranışlara örnektir.",Listeleme,35
Vatandaşlar yönetimde nasıl söz sahibi olabilirler?,"Vatandaşlar, anayasa ve yasalara uygun şekilde seçimlerde oy kullanarak ve siyasi partiler aracılığıyla yönetimde söz sahibi olabilirler.",Yöntemsel,35
15 Temmuz Demokrasi ve Milli Birlik Günü neden kutlanır?,"15 Temmuz Demokrasi ve Milli Birlik Günü, Türk milletinin 15 Temmuz 2016 tarihinde demokratik yollarla seçilmiş yöneticileri görevden almak isteyen darbecilere karşı direnerek zafer kazanması nedeniyle kutlanır.",Nedensel,35
Haklarımızı ve sorumluluklarımızı kullanabilmemiz için ne gereklidir?,"Haklarımızı ve sorumluluklarımızı kullanabilmemiz için, insan olduğumuz için doğuştan kazandığımız hak ve özgürlüklerimizin anayasa ile koruma altına alınmış olması gereklidir.",Kavramsal,35
Anayasal güvence ne anlama gelir?,"Anayasal güvence, hak ve özgürlüklerimizin devlet tarafından anayasa ile korunması ve bu hakların sınırlandırılamaması anlamına gelir.",Olgusal,35
Devletin demokrasi anlayışı olan ülkelerde vatandaşlardan beklentileri nelerdir?,"Devletin demokrasi anlayışı olan ülkelerde vatandaşlardan beklentisi, Anayasa’da belirtildiği şekilde sorumluluklarını yerine getirmeleridir.",Bağlamsal,35
Yaşama hakkı anayasada nasıl güvence altına alınmıştır?,"Yaşama hakkı, Anayasa'nın 17. Maddesinde “Kişinin dokunulmazlığı, maddî ve manevî varlığı” başlığı altında insanların vücut bütünlüğüne dokunulamayacağı ve zarar verilemeyeceği, yaşama hakkının engellenemeyeceği belirtilerek anayasal güvence altına alınmıştır.",Olgusal,35
Sağlık ve çevre hakkı hangi anayasa maddesinde yer alır?,"Sağlık ve çevre hakkı, Anayasa’nın 56. Maddesinde yer alır.",Olgusal,35
Demokratik bir toplumda bireylerin birbirlerine karşı sorumlulukları nelerdir?,"Demokratik bir toplumda bireylerin birbirlerine karşı sorumlulukları, birbirlerinin hak ve sorumluluklarına saygı duymaktır.",Kavramsal,35
Anayasada belirtilen haklarımızdan bazıları nelerdir?,Anayasada belirtilen haklarımızdan bazıları yaşama hakkı ve sağlık ve çevre hakkıdır.,Listeleme,35
"15 Temmuz darbe girişimi başarılı olsaydı, Türkiye'deki demokrasi nasıl etkilenirdi?","15 Temmuz darbe girişimi başarılı olsaydı, Türkiye'deki demokrasi büyük bir darbe alırdı ve demokratik hak ve özgürlükler kısıtlanabilirdi.",Varsayımsal,35
Demokrasiyi benimsememiş bir yönetim şekli toplumsal hayata nasıl bir etki ederdi?,"Demokrasiyi benimsememiş bir yönetim şekli toplumsal hayatta huzursuzluğa, eşitsizliğe ve güvensizliğe neden olabilirdi.",Yansıtıcı,35
Anayasa'nın 17. maddesi neden önemlidir?,"Anayasa'nın 17. maddesi, bireylerin en temel hakkı olan yaşama hakkını ve vücut bütünlüğünü güvence altına aldığı için önemlidir.",Analitik,35
Anayasa'nın 56. maddesine göre devletin ve vatandaşların çevreyi koruma görevi nedir?,"Devletin ve vatandaşların görevi çevreyi geliştirmek, çevre sağlığını korumak ve çevre kirlenmesini önlemektir.",Olgusal,36
Eğitim hakkı hangi anayasa maddesinde düzenlenmiştir ve bu maddeye göre eğitim faaliyetleri nasıl olmalıdır?,Eğitim hakkı Anayasa’nın 42. Maddesinde düzenlenmiştir. Bu maddeye göre eğitim faaliyetleri kanuna uygun olmalı ve hiç kimse eğitim ve öğrenim hakkından mahrum bırakılmamalıdır.,Olgusal,36
Seçme ve seçilme hakkı Anayasa'da nasıl belirlenmiştir?,"Anayasa’nın 42. Maddesinde vatandaşların, kanuna uygun olarak seçme, seçilme ve siyasi partide görev alma, siyasi faaliyette bulunma ve oy kullanma hakları anayasa ile belirlenmiştir.",Olgusal,36
Konut dokunulmazlığı hakkı ne anlama gelir ve hangi koşullarda bu hakka müdahale edilebilir?,"Konut dokunulmazlığı hakkı, Anayasa’nın 21. Maddesine göre hukuki sebebe bağlı hakim kararı olmadıkça hiç kimsenin konutuna dokunulamayacağı ve girilemeyeceği anlamına gelir.",Kavramsal,36
Kanunlara uymak neden önemlidir?,"Kanunlara uymak toplumda düzenin sağlanması, hakların ve özgürlüklerin yaşanabilmesi ve adaletin uygulanabilmesi için gereklidir.",Nedensel,36
Vergi vermenin vatandaşlık sorumluluğu olarak önemi nedir?,"Vergi vermek, devletin okul, hastane, güvenlik gibi kamu hizmetlerinin yürütülmesini sağlar.",Kavramsal,36
Askerlik yapmak kimlerin görevidir ve hangi kanuna göre belirlenir?,"Askerlik yapmak, vatandaşlık sorumluluklarımızdan olup, Askerlik Kanunu’na göre belirlenen şartlara uygun olarak erkek Türk vatandaşlarının görevidir.",Olgusal,36
Oy kullanmanın demokrasiye katkısı nedir?,"Oy kullanmak, ülkemizde millî egemenlik ve demokrasi ilkesinin gelişmesine katkı sağlar.",Yansıtıcı,36
Kadınların Türk tarihindeki rolü nasıldı?,"Türk tarihinde kadın erkek ayrımı yapılmaksızın kadınlar yönetimlerde görev almış, askerlik hizmeti yapmış, spor faaliyetleri ve çeşitli mesleklerde başarılar elde etmiştir.",Bağlamsal,36
İlk Türk devletlerinde hükümdar eşlerine ne denilirdi ve bu durum kadınların rolüne dair ne gösterir?,"İlk Türk devletlerinde hükümdar eşlerine “Hatun” denilmekteydi. Bu, kadınların yönetimde önemli bir role sahip olduğunu gösterir.",Analitik,36
Anayasamızda belirtilen vatandaşlık sorumlulukları nelerdir?,"Anayasamızda belirtilen vatandaşlık sorumlulukları arasında kanunlara uymak, vergi vermek, askerlik yapmak ve oy kullanmak yer almaktadır.",Listeleme,36
Vatandaşlık sorumluluklarını yerine getirmenin toplum üzerindeki olumlu etkileri nelerdir?,"Vatandaşlık sorumluluklarını yerine getirmek, toplumun sağlıklı, huzurlu ve mutlu bir hayat sürmesine katkıda bulunur.",Yansıtıcı,36
Türkiye'de 18 yaşını doldurmuş her vatandaşın oy kullanmasının önemi nedir?,"18 yaşını doldurmuş her vatandaşın oy kullanması, ülkemizde milli egemenlik ve demokrasi ilkesinin gelişmesini sağlar.",Kavramsal,36
Kadınlara yönelik olumlu davranışlara örnekler neler olabilir?,"Kadınlara yönelik olumlu davranışlara örnek olarak, onlara saygı duymak, eşit fırsatlar sunmak ve toplumsal hayata katılımlarını desteklemek sayılabilir.",Spekülatif,36
Anayasa'nın 56. maddesi neden önemlidir?,"Anayasa'nın 56. maddesi, sağlıklı ve dengeli bir çevrede yaşama hakkını güvence altına alarak çevrenin korunmasının önemini vurguladığı için önemlidir.",Kavramsal,36
Osmanlı döneminde sosyal hayatta yapılan halka faydalı eserlerden bazıları nelerdir?,"Osmanlı döneminde sosyal hayatta cami, han, hamam, çeşme ve hastane gibi halka faydalı birçok eser yapılmıştır.",Olgusal,37
Cumhuriyet döneminde kadınların sahip olduğu haklardan bazıları nelerdir?,"Cumhuriyet döneminde kadınlar eğitimde eşit haklara sahip olma, miras hakkı, hukuki eşitlik, çalışma hakkında eşitlik ve yönetimlerde görev alma gibi haklara sahip olmuşlardır.",Olgusal,37
Pozitif ayrımcılık nedir ve kadınlara hangi alanlarda fayda sağlamaktadır?,"Pozitif ayrımcılık, kadınların toplumsal hayatta daha çok görev alması için verilen çeşitli haklardır. İş hayatında çocuk bakımı için izinler, atamalarda ve siyasi partilerde kontenjan ayrılması, erkeklerden daha kısa çalışma süresinde emekli olabilme gibi faydalar sağlamaktadır.",Kavramsal,37
Kurtuluş Savaşı döneminde kadınların rolü neydi?,Kurtuluş Savaşı döneminde kadınlar cephede ve cephe gerisinde asker olarak görev yapmışlardır. Kara Fatma ve Şerife Bacı gibi kahramanlar bu döneme örnektir.,Bağlamsal,37
Kadınlara yönelik olumsuz durumlardan bazıları nelerdir?,"Kadınlara yönelik olumsuz durumlar arasında kadına şiddet ve cinsiyet ayrımcılığı bulunmaktadır. Kadınlar baskı, fiziksel ve ruhsal şiddete maruz kalma ve haklarının kısıtlanması gibi durumlarla karşılaşabilmektedir.",Olgusal,37
Kanunlar kadınları korumaya yönelik ne gibi tedbirler almaktadır?,Kanunlar kadınları korumaya yönelik tedbirler almakta ve şiddet gibi durumlarda suçlulara hukuki yaptırımlar uygulanmaktadır.,Yöntemsel,37
Kadınların sosyal alandaki faaliyetleri Osmanlı döneminde nasıldı?,"Osmanlı döneminde kadınlar sosyal alanda at biner, ok atar ve ekonomik faaliyetlere katılırlardı.",Bağlamsal,37
Pozitif ayrımcılığın amacı nedir?,"Pozitif ayrımcılığın amacı, kadınların toplumsal hayatta daha fazla rol almasını sağlamaktır.",Nedensel,37
Kadınlara yönelik şiddetin sonuçları neler olabilir?,"Kadınlara yönelik şiddetin sonuçları arasında fiziksel ve ruhsal sağlık sorunları, travma ve sosyal izolasyon yer alabilir.",Yansıtıcı,37
Cumhuriyetin ilanı kadınların haklarını nasıl etkilemiştir?,"Cumhuriyetin ilanıyla birlikte kadınlar eğitim, miras, hukuk, çalışma hayatı ve yönetimde görev alma gibi birçok alanda eşit haklara sahip olmuşlardır.",Analitik,37
Kadınlara kontenjan ayrılmasının gerekçesi nedir?,"Kadınlara kontenjan ayrılmasının gerekçesi, kadınların siyasi ve sosyal hayatta daha fazla temsil edilmesini sağlamaktır.",Nedensel,37
"Eğer kadınlara yönelik şiddet artarsa, toplum üzerindeki etkileri neler olabilir?","Eğer kadınlara yönelik şiddet artarsa, toplumda güvensizlik, eşitsizlik ve sosyal huzursuzluk artabilir.",Varsayımsal,37
Kadınların çalışma hayatında erkeklerden daha kısa sürede emekli olabilmesi ne gibi faydalar sağlar?,"Kadınların çalışma hayatında erkeklerden daha kısa sürede emekli olabilmesi, kadınların daha erken yaşta dinlenmelerine ve ailelerine daha fazla zaman ayırmalarına olanak sağlar.",Yansıtıcı,37
Şerife Bacı ve Kara Fatma'nın Kurtuluş Savaşı'ndaki rolleri nelerdi?,"Şerife Bacı ve Kara Fatma, Kurtuluş Savaşı'nda cephede ve cephe gerisinde kahramanca mücadele ederek önemli roller üstlenmişlerdir.",Olgusal,37
Kadınların toplumda karşılaştığı cinsiyet ayrımcılığına karşı neler yapılabilir?,"Kadınların toplumda karşılaştığı cinsiyet ayrımcılığına karşı eğitim yoluyla bilinçlendirme çalışmaları yapılabilir, yasal düzenlemelerle eşitlik sağlanabilir ve toplumsal farkındalık kampanyaları düzenlenebilir.",Yöntemsel,37
Yönetimde demokrasi anlayışı olmazsa ne gibi sorunlarla karşılaşılabilir?,"Yönetimde demokrasi anlayışı olmazsa, halkın istek ve ihtiyaçları göz ardı edilebilir, farklı görüşler susturulabilir, adaletsizlikler artabilir ve toplumda huzursuzluklar yaşanabilir.",Olgusal,38
15 Temmuz Demokrasi ve Millî Birlik Günü'nün önemi nedir?,"15 Temmuz Demokrasi ve Millî Birlik Günü, Türk milletinin demokrasiye olan bağlılığını ve darbe girişimine karşı gösterdiği direnişi simgelemektedir. Bu gün, demokrasinin korunmasının ve milli birliğin öneminin vurgulanması açısından önemlidir.",Kavramsal,38
Toplum hayatında günlük hayatımızdaki demokrasi anlayışının önemine örnek olarak aşağıdakilerden hangisi verilemez: A) Fikir ve düşüncelerimizin sorulması B) Sınıf başkanı veya öğrenci temsilcilerini öğretmenin seçebilmesi C) Vatandaşların siyasi partilere katılarak yönetime gelebilmesi D) Yasalar sayesinde insanların haklara sahip olmaları,B) Sınıf başkanı veya öğrenci temsilcilerini öğretmenin seçebilmesi,Analitik,38
Demokratik yönetimlerde halk yönetime katılma hakkını yalnızca seçimlerde mi kullanır?,"Hayır, demokratik yönetimlerde halk yönetime katılma hakkını yalnızca seçimlerde değil, aynı zamanda sivil toplum kuruluşları aracılığıyla, referandumlarla, dilekçe hakkını kullanarak ve kamuoyu oluşturarak da kullanır.",Olgusal,38
Yeni otomobil alacak bir ailenin çocuklarına fikrini sorması demokratik bir davranış mıdır?,"Evet, yeni otomobil alacak bir ailenin çocuklarına fikrini sorması demokratik bir davranıştır. Çünkü bu, aile içinde farklı görüşlere değer verildiğini ve ortak kararlar alınmaya çalışıldığını gösterir.",Kavramsal,38
15 Temmuz 2016 günü darbe girişimine karşı Türk milletinin karşı çıkması neyin göstergesidir?,"15 Temmuz 2016 günü darbe girişimine karşı Türk milletinin karşı çıkması, halkımızın demokrasi bilincine sahip olduğunun ve demokrasiyi koruma kararlılığının bir göstergesidir.",Yansıtıcı,38
İnsanların başkalarının inançlarına gösterdiği anlayışa ne denir?,İnsanların başkalarının inançlarına gösterdiği anlayışa saygı denir.,Olgusal,38
Vatandaşların yönetimde söz sahibi olmak için bir araya gelerek oluşturduğu kuruluşa ne denir?,Vatandaşların yönetimde söz sahibi olmak için bir araya gelerek oluşturduğu kuruluşa siyasi parti denir.,Olgusal,38
Halkın egemenliğinin esas olduğu yönetim biçimine ne denir?,Halkın egemenliğinin esas olduğu yönetim biçimine demokrasi denir.,Olgusal,38
Demokrasi kavramı hangi bağlamda önemlidir?,"Demokrasi kavramı, bireylerin özgürce düşüncelerini ifade edebildiği, haklarının korunduğu ve yönetime katılma imkanı bulabildiği bir toplum düzeni oluşturma bağlamında önemlidir.",Bağlamsal,38
Demokrasinin temel unsurları nelerdir?,"Demokrasinin temel unsurları arasında halk egemenliği, serbest seçimler, siyasi partilerin varlığı, kuvvetler ayrılığı, hukukun üstünlüğü ve insan haklarına saygı yer alır.",Listeleme,38
Türkiye'de demokrasinin önemi nedir?,"Türkiye'de demokrasinin önemi, ülkenin istikrarı, vatandaşların refahı ve uluslararası ilişkilerde saygın bir konuma sahip olması açısından büyüktür. Demokrasi, farklı görüşlerin bir arada yaşamasını ve uzlaşma kültürünün gelişmesini sağlar.",Kavramsal,38
Demokrasi bilincine sahip olmak neden önemlidir?,"Demokrasi bilincine sahip olmak, vatandaşların haklarını ve sorumluluklarını bilerek ülkenin yönetimine aktif olarak katılmasını sağlar. Ayrıca, hoşgörüyü, farklılıklara saygıyı ve ortak değerlere bağlılığı güçlendirir.",Nedensel,38
"Bir ülkede demokrasinin olmadığını varsayarsak, bu durumun olası sonuçları neler olabilir?","Bir ülkede demokrasinin olmaması durumunda, insan hakları ihlalleri artabilir, ekonomik eşitsizlikler derinleşebilir, siyasi istikrarsızlıklar yaşanabilir ve uluslararası alanda yalnızlaşma görülebilir.",Varsayımsal,38
Demokrasi ve hukuk arasındaki ilişkiyi özetleyiniz.,"Demokrasi ve hukuk arasında güçlü bir ilişki vardır. Hukuk, demokrasinin temelini oluşturur ve vatandaşların haklarını güvence altına alır. Demokratik yönetimlerde yasalar, halkın iradesini yansıtır ve herkes için eşit uygulanır.",Özetleme,38
Vatandaşların devlete karşı olan sorumluluklarını yerine getirmesinin amaçları nelerdir?,"Vatandaşların sorumluluklarını yerine getirmesinin amacı, devletin düzenli işlemesini sağlamak, toplumun refahını artırmak ve ortak yaşamı kolaylaştırmaktır.",Olgusal,39
Hak ve sorumluluklarımızın anayasal olarak korunmasının nedenleri nelerdir?,"Hak ve sorumlulukların anayasal olarak korunmasının nedeni, bireylerin özgürlüklerini güvence altına almak, devletin keyfi uygulamalarını engellemek ve toplumda adaleti sağlamaktır.",Kavramsal,39
Anayasa'nın 17. maddesi neyi ifade etmektedir?,"Anayasa'nın 17. maddesi, herkesin yaşama, maddi ve manevi varlığını koruma ve geliştirme hakkına sahip olduğunu ifade etmektedir.",Olgusal,39
Anayasa'nın 25. maddesi hangi özgürlüğü güvence altına alır?,"Anayasa'nın 25. maddesi, herkesin düşünce ve kanaat hürriyetine sahip olma özgürlüğünü güvence altına alır.",Olgusal,39
Anayasa'nın 42. maddesi neyi belirtir?,"Anayasa'nın 42. maddesi, kimsenin eğitim ve öğrenim hakkından yoksun bırakılamayacağını belirtir.",Olgusal,39
Anayasa'nın 73. maddesine göre vatandaşların yükümlülüğü nedir?,"Anayasa'nın 73. maddesine göre, her vatandaş kamu giderlerini karşılamak üzere mali gücüne göre vergi ödemekle yükümlüdür.",Olgusal,39
"Temel hak ve özgürlükler kısıtlanabilir mi? Kısıtlanabilirse, hangi durumlarda?","Temel hak ve özgürlükler sınırsız değildir; ancak, yalnızca kanunla ve demokratik toplum düzeninin gerekleri ile orantılı olarak kısıtlanabilir.",Analitik,39
Anayasada belirtilen temel hak ve özgürlüklerin korunması kimin görevidir?,Anayasada belirtilen temel hak ve özgürlüklerin korunması devletin görevidir.,Olgusal,39
Temiz bir çevrede yaşamak bir hak mı yoksa sorumluluk mudur?,Temiz bir çevrede yaşamak hem bir hak hem de bir sorumluluktur. Vatandaşlar olarak çevreyi korumak sorumluluğumuzdur.,Kavramsal,39
Yasalarda belirtilen ve yerine getirmemiz gereken görevlere ne ad verilir?,Yasalarda belirtilen ve yerine getirmemiz gereken görevlere sorumluluk denir.,Olgusal,39
Vatandaşların haklarını ve sorumluluklarını bildiren yasaya ne denir?,Vatandaşların haklarını ve sorumluluklarını bildiren yasaya anayasa denir.,Olgusal,39
İnsanların doğuştan kazandığı ve hayatın devamı için gerekli ayrıcalıklara ne denir?,İnsanların doğuştan kazandığı ve hayatın devamı için gerekli ayrıcalıklara hak denir.,Olgusal,39
Hak ve sorumluluklarımızın yasa ile güvence altında olmasının önemi nedir?,"Hak ve sorumluluklarımızın yasa ile güvence altında olması, bireylerin keyfi uygulamalara karşı korunmasını ve adil bir toplum düzeninin sağlanmasını destekler.",Kavramsal,39
Vergi ödeme yükümlülüğünün amacı nedir?,"Vergi ödeme yükümlülüğünün amacı, devletin kamu hizmetlerini finanse etmesini sağlamak ve toplumun ortak ihtiyaçlarını karşılamaktır.",Kavramsal,39
Anayasa'nın bireylerin hak ve özgürlüklerini koruma amacı güttüğü söylenebilir mi? Neden?,"Evet, anayasa bireylerin hak ve özgürlüklerini koruma amacı güder. Çünkü anayasa, devletin yetkilerini sınırlar ve bireylerin temel haklarını güvence altına alır.",Analitik,39
Türk tarihinde kadınların başarılarına örnekler nelerdir?,"Metinde Türk tarihindeki kadınların başarılarına dair doğrudan örnekler verilmemiştir. Ancak, kadınların cami ve imarethane gibi yapıtlar inşa etmesi, yönetici eşlerinin karar alma süreçlerine katılması, seçme ve seçilme hakkını kazanması ve Kurtuluş Savaşı'nda cephede ve cephe gerisinde mücadele etmeleri örnek olarak gösterilebilir.",Olgusal,40
Pozitif ayrımcılık nedir ve günümüzde kadınlarla ilgili nasıl bir örneği vardır?,"Pozitif ayrımcılık, toplumda dezavantajlı durumda olan gruplara (bu durumda kadınlara) çeşitli ayrıcalıklar tanıyarak onları desteklemektir. Günümüzde kadınlara yönelik pozitif ayrımcılık örnekleri arasında, işe alımlarda veya eğitim burslarında kadınlara öncelik tanınması sayılabilir.",Kavramsal,40
Toplumsal temsil ne anlama gelir ve kadınlarla ilgili güncel bir örneği nedir?,"Toplumsal temsil, kadınların toplumun çeşitli alanlarında (siyaset, iş dünyası, eğitim vb.) eşit ve adil bir şekilde temsil edilmesini ifade eder. Güncel bir örnek olarak, mecliste kadın milletvekili sayısının artırılması veya şirket yönetim kurullarında kadın yöneticilerin bulunması gösterilebilir.",Kavramsal,40
Cinsiyet ayrımcılığı nedir ve günümüzde kadınlarla ilgili bir örneği nedir?,"Cinsiyet ayrımcılığı, bir kişinin cinsiyeti nedeniyle ayrımcılığa uğraması, bazı haklardan mahrum bırakılmasıdır. Günümüzde kadınlarla ilgili bir örnek olarak, aynı işi yapan kadın ve erkek çalışanlara farklı ücret ödenmesi veya kadınların belirli mesleklerde çalışmasının engellenmesi sayılabilir.",Kavramsal,40
Türk tarihindeki kadınların başarılarına dair verilen örneklerin kronolojik sıralaması nasıldır?,"Metinde verilen örneklerin kronolojik sıralaması şu şekildedir: I. Kadınlar tarafından cami, imarethane gibi yapıtların ilk kez yapılması, II. Yönetici eşleri hatunların karar alma sürecine katılması, IV. Kurtuluş savaşı sürecinde cephede ve cephe gerisinde mücadele etmeleri, III. Seçme ve Seçilme hakkının kazanılması. Bu sıralama B seçeneğinde (II – I – IV – III) doğru olarak verilmiştir.",Analitik,40
Türk tarihinde kadınlara yönetimde söz hakkı verilmesi ilk kez ne zaman gerçekleşmiştir?,"Metinde Türk tarihinde kadınlara yönetimde söz hakkı verilmesinin ilk kez Cumhuriyet döneminde gerçekleştiği belirtilmiştir. Ancak, bu ifadenin yanlış olduğu, kadınların daha önceki dönemlerde de yönetimde söz sahibi olduğu belirtilmelidir.",Olgusal,40
Kadınların toplumsal hayatta etkin olması ne ile korunmaktadır?,Kadınların toplumsal hayatta etkin olması anayasa ile korunmaktadır.,Olgusal,40
Kadınlara pozitif ayrımcılık yapılması olumlu mu yoksa olumsuz bir davranış mıdır?,"Kadınlara pozitif ayrımcılık yapılması olumlu bir davranıştır. Amaç, kadınların toplumdaki dezavantajlı durumunu telafi etmek ve eşit fırsatlara sahip olmalarını sağlamaktır.",Kavramsal,40
Pozitif ayrımcılık kavramı ne anlama gelir?,"Pozitif ayrımcılık, toplumda çeşitli ayrıcalıklar tanıyarak dezavantajlı grupları desteklemektir.",Kavramsal,40
Kadınların yönetimde görev almasına ne ad verilir?,Kadınların yönetimde görev almasına siyasal temsil denir.,Olgusal,40
Toplumsal hayatta kadın olduğundan dolayı bazı haklardan mahrum bırakılmaya ne denir?,Toplumsal hayatta kadın olduğundan dolayı bazı haklardan mahrum bırakılmaya cinsiyet ayrımcılığı denir.,Olgusal,40
"Eğer kadınlara pozitif ayrımcılık yapılmasaydı, toplumda ne gibi sonuçlar ortaya çıkabilirdi?","Eğer kadınlara pozitif ayrımcılık yapılmasaydı, kadınların toplumsal hayatta eşit fırsatlara sahip olması zorlaşır, toplumsal cinsiyet eşitsizliği daha da derinleşebilirdi.",Varsayımsal,40
Cinsiyet ayrımcılığının toplum üzerindeki etkileri nelerdir?,"Cinsiyet ayrımcılığı, kadınların potansiyelini tam olarak kullanmasını engelleyerek toplumsal gelişimi yavaşlatır, ekonomik kayıplara neden olur ve toplumsal huzursuzluğa yol açabilir.",Yansıtıcı,40
